642,RepMcNerney,Veterans with traumatic brain injuries TBIs can have constant pain amp reduced cognitive function I wrote the law to improve care for service members with TBIs amp am disgusted the president would trivialize these severe injuries Our troops deserve better,-0.16666666666666666,"['veterans', 'traumatic brain injuries', 'tbis', 'constant pain amp', 'cognitive function', 'service members', 'tbis', 'severe injuries', 'troops deserve']"
643,RepMcNerney,This sham trial proves that the GOP is officially the party of Trump Both House and Senate Republicans have shown that they are governed by the fear of crossing their leader rather than the oath they swore to uphold This is a sad statement about the future of our democracy,-0.1,"['sham trial proves', 'trump', 'sad statement']"
644,RepMcNerney,Looking forward to seeing everyone at my open house in Stockton tonight Stop by my office between 6 00 PM 7 30 PM for an update on what s happening in Washington and a discussion about the important issues impacting our nation,0.2,"['looking', 'open house', 'stockton', 'stop', 'pm', 'pm', 'washington', 'important issues']"
645,RepJoshHarder,Got some great news today the officially endorsed my bill to extend health care coverage to veterans suffering from additional Agent Orange diseases Pushing hard to get this across the finish line,0.25416666666666665,"['got', 'great news', 'health care coverage', 'agent orange', 'pushing', 'finish line']"
646,RepJoshHarder,This Administration s travel ban will go down as a shameful part of our history I stand with our Assyrian and other refugee communities in calling for it to end NOW,-0.14027777777777778,"['administration s travel ban', 'shameful part', 'assyrian', 'refugee communities', 'now']"
647,RepJoshHarder,Guess who s testifying in front of Congress today amp Time for us to get some answers,0.0,"['guess', 'congress', 'amp time']"
648,RepJoshHarder,IMPORTANT January 31 is the last day to enroll in 2020 health coverage be sure to sign up today,0.3,"['important january', 'health coverage']"
649,RepJoshHarder,Students who got scammed by sketchy colleges are now getting scammed by their Education Secretary Betsy DeVos is either incompetent corrupt or both,-0.425,"['sketchy colleges', 'education secretary', 'betsy devos']"
650,RepDeSaulnier, Creating good paying jobs Protecting our environment Building 21st century infrastructure Today u,0.35,"['creating', 'protecting', 'environment building', 'century infrastructure']"
651,RepDeSaulnier, says he is working on legislation to improve communication with patients in the health care system One w,0.0,['health care system']
652,RepDeSaulnier,Join us live for a conversation with on our nation s health care system As the founder of the Congressional Caucus of Cancer Survivors I will share my own experiences as a patient and a Member of Congress,0.36818181818181817,"['join', 'nation s health care system', 'caucus', 'cancer survivors', 'own experiences', 'member', 'congress']"
653,RepDeSaulnier,Statistics show that communities of color suffer more from lack of access to health care that would prevent pregnancy related deaths Today at we discussed the need for increased federal resources to support maternal and infant health,0.25,"['statistics', 'color suffer', 'health care', 'federal resources', 'support maternal', 'infant health']"
654,RepDeSaulnier, At CoveredCA there s financial help available so you can get quality health coverage for a lower cost People who have no,0.2,"['coveredca', 'financial help', 'quality health coverage', 'cost people']"
655,SpeakerPelosi,are MovingForward with a plan to create good paying jobs amp protect our environment while building an infrastructure made to last ForThePeople,0.35,"['movingforward', 'jobs amp', 'forthepeople']"
656,SpeakerPelosi, Creating good paying jobs Protecting our environment Building 21st century infrastructure Today u,0.35,"['creating', 'protecting', 'environment building', 'century infrastructure']"
657,SpeakerPelosi,promised to rebuild America with a ForThePeople infrastructure plan that creates good paying jobs amp protects the environment Today we re MovingForward Tune in here at 10 am ET,0.7,"['america', 'forthepeople', 'infrastructure plan', 'jobs amp protects', 'movingforward', 'et']"
658,SpeakerPelosi,The Supreme Court s decision to grant the Trump Admin more time to advance its cruel amp unlawful attacks on immigrants is a serious amp troubling departure from long standing judicial norms Read my full statement here,-0.10666666666666666,"['supreme court s decision', 'trump admin', 'cruel amp unlawful attacks', 'serious amp', 'judicial norms', 'read', 'full statement']"
659,SpeakerPelosi,Last week I led a bipartisan Congressional Delegation to Poland and Israel to commemorate 75 years since the liberation of Auschwitz It was an experience that will stay with my colleagues and I forever WeRemember,0.0,"['delegation', 'poland', 'israel', 'auschwitz', 'weremember']"
660,RepBarbaraLee,Trump s one sided so called peace plan is anything but It green lights annexation goes against decades of bipartisan US foreign policy and international law and conflicts with the principles laid out by Congress last year,-0.08125,"['trump', 'peace plan', 'green lights annexation', 'bipartisan us', 'foreign policy', 'international law', 'congress']"
661,RepBarbaraLee,President Trump wants to kick hundreds of thousands off SNAP by imposing bureaucratic barriers between people who are going hungry and the help they need HandsOffSNAP,0.2,"['trump', 'snap', 'bureaucratic barriers', 'handsoffsnap']"
662,RepBarbaraLee,I m presiding over the House Floor today as continue our important work to StopEndlessWar and say NoWarWithIran ForThePeople,0.4,"['floor', 'important work', 'stopendlesswar', 'nowarwithiran forthepeople']"
663,RepBarbaraLee,I m closely monitoring developments about the coronavirus and I m glad will begin screening passengers at SFO for symptoms The risk is still low for people in the East Bay but you can follow these guidelines to help keep you and your loved ones healthy,0.425,"['sfo', 'ones healthy']"
664,RepBarbaraLee,This just underscores the need for a fair and open trial in the Senate The American people deserve to hear the full facts of the case and that includes having witnesses testify and documents produced DefendOurDemocracy,0.26249999999999996,"['american people deserve', 'full facts', 'defendourdemocracy']"
665,RepSpeier,That s 50 people who have suffered serious debilitating injuries to protect our country amp who has belittled amp denigrated I hope my colleagues on the House Armed Serices Committee will help educate Trump,-0.3333333333333333,"['country amp', 'serices', 'trump']"
666,RepSpeier,Don t be fooled by s Ruse of the Century Green lighting any form of annexation without even talking to Palestinian leadership is a plan for conflict and oppression not peace We cannot be gas lit by two aspiring autocrats using a photo op as a political distraction,-0.1,"['don', 'ruse', 'palestinian', 'gas lit', 'photo op', 'political distraction']"
667,RepSpeier,Words of the 45th President of the United States You did a good job on her Grab em by the pussy I can do whatever I want Every woman in America should be outraged by these malevolent and misogynistic men attacking a professional for doing her job thisisnotnormal,-0.225,"['words', '45th president', 'good job', 'grab', 'america', 'misogynistic men', 'job thisisnotnormal']"
668,RepSpeier, White House Claim Founders opposed this sort of impeachment Reality Constitutional scholars testified If what we re ta,0.0,"['white house', 'claim founders', 'reality constitutional', 're ta']"
669,RepSpeier, White House claim Trump has been impeached over a policy disagreement Reality He created an irregular back channel for,0.0,"['white house claim', 'trump', 'policy disagreement', 'reality']"
670,RepSwalwell, Here s the video playing on the truck TrumpJury,0.0,['trumpjury']
671,RepSwalwell,Sat down with and to discuss their civic engagement project AStartingPoint I didn t miss the chance to pitch Captain America on his next blockbuster role Head to my insta story to see how that worked out for me,-0.07777777777777779,"['sat', 'civic engagement project', 'astartingpoint', 'didn t', 'pitch captain', 'america', 'blockbuster role', 'head', 'insta story']"
672,RepSwalwell,We are much better off now Three years ago we entered your hell This year we escape,0.5,[]
673,RepSwalwell,may be the Majority Leader in the Senate but he does not have the final say The American people have made it clear that a trial without witnesses and without evidence is no trial at all We must all remain vigilant and vocal to prevent a sham acquittal,-0.024999999999999998,"['majority', 'american people', 'sham acquittal']"
674,RepSwalwell,Every second we spend attacking Trump s lawyers is a second we aren t reminding people about their client the most corrupt president ever Who cares about his insignificant lawyers Trump is cheating and must be stopped impeachment,0.0,"['trump', 's lawyers', 'aren t', 'corrupt president', 'who', 'insignificant lawyers', 'trump']"
675,RepJimCosta,Last week I introduced the Expanding Medical Education Act to help combat that crisis providing funding to promote medical training in areas of high need with a focus on diverse and medically deprived communities,0.032,"['expanding', 'medical education act', 'medical training', 'high need']"
676,RepJimCosta,The U S is expected to face a massive shortfall of primary care doctors in the next 15 years with rural and low income communities expected to feel the brunt of this shortage,0.028571428571428577,"['massive shortfall', 'primary care', 'low income communities']"
677,RepJimCosta,I recently helped introduce legislation to expand drinking water access for disadvantaged communities and make vital repairs to our water infrastructure that will increase storage and supply,0.05,"['introduce legislation', 'water access', 'vital repairs', 'water infrastructure']"
678,RepJimCosta,Water is the lifeblood of our Valley At today s hearing I questioned one Bureau of Reclamation official about the lack of funding to address our water crisis,0.0,"['s hearing', 'reclamation', 'water crisis']"
679,RepJimCosta,HAPPENING NOW Water Oceans and Wildlife Subcommittee is holding a hearing on important legislation which I helped introduce to provide clean drinking water to under served communities and make repairs to infrastructure vital to water access in our Valley,0.2888888888888889,"['happening now', 'oceans', 'wildlife subcommittee', 'important legislation', 'water access']"
680,RepRoKhanna, On Thursday the House will vote on two crucial amendments The first from would prevent funding for an unauthoriz,0.125,['crucial amendments']
681,RepRoKhanna,Movements for social and racial justice are closely tied to so many faith traditions,0.26666666666666666,"['movements', 'racial justice', 'faith traditions']"
682,RepRoKhanna,Parents and family members shouldn t have to choose between a career and children Building a strong economy starts by supporting our families Proud to cosponsor the FAMILYAct to give American workers 12 weeks of paid leave,0.37083333333333335,"['family members shouldn t', 'children building', 'strong economy', 'proud', 'familyact', 'american workers']"
683,RepRoKhanna,A true peace plan would require engaging all sides in a negotiation The Trump plan undermines any two state solution to protect the rights amp safety of Israelis amp Palestinians,0.375,"['true peace plan', 'trump', 'plan undermines', 'state solution', 'rights amp safety', 'israelis', 'palestinians']"
684,RepRoKhanna,Our planet is worth fighting for I applaud the Amazon employees who have bravely taken a stand in support of a greener future,0.3666666666666667,['amazon']
685,RepAnnaEshoo,A happy and healthy LunarNewYear to all those celebrating,0.65,['lunarnewyear']
686,RepAnnaEshoo,Check out my interview with Michael Krasny on,0.0,['michael krasny']
687,RepAnnaEshoo,Today is the only federal holiday designated as a national day of service It is only appropriate that we honor Dr King by encouraging all Americans to volunteer to improve their communities Thank you to all the volunteers in San Jose today who embraced the spirit of Dr King,0.16666666666666666,"['federal holiday', 'national day', 'dr', 'thank', 'san jose', 'dr']"
688,RepAnnaEshoo, It s NationalBiotechnologyMonth We re using biotech for new space solutions is researching how to grow p,0.13636363636363635,"['nationalbiotechnologymonth', 'new space solutions']"
689,RepAnnaEshoo,has delivered on our ForThePeople agenda at every step The House passed over 400 bills last year More than 275 are bipartisan They re sitting on s desk Perhaps you two will go down as the laziest Senate Majority Leader and President in history,0.11481481481481481,"['forthepeople', 's desk', 'laziest senate', 'majority']"
690,RepZoeLofgren, The current state of the immigration court system is untenable gives opening remarks at the hearing on,0.0,"['current state', 'immigration court system']"
691,RepZoeLofgren,I ve worked on 3 impeachments in my life Nixon resigned in disgrace Clinton apologized to the nation amp repented Trump says his behavior was perfect keeps trying to cheat our elections amp says he has a right to abuse his power That s why we must DefendOurDemocracy,0.6428571428571428,"['nixon', 'clinton', 'nation amp', 'trump', 'elections amp', 'defendourdemocracy']"
692,RepZoeLofgren, TONIGHT s full EXCLUSIVE interview with and the three historic Hous,0.175,"['tonight', 'exclusive', 'hous']"
693,RepZoeLofgren, LOFGREN The Chief Justice of the United States is presiding over this trial If he signs a subpoena for a witness to come,0.0,['lofgren']
694,RepZoeLofgren, All over the world those living under oppressive regimes look to us They look to us because we have a rule of law B,0.0,"['oppressive regimes', 'law b']"
695,RepJimmyPanetta,The 2020Census is hiring is hosting a jobs fair 10am 5pm on Jan 31 at the Monterey Public Library on Pacific Street Online applications are also available at The census helps decide funding for our community s schools housing amp roads,0.3666666666666667,"['fair 10am 5pm', 'jan', 'monterey', 'public library', 'pacific street', 'online', 'community s schools', 'amp roads']"
696,RepJimmyPanetta, All working Americans will need access to PaidLeave at some point Passing the FAMILYAct would ensure all families will not ha,0.0,"['need access', 'paidleave', 'passing', 'familyact']"
697,RepJimmyPanetta,According to a 2018 survey of LGBTQ workers fewer than half of respondents reported their employer s policies cover new parents of all genders equally I highlighted how the FAMILY Act along with like policies will provide paid leave for all,-0.010101010101010102,"['according', 'lgbtq', 'employer s policies', 'new parents', 'family']"
698,RepJimmyPanetta,The Administration wants to weaken states ability to provide food assistance for thousands of Americans relying on the lifeline of SNAP or CalFresh in high unemployment areas The House filed an amicus brief to be a check on the Administration amp help our community members,0.12,"['states ability', 'food assistance', 'snap', 'calfresh', 'high unemployment areas', 'administration amp', 'community members']"
699,RepJimmyPanetta, Always important to integrate policy and infrastructure questions into the conversation of sustainable food Great to h,0.6000000000000001,"['infrastructure questions', 'sustainable food']"
700,RepTjCox,Tambi n hablamos sobre las importantes contribuciones de los j venes mexicoamericanos la importancia de proteger sus derechos con el programa DACA y c mo el nuevo acuerdo USMCA beneficiar a los agricultores y trabajadores agr colas en ambos lados de la frontera,0.0,"['tambi', 'n hablamos sobre las importantes contribuciones', 'los j venes mexicoamericanos', 'proteger sus derechos', 'con el programa', 'daca', 'y c mo el nuevo acuerdo', 'usmca', 'los agricultores y trabajadores agr colas', 'ambos lados']"
701,RepTjCox,Ayer me reun con la Emb Barcena de M xico en E E U U para hablar sobre las contribuciones de la comunidad mexicana en el Distrito 21 de California,0.0,"['ayer', 'emb barcena', 'm xico', 'e e u u', 'para hablar sobre las contribuciones', 'comunidad mexicana', 'distrito', 'california']"
702,RepTjCox,We also talked about the important contributions of young Mexican Americans the importance of protecting their rights with the DACA program and how the new USMCA will benefit farmers and agricultural workers on both sides of the border,0.1590909090909091,"['important contributions', 'daca', 'usmca', 'agricultural workers']"
703,RepTjCox,Yesterday I met with Amb Barcena from Mexico to the U S to speak about the contributions of the Mexican community in California s 21st District,0.0,"['yesterday', 'amb barcena', 'mexico', 'mexican community', 'california']"
704,RepTjCox,Thank you to EJ s Executive Director and s CEO Jason Philips for coming to DC from the Valley to testify in support of these key pieces of legislation,0.0,"['thank', 'ej', 's executive director', 'ceo jason philips', 'dc', 'key pieces']"
705,RepDevinNunes,ICYMI Be sure to read this op ed from my colleague highlighting s successful economic and trade agenda President Trump and s policies have produced a roaring economy,0.48333333333333334,"['icymi be', 'trade agenda president', 'trump', 's policies']"
706,RepDevinNunes,With USMCA s passage moving forward in the Senate secures another vital trade deal today with China Highlights include China s purchase of 200 billion of U S goods and promises to remedy issues like intellectual property theft,0.2,"['usmca', 's passage', 'senate secures', 'vital trade', 'china highlights', 'china', 's purchase', 's goods', 'intellectual property theft']"
707,RepDevinNunes,Catch my interview with from earlier today to hear my thoughts on the strike against Iran Quds Force commander Qassem Soleimani,0.0,"['iran quds', 'force commander', 'qassem soleimani']"
708,RepDevinNunes,After a year of delays the House has passed USMCA to help American workers and farmers Deepest thanks to and for fighting to get this vital deal to the finish line,0.10000000000000002,"['usmca', 'american workers', 'deepest', 'finish line']"
709,RepDevinNunes,Lower taxes higher wages and greater investment in our economy The Tax Cuts and Jobs Act has been a roaring success,0.35000000000000003,"['lower', 'cuts', 'jobs']"
710,GOPLeader, Signed sealed delivered Today President puts his signature on USMCA Watch LIVE at 11 00 a m ET,0.13636363636363635,"['signed', 'usmca watch live', 'et']"
711,GOPLeader,The President is about to sign USMCA a HUGE promise made and kept with American workers The greatest economy in our lifetime is about to heat up even more,0.47500000000000003,"['usmca', 'huge', 'american workers']"
712,GOPLeader,President Trump s Peace Plan shows that he is leading from the front in reaching for that universal goal of peace and stability a promising step toward a brighter future,0.06666666666666667,"['trump', 's peace plan shows', 'universal goal', 'promising step']"
713,GOPLeader, The President s peace proposal is a step toward ending tensions between Israel amp Palestine Peace requires compromise but Is,0.0,"['president s peace proposal', 'israel', 'palestine']"
714,GOPLeader,The ban on fentanyl expires in eight days The Senate has already acted unanimously Why have House Democrats dragged their feet They are more focused on removing President Trump from office than they are on removing fentanyl from our communities,0.5,['trump']
715,RepCarbajal,It s unfathomable that this administration would rather demonize SNAP recipients than help them get back on their feet These cuts will strip SNAP from 700 000 people We are global leaders no one should be living in hunger HandsOffSNAP,0.0,"['snap', 'snap', 'global leaders', 'handsoffsnap']"
716,RepCarbajal,Tax season can be stressful I m hosting a FREE income tax workshop that will address topics like tax law refunds what to do if you owe and more Join me this Saturday February 1 at 2 30 p m at the Ludwick Community Center in SLO RSVP here,0.26666666666666666,"['tax season', 'free', 'income tax workshop', 'address topics', 'tax law refunds', 'join', 'february', 'p m', 'ludwick', 'community center', 'slo rsvp']"
717,RepCarbajal,This public charge rule is cruel and against our values SCOTUS s decision to authorize this rule will have dire consequences This is a targeted attack on immigrants that cannot stand Immigrants are the backbone of our nation,-0.5,"['public charge rule', 'scotus', 's decision', 'dire consequences', 'immigrants']"
718,RepCarbajal,51 years after the Santa Barbara oil spill corporate profits and big oil are still being put above our health and safety We have an abundance of natural renewable energy sources There is NO reason for us to resort to offshore oil,0.025,"['santa barbara', 'oil spill', 'corporate profits', 'big oil', 'natural renewable energy sources', 'no', 'offshore oil']"
719,RepCarbajal,As we fight to prevent future offshore oil drilling we must be prepared to mitigate the damage of currently operating pipelines I worked with to pass the SAFER Pipelines Act which will help DOT contain and reduce the devastation of oil spills,0.0,"['future offshore oil', 'safer pipelines', 'dot']"
720,RepKatieHill,I yield the balance of my time for now but not forever,0.0,[]
721,RepKatieHill,Tomorrow I will join my colleagues to vote to affirm the impeachment inquiry and then deliver my final floor speech You can tune into my speech on sometime between 12 30 and 1 30pm ET See you then,0.0,"['tomorrow', 'impeachment inquiry', 'final floor speech', 'et']"
722,RepKatieHill,It is with a broken heart that today I announce my resignation from Congress This is the hardest thing I have ever had to do but I believe it is the best thing for my constituents my community and our country See my official statement below,0.3,"['congress', 'hardest thing', 'official statement']"
723,RepKatieHill, TickFire Morning Update,0.0,['tickfire morning update']
724,RepKatieHill,As our community works to rebuild after the SaddleridgeFire we are now faced with an escalating threat in the form of the TickFire That s why I sent this letter to President Trump and Administrator Gaynor to request their continued support and attention to this matter,0.0,"['saddleridgefire', 'tickfire', 'trump', 'gaynor']"
725,RepBrownley,My thoughts are with his family and loved ones during this difficult time Rest in peace Mayor Lopez,0.09999999999999998,"['difficult time', 'rest', 'peace mayor', 'lopez']"
726,RepBrownley,Dr Manuel Lopez was a kind soul who was a loving father wonderful husband amp distinguished community leader On many occasions he opened up his home to me amp provided me with advice that has continued to guide my work as a public servant for which I will be forever grateful,0.54,"['dr manuel lopez', 'kind soul', 'wonderful husband amp', 'community leader', 'public servant']"
727,RepBrownley,America is a country founded by immigrants amp continues to flourish because of them The Trump Admin s PublicCharge rule unnecessarily punishes legal immigrants amp this SCOTUS decision will harm communities across the country I ll continue to fight to reverse this cruel policy,-0.39999999999999997,"['america', 'immigrants amp', 'trump admin', 'publiccharge', 'legal immigrants amp', 'scotus', 'harm communities', 'cruel policy']"
728,RepBrownley,I introduced the Every Veteran Counts Act which would call for a national survey of our veterans so that Congress VA and other stakeholders can better understand the evolving veteran population,0.09375,"['veteran counts', 'national survey', 'congress va', 'veteran population']"
729,RepBrownley,US Navy Senior Chief Petty Officer Shannon Kent was killed in action in Syria in January of 2019 A cryptologic technician wife and mother her sacrifice will not be forgotten and we honor her with a ForeverStamp,-0.05,"['us navy', 'senior', 'petty', 'shannon kent', 'syria', 'january', 'cryptologic technician wife', 'foreverstamp']"
730,RepJudyChu,Democratic women Assemble,0.0,"['democratic women', 'assemble']"
731,RepJudyChu,America s debt is on track to hit 1 trillion 98 of our economy by 2030 This is the direct outcome of the GOPTaxScam Despite what they claimed tax cuts for the rich don t pay for themselves they re paid for by you and your children,0.2375,"['america', 's debt', 'direct outcome', 'goptaxscam', 'tax cuts', 'rich don t pay']"
732,RepJudyChu,Who wore it best So great to have back on the Hill today to talk about how we can help more Americans understand and engage in politics not by fighting but by hearing each other out,0.43499999999999994,['who']
733,RepJudyChu,Paid Family and Medical Leave is as essential for strong families as it is for a strong economy Nobody understands that better than who shared her experiences today with,0.2733333333333333,"['paid', 'strong families', 'strong economy']"
734,RepJudyChu, It is time to end the arbitrary punishment of the Muslim American community write and,-0.05,"['arbitrary punishment', 'muslim', 'american community']"
735,RepAdamSchiff,Here are my takeaways Trump s lawyers cannot and did not defend him on the facts Their defense has evolved to this he did it so what His lawyers strengthened our case that the Senate must hear from Bolton A fair trial requires key witnesses Will America have one,0.35,"['trump', 's lawyers', 'bolton', 'fair trial', 'key witnesses', 'will america']"
