1942,RepBrianHiggins,A look at the public meeting today held by the to discuss the Skyway removal options designed to improve north south transportation and open up dozens of acres of Buffalo s waterfront for improved public access and use,0.0,"['public meeting', 'skyway removal options', 'buffalo', 's waterfront', 'public access']"
1943,RepSteveChabot,While Cincinnati will dearly miss both Commissioner Portune and Judge Jones their legacies will be felt by our community and our nation for generations to come Please watch the full video here,0.35,"['cincinnati', 'portune', 'jones', 'please', 'full video']"
1944,RepSteveChabot,Today I honored longtime Hamilton County Commissioner and former Cincinnati City Councilman Todd Portune and Judge Nathaniel Raphael Jones a civil rights leader and a federal judge on the House floor,0.0,"['hamilton', 'county commissioner', 'cincinnati', 'city councilman', 'todd portune', 'nathaniel raphael jones', 'civil rights leader', 'federal judge', 'house floor']"
1945,RepSteveChabot,ICYMI I worked with on the Mobile Workforce State Income Tax Simplification Act of 2020 The legislation would disallow states from taxing out of state employees until they have worked in the state for at least 30 days Read more here,0.1,"['icymi', 'mobile workforce', 'income', 'simplification', 'disallow states', 'state employees', 'read']"
1946,RepSteveChabot,,0.0,[]
1947,RepSteveChabot,Each year I have the privilege of nominating students from the First District for admission to each of the United States Service Academies Last week I hosted an event in Mason honoring this year s nominees and their families The students should be extremely proud,0.35000000000000003,"['academies', 'mason', 'year s nominees']"
1948,RepBradWenstrup,You can tune in live to watch sign the USMCA here,0.13636363636363635,['usmca']
1949,RepBradWenstrup,Consumer behavior looks a lot different today than it did 25 years ago when our current trade agreement was established The USMCA modernizes amp improves our North American trade relationships to ensure American exporters amp importers can thrive in a growing 21st century economy,0.0,"['consumer behavior', 'current trade agreement', 'usmca', 'modernizes amp improves', 'north american trade relationships', 'american exporters amp importers', 'century economy']"
1950,RepBradWenstrup,Just arrived at the White House to join for USMCA signing PromisesKept,0.0,"['white house', 'usmca', 'promiseskept']"
1951,RepBradWenstrup,Ohio is the 12th largest agricultural exporting state The USMCA will help Ohio farmers grow and compete in the global trading market by reducing the use of unfair trade distorting policies and opening up new opportunities to sell products like poultry and dairy in Canada,-0.12121212121212122,"['ohio', 'usmca', 'ohio', 'unfair trade', 'new opportunities', 'canada']"
1952,RepBradWenstrup,In 2018 Canada and Mexico were the top two markets for Ohio exports The USMCA will expand markets for American businesses and boost our Buckeye economy by improving our trade relationships with our North American neighbors,0.16666666666666666,"['canada', 'mexico', 'ohio', 'usmca', 'american businesses', 'buckeye', 'trade relationships', 'north american neighbors']"
1953,RepBeatty,It s obvious the is scared to hear the truth and that McConnell is desperately trying to cover it all up for,-0.3,['mcconnell']
1954,RepBeatty,Ohio is one step closer to voting on a RaiseTheWage constitutional amendment Get more info now,0.5,"['ohio', 'raisethewage', 'constitutional amendment']"
1955,RepBeatty,The 2020 Census is on the horizon PLEASE make sure that you are counted,0.5,"['census', 'please']"
1956,RepBeatty,FACT 4 830 900 Ohioans with pre existing conditions are at risk of losing their healthcare if amp s get their way We must ProtectOurCare ForThePeople,0.0,"['fact', 'ohioans', 'amp s', 'protectourcare forthepeople']"
1957,RepBeatty,The federal deficit AND national debt are EXPLODING under thanks to the GOPTaxScam,0.2,"['federal deficit', 'and', 'national debt', 'exploding', 'goptaxscam']"
1958,Jim_Jordan,Remember the witness count is already 17 to ZERO in favor of Democrats But they need one more still none for us to make their case How s that fair,0.6,"['remember', 'zero']"
1959,Jim_Jordan,Schiff s memo DOJ met the rigor transparency and evidentiary basis needed to meet FISA s probable cause requirement WATCH Inspector General Horowitz debunk that false claim,-0.17500000000000004,"['schiff', 's memo', 'doj', 'rigor transparency', 'evidentiary basis', 'fisa', 'watch inspector', 'horowitz', 'false claim']"
1960,Jim_Jordan, I guess that s why held all of his sham depositions in a SCIF,-0.2,"['sham depositions', 'scif']"
1961,Jim_Jordan,House Democrats STILL haven t scheduled a hearing for Inspector General Horowitz to testify about his report on the FBI s FISA abuse Thankfully Horowitz is here on an unrelated matter And we have plenty of questions for him,0.05000000000000002,"['still', 'haven t', 'inspector', 'horowitz', 'fbi s', 'fisa', 'thankfully horowitz']"
1962,Jim_Jordan, The ban on fentanyl analogues expires in 10 days yet House Democrats are too fixated on impeachment to take action,0.1,['fentanyl analogues']
1963,boblatta, While has been in office he s been delivering for the American people Millions of new jobs created 50 y,0.06818181818181818,"['american people', 'millions', 'new jobs']"
1964,boblatta,According to Bureau of Labor Statistics data Ohio added 9 800 jobs in December 2019 amp our state s private sector added 10 400 jobs last month alone In 2019 Ohio added 24 600 private sector jobs further fueling our local amp national economy,0.0,"['according', 'statistics', 'ohio', 'december', 'state s', 'private sector', 'ohio', 'private sector jobs', 'local amp', 'national economy']"
1965,boblatta,Over the past year 2 1 million jobs were created across the country with 27 300 jobs added in Ohio Our state s unemployment rate also fell by 0 4 from 4 6 thanks to Republican led policies focused on ensuring families have more in their pockets amp businesses can succeed,0.15,"['past year', 'ohio', 'state s unemployment rate', 'republican', 'pockets amp businesses']"
1966,boblatta, Fentanyl by the numbers 32 000 People who died from fentanyl in 2018 9 Days left before the temporary ban on fentanyl,0.0,"['fentanyl', 'temporary ban']"
1967,boblatta,Next Stop desk for signature into law I m proud the House passed the bipartisan Supporting Veterans in STEM Careers Act tonight because we must ensure our nation s veterans in OH5 amp beyond have the skills amp opportunities needed to succeed in STEM careers,0.35000000000000003,"['stop', 'supporting veterans', 'stem careers', 'nation s veterans', 'oh5', 'skills amp opportunities', 'stem']"
1968,RepBillJohnson, At 10 00 a m EST Director Phillip Swagel will testify before the House Budget Committee Watch live on,0.13636363636363635,"['est', 'phillip swagel', 'budget', 'watch']"
1969,RepBillJohnson, Remember when blocked Republican witnesses during his sham impeachment hearings We do,-0.2,"['remember', 'republican', 'sham impeachment hearings']"
1970,RepBillJohnson, Today Ohio signed occupational licensing reforms for our great military members amp their spouse who are lice,0.35000000000000003,"['ohio', 'great military members amp']"
1971,RepBillJohnson,Renewing the ban on a deadly substance like fentanyl should take priority over the partisan impeachment sham Dems have chosen to prioritize impeachment above everything else even when lives are at stake,-0.13333333333333333,"['renewing', 'partisan impeachment sham', 'dems', 'prioritize impeachment']"
1972,RepBillJohnson, Selective leaks in the 11th hour Bombshell revelations to undermine the trial We ve seen this before It s the same,0.0,"['selective', '11th hour', 'bombshell']"
1973,RepBobGibbs,Inconvenient facts undermining House Dems ShamImpeachment Ukraine President Zelensky said he was never pressured offered THREE TIMES to meet w Zelensky No preconditions Gordon Sondland was told by the president I want nothing I want no quid pro quo,-0.6,"['inconvenient', 'dems shamimpeachment ukraine', 'zelensky', 'three times', 'zelensky', 'gordon sondland']"
1974,RepBobGibbs,While Congressional Dems keep pushing their ShamImpeachment is killing terrorists and signing trade deals Why and how eliminating Soleimani was a good thing,0.7,"['dems', 'shamimpeachment', 'trade deals', 'soleimani', 'good thing']"
1975,RepBobGibbs,Check out my op ed on Taking out Soleimani wasn t just about retribution for months of rocket attacks He and his Quds Force which supports terrorists have been brazenly operating around the world for years,0.0,"['soleimani', 'wasn t', 'rocket attacks', 'quds', 'supports terrorists']"
1976,RepBobGibbs, is right But don t take our word for it Dr Fiona Hill one of s star witnesses testified t,0.2857142857142857,"['don t', 'dr fiona', 's star witnesses']"
1977,RepBobGibbs,Do Dems have a slam dunk case or do they need to call witnesses during the Senate trial Can t have it both ways Speaker Pelosi amp Schiff wouldn t allow House Republicans to call witnesses in their ShamImpeachment but now want the same privilege they denied,0.0,"['dems', 'slam dunk case', 'senate trial', 'ways speaker', 'pelosi', 'schiff', 'wouldn t', 'shamimpeachment']"
1978,WarrenDavidson,This GoodNews has received far too little attention,-0.04375,['goodnews']
1979,WarrenDavidson,The US ArmedForces accomplish amazing feats but they can t succeed if we don t keep to a mission It s time to end blank check AUMFs,0.30000000000000004,"['armedforces', 'amazing feats', 'don t', 's time', 'blank check', 'aumfs']"
1980,WarrenDavidson,Despite the exceptional economic growth too many able bodied people are still on the sidelines To sustain the strong economic growth we need more participation and more productivity,0.4375,"['economic growth', 'strong economic growth']"
1981,WarrenDavidson,Americans value a social safety net that helps those who cannot help themselves and equips those who can to begin again I am working with others to help end benefits cliffs so that more people have more opportunity,0.2583333333333333,"['social safety net', 'end benefits cliffs']"
1982,WarrenDavidson,America must always be the land of opportunity for all Americans providing as many as possible with the dignity of work,0.25,['america']
1983,RepMarcyKaptur, Trump s lawyers argued he has a right to abuse his power as much as he wants and Congress can do nothing about it Sou,0.24285714285714285,"['trump', 's lawyers', 'congress', 'sou']"
1984,RepMarcyKaptur,Ambassador William Taylor is a patriot who understands American interests and the interest of liberty are bigger than the petty political agendas of the few,-0.05,"['william taylor', 'american interests', 'petty political agendas']"
1985,RepMarcyKaptur,The VFW is right The president has diminished the sacrifice of these honorable service members and owes an apology,0.2857142857142857,"['vfw', 'honorable service members']"
1986,RepMarcyKaptur,Women can make their own healthcare decisions without politicians,0.6,['own healthcare decisions']
1987,RepMarcyKaptur,This week is the 47th Anniversary of Roe v Wade yet Trump is marking the occasion by addressing March For Life the 1st president to do so This is another sign that women s Constitutional right to make their own healthcare decisions is more at risk than it has been in years,0.4619047619047619,"['47th anniversary', 'roe', 'wade', 'trump', 'march', '1st president', 'women s', 'constitutional', 'own healthcare decisions']"
1988,RepMikeTurner,As Vice President of the NATO Parliamentary Assembly I joined the Head of the US Delegation to NATO PA in releasing the following statement regarding the UK s decision to allow Chinese company Huawei to assist in building the UK s 5G data network,0.0,"['vice president', 'parliamentary', 'head', 'delegation', 'pa', 'uk', 's decision', 'chinese company', 'huawei', 'uk', 's 5g data network']"
1989,RepMikeTurner, Democrats reference Gordon Sondland EVERYWHERE in their case Spread this clip far and wide No one on this planet to,0.0,"['gordon sondland everywhere', 'spread']"
1990,RepMikeTurner, Military families are vital to our nation Today I was proud to sign SB7 at to eliminate employ,0.26666666666666666,"['military families', 'sb7']"
1991,RepMikeTurner, Q Did the President of the United States ever say to you that he was not going to allow aid from the United States to go t,0.0,[]
1992,RepMikeTurner, With the impeachment trial starting today joins us live to talk with with what we can expect,0.06818181818181818,['impeachment trial']
1993,RepMarciaFudge,Maternal and infant health are in a state of crisis in America Today s hearing makes clear more must be done to address racial disparities in health expand health care coverage and improve access to nutrition services for pregnant women,0.3111111111111111,"['maternal', 'infant health', 'america', 's hearing', 'racial disparities', 'health care coverage', 'nutrition services', 'pregnant women']"
1994,RepMarciaFudge,Press Conference on House Support for State led Lawsuit to Block SNAP cuts,0.0,"['press conference', 'support', 'lawsuit', 'block snap']"
1995,RepMarciaFudge, NEWS At 1 00PM today I m joining to hold a press conference on an amicus brief filed by the House of Rep,0.0,"['news', 'press conference', 'rep']"
1996,RepMarciaFudge,Congress has repeatedly tried to expand access to conservation programs to socially disadvantaged farmers including Black and minority farmers Today I asked why it is seemingly pushing minority farmers and community based organizations out of these critical programs,-0.044444444444444446,"['conservation programs', 'black', 'minority farmers', 'minority farmers', 'critical programs']"
1997,RepMarciaFudge,The President s decision to kick nearly 700 000 people off SNAP is shameful amp cruel I m proud to stand with my colleagues to fight this Administration s attack on hungry people and expose its harmful actions at every turn HandsOffSNAP Full statement,0.0625,"['president s decision', 'snap', 'shameful amp cruel', 'administration s attack', 'hungry people', 'harmful actions', 'handsoffsnap', 'full statement']"
1998,RepBalderson,Ohio is open for business The economy and job market are BOOMING in the Buckeye State We need to keep promoting policies that protect this prosperity and support local businesses When Ohio businesses thrive Ohioans thrive,0.0,"['ohio', 'job market', 'booming', 'buckeye', 'support local businesses', 'ohio', 'businesses thrive', 'ohioans']"
1999,RepBalderson,Central Ohio is a hub of technology and innovation For 90 years has been developing solutions to the world s most pressing challenges Special thanks to their team for sharing about their cutting edge research in water quality amp energy during my recent visit,0.0761904761904762,"['ohio', 'world s', 'special thanks', 'edge research', 'water quality amp energy', 'recent visit']"
2000,RepBalderson,Thrilled to see such strong numbers in Ohio s economy and jobs market All the more reason we need to prepare our workforce for job opportunities through proper education and skills training workforcedevelopment,0.30666666666666664,"['thrilled', 'such strong numbers', 'ohio', 's economy', 'jobs market', 'job opportunities', 'proper education', 'skills training workforcedevelopment']"
2001,RepBalderson,Today we remember the brave men and women who boarded the Challenger Space Shuttle and never returned home including Ohioan Judith Resnik 34 years later and our hearts still break We will always remember their lives and the legacy they left behind,0.1,"['brave men', 'challenger', 'shuttle', 'ohioan judith resnik']"
2002,RepBalderson,I applaud this collaboration between the U S Department of and to improve vehicle performance reduce greenhouse gases reduce exhaust pollutants and improve fuel economy,0.0,"['s department', 'vehicle performance', 'greenhouse gases', 'exhaust pollutants', 'fuel economy']"
2003,RepTimRyan,The are a pillar of our community and provide an affordable fun way for families to spend time together I m 100 with the Scrappers because I know that in the Mahoning Valley the best days for America s pastime are yet to come,0.65,"['affordable fun way', 'scrappers', 'mahoning', 'america', 's pastime']"
2004,RepTimRyan,I m proud to support HOPE4AlzAct Whatever journey our lives take not one of our paths will be the same Those impacted by devastating diseases like Alzheimer s deserve individualized plans from their doctors,-0.06666666666666665,"['hope4alzact', 'alzheimer', 's deserve']"
2005,RepTimRyan,And TODAY the WORKER Act took a big step forward amp introduced it in the Senate Now the future of American workers rests with Will he do the right thing this time and bring the WORKER Act up for a vote 3 3,0.07142857142857142,"['today', 'worker', 'big step', 'american workers rests', 'will', 'right thing', 'worker']"
2006,RepTimRyan,That s why I introduced the WORKER Act in the House It s the first step to fighting automation amp helping put America back to work in the modern economy 2 3,0.15,"['worker', 'automation amp', 'america', 'modern economy']"
2007,RepTimRyan,We live in the wealthiest nation on earth yet 40 of Americans can t cover an unexpected 400 bill This is wrong It has to change 1 3,-0.08787878787878789,['wealthiest nation']
2008,RepDaveJoyce,PS Winnie wants me to let you know that he s here through next week and keeping his paws crossed for a play date he can even give you a tour of the Capitol,0.1,['ps winnie']
2009,RepDaveJoyce,We have family members who have served which is why Winnie is thankful for all does for our heroes in need amp why I was proud to cosponsor bill to give veterans increased access to service dogs,0.8,"['family members', 'winnie', 'need amp', 'cosponsor bill', 'service dogs']"
2010,RepDaveJoyce,While I was working today Winnie snuck outside to play I know he was secretly hoping for a sighting,-0.2,['winnie']
2011,RepDaveJoyce,As the son of a WWII vet I know how hard it can be for our heroes to get back into the workforce That s why I voted for the bipartisan Supporting Veterans in STEM Careers Act last night Veterans deserve the opportunities support they need to succeed once they return home,-0.010416666666666671,"['wwii', 'supporting veterans', 'stem careers', 'veterans', 'opportunities support', 'return home']"
2012,RepDaveJoyce,Just as a reminder below is what a fatal dose of fentanyl looks like And fentanyl analogues can be even more lethal,0.5,"['fatal dose', 'fentanyl analogues']"
2013,RepSteveStivers,As an Eagle Scout I gained a lot by being outdoors All kids deserve that same opportunity regardless of zip code That s why I cosponsored the Transit2Trails Act It will fund affordable transportation so those in underserved communities can experience public lands,0.0,"['eagle scout', 'kids deserve', 'opportunity regardless', 'zip code', 'transit2trails', 'affordable transportation', 'public lands']"
2014,RepSteveStivers,This HolocaustRemembranceDay we remember the millions of victims and stand with Holocaust survivors We must continue to drive out hate and combat all forms of anti Semitism,-0.8,"['holocaustremembranceday', 'holocaust', 'semitism']"
2015,RepSteveStivers,Planning a trip Make sure you re ready to go at my passport workshop on Jan 25th from 10AM 12PM at the Canal Winchester Community Senior Center Members of my staff can help you apply for or update a passport and answer any questions you have For more info call 740 654 2654,0.275,"['passport workshop', 'jan', '10am 12pm', 'winchester', 'senior', 'center members']"
2016,RepSteveStivers,Looking for some taxtips before filing Be sure to take advantage of events near you If you re in Chillicothe Washington Court House or Wilmington check out the Taxpayer Advocate Service s event on January 31st,0.3,"['looking', 'be', 'chillicothe washington', 'court house', 'wilmington', 'taxpayer advocate', 'service s event', 'january']"
2017,RepSteveStivers,Today we remember the life and legacy of Dr Martin Luther King Jr His commitment to service and compassion is an inspiration to us all,0.0,['dr martin luther king jr']
2018,RepAGonzalez,Instances like this are exactly why taking steps to help safeguard our intellectual property and cutting edge research is so important My SASTA legislation will help safeguard against academic espionage amp was signed into law as part of the FY2020 NDAA,0.07000000000000002,"['instances', 'intellectual property', 'edge research', 'sasta', 'academic espionage amp', 'fy2020 ndaa']"
2019,RepAGonzalez, Special thanks to for your leadership in prioritizing suicide preventi,0.2785714285714286,"['special thanks', 'suicide preventi']"
2020,RepAGonzalez,Great to see innovative programs like this opening in Northeast Ohio to lower barriers to recovery for women across our community Congratulations to OneEighty on the new facility,0.4787878787878788,"['innovative programs', 'ohio', 'congratulations', 'oneeighty', 'new facility']"
2021,RepAGonzalez, Congratulations to amp on passage of their bipartisan Advancing Research to Prevent Suicide,0.0,"['congratulations', 'advancing', 'prevent suicide']"
2022,RepAGonzalez,I sincerely believe that if we want to make a dent on preventing suicide we need to be more proactive in finding the causes of suicide clusters and suicide contagions Our children our veterans and our neighbors deserve action,0.3666666666666667,"['suicide clusters', 'suicide contagions', 'neighbors deserve action']"
2023,repkevinhern,When I first saw this I thought it was a headline from turns out it s a legitimate move from to silence anyone who disagrees with them You can t make this stuff up,0.25,[]
2024,repkevinhern, I ve never seen a guy who can say things that aren t true with more conviction than Schiff Glad today we are finally hearin,0.3375,"['aren t', 'schiff glad']"
2025,repkevinhern,MarchforLife is happening in DC today I m in Oklahoma but my thoughts are with everyone standing up for life Incredible to see address the attendees 1st POTUS to do it Thank you for supporting life,0.575,"['marchforlife', 'dc', 'oklahoma', 'incredible', 'attendees 1st', 'potus', 'thank']"
2026,repkevinhern, NEWSFLASH for Nancy Pelosi and Adam Schiff invoking Constitutional privilege is not obstruction of Congress,0.0,"['newsflash', 'nancy pelosi', 'adam schiff', 'constitutional', 'congress']"
2027,repkevinhern, You know what they say Nothing says solemn and somber like fist bumps and signing celebrations with souvenir pens,0.0,"['fist bumps', 'souvenir pens']"
2028,RepMullin,Today on International Holocaust Remembrance Day WeRemember the millions of people who were murdered during the Holocaust Anti Semitism has no place in this world and we will continue to stand together against it NeverAgain,0.0,"['holocaust remembrance', 'weremember', 'holocaust anti semitism', 'neveragain']"
2029,RepMullin,It is always inspiring to see so many especially young people come out in support of life I stand with those who have come to march and I stand firm in my conviction that life begins in the womb MarchForLife,0.25,"['young people', 'marchforlife']"
2030,RepMullin,I am grateful the Trump Admin repealed the old harmful WOTUS rule amp delivered a new rule that clearly defines a WOTUS It strikes the right balance between the regulatory authority of the federal government amp allowing states to take care of their own natural resources,0.22034632034632037,"['trump admin', 'old harmful', 'wotus', 'rule amp', 'new rule', 'wotus', 'right balance', 'regulatory authority', 'federal government amp', 'own natural resources']"
2031,RepMullin,Every human life is precious As a father of six I cannot express enough how precious the lives of innocent children are From the moment of conception each child is worthy of life and protection from harm,0.3055555555555555,"['human life', 'innocent children']"
2032,RepMullin, Republicans in Congress are fighting every day for the most vulnerable among us Today we stand with pro life supporters ac,0.0,"['congress', 'pro life supporters ac']"
2033,RepFrankLucas,The Securing American Leadership in Science amp Technology Act confronts China s threats to American science and technology and invests basic research into next generation technologies addressing the world s changing climate,0.0,"['securing', 'science amp technology act', 'china', 's threats', 'american science', 'basic research', 'generation technologies', 'world s']"
2034,RepFrankLucas,For centuries America has led the world in innovation and has pioneered breakthrough research amp scientific discovery As we face increasing Chinese threats amp a changing climate we must continue to invest in research amp infrastructure to protect our economic amp national security,0.1,"['america', 'breakthrough research amp', 'scientific discovery', 'chinese threats amp', 'research amp infrastructure', 'economic amp', 'national security']"
2035,RepFrankLucas,Last night the House passed 2 bipartisan Science Committee bills one supporting research to better prevent suicide amp the other expanding STEM opportunities for veterans transitioning to civilian life I thank my fellow House colleagues for addressing these important issues,0.205,"['bipartisan science committee bills', 'suicide amp', 'stem', 'civilian life', 'fellow house colleagues', 'important issues']"
