723,RepCardenas,Praying for the victims of this shooting We have a gun violence problem in America That s the truth McConnell has had a bipartisan gun safety bill on his desk since last year but refuses to bring it to a vote Do your job EnoughIsEnough,0.0,"['praying', 'gun violence problem', 'america', 'mcconnell', 'bipartisan gun safety bill', 'enoughisenough']",D,California
724,RepCardenas, A small group of lawmakers led by Sen and have fought to restore the islanders Medicaid cover,-0.25,"['small group', 'sen', 'medicaid']",D,California
725,BradSherman,Despite Trump s empty rhetoric at SOTU2020 his administration has tried to strip people of their healthcare gravely degraded environmental standards amp has given huge giveaways to big pharma Trump has failed hard working Americans everywhere,-0.09833333333333333,"['trump', 's empty rhetoric', 'sotu2020', 'strip people', 'environmental standards amp', 'huge giveaways', 'big pharma', 'trump']",D,California
726,BradSherman,Very long speech He still hasn t mentioned how his tax cuts for millionaires means your family s share of the increase in USA debt is 35 000 Maybe you will save a few hundred in taxes SOTU2020,-0.1325,"['hasn t', 'tax cuts', 'millionaires means', 'family s', 'usa', 'sotu2020']",D,California
727,BradSherman,If you believe Trump is protecting coverage for pre existing conditions you probably believe he was faithful to all three of his wives SOTU2020,0.0,"['trump', 'sotu2020']",D,California
728,BradSherman,If you believe Trump will lower drug prices you probably believe he was faithful to all three of his wives SOTU2020,0.0,"['trump', 'drug prices', 'sotu2020']",D,California
729,BradSherman,If you believe Trump will protect your Social Security you probably believe he was faithful to all three of his wives SOTU2020,0.03333333333333333,"['trump', 'social security', 'sotu2020']",D,California
730,RepPeteAguilar,My full response to the president s SOTU,0.35,"['full response', 'president s', 'sotu']",D,California
731,RepPeteAguilar,The 2020Census will shape the future of our region That s why I m working to make sure every Inland Empire resident is counted Listen to the full story on my latest Census workshop here,0.3375,"['inland', 'empire resident', 'listen', 'full story', 'census']",D,California
732,RepPeteAguilar, Honored to represent the women and men of and the California Fire Service at next weeks 2020SOTU Thank yo,0.0,"['honored', 'california', 'fire service', 'weeks 2020sotu', 'thank']",D,California
733,RepPeteAguilar,This year one of the best ways to help improve our region is to spread the word about the 2020Census Help me make sure every member of our community is counted,0.75,[],D,California
734,RepPeteAguilar,I m proud to announce that San Bernardino County Fire Chief Daniel Munsey will join me at the president s State of the Union address next week Read more here gt,0.43333333333333335,"['san bernardino', 'county fire chief', 'daniel munsey', 'president s state', 'union address', 'read']",D,California
735,gracenapolitano,The 2002 Iraq Authorization for Use of Military Force should not be used to justify war with Iran or any other nation I proudly voted against this AUMF nearly 18 years ago and I am proud to cast my vote to repeal it today StopEndlessWar,0.29500000000000004,"['iraq authorization', 'military force', 'iran', 'aumf', 'stopendlesswar']",D,California
736,gracenapolitano, We can t let President Trump drag us into a war with Iran that Congress never intended to authorize that s why we re v,-0.1,"['trump', 'iran', 'congress', 're v']",D,California
737,gracenapolitano, UPDATE this young girl is receiving medical treatment in Philadelphia DHS is forcing children with disabilities amp se,0.05,"['update', 'young girl', 'medical treatment', 'philadelphia dhs', 'disabilities amp se']",D,California
738,gracenapolitano, The 2002 Authorization for Military Force was passed to address the threat posed by Saddam Hussein That was 6 320 days,-0.1,"['authorization', 'military force', 'saddam hussein']",D,California
739,gracenapolitano, The 2002 AUMF never should have been on the books in the first place Tomorrow the House can come together in a biparti,0.25,"['aumf', 'tomorrow']",D,California
740,RepTedLieu, WATCH IT LIVE Hearing on Oversight of the Federal Bureau of Investigation with FBI Director Christophe,0.13636363636363635,"['watch it live hearing', 'oversight', 'federal bureau', 'fbi director', 'christophe']",D,California
741,RepTedLieu,From trying to tear down protections for preexisting conditions to the healthcare sabotage driving up premiums Trump is waging an all out assault on Americans healthcare Thank you for being our CA33 SOTU guest to remind us all what s at stake StateofHealthCare,-0.15555555555555559,"['healthcare sabotage', 'trump', 'thank', 'ca33 sotu', 'stateofhealthcare']",D,California
742,RepTedLieu, Democrats will never stop extending the hand of friendship to get the job done ForThePeople We will work to find commo,0.0,['forthepeople'],D,California
743,RepTedLieu,Proud to welcome former gold medal Olympic swimmer turned healthcare advocate Gary Hall Jr from CA33 to join us at tonight s SOTU and shine a light on our fight to improve the StateOfHealthCare ForThePeople,0.5,"['proud', 'gold medal', 'olympic swimmer', 'healthcare advocate', 'gary hall jr', 'ca33', 'sotu', 'stateofhealthcare forthepeople']",D,California
744,RepTedLieu, Last year House Democrats passed bipartisan gun legislation to keep our children safe and ensure dangerous weapons don,-0.033333333333333326,"['year house', 'bipartisan gun legislation', 'dangerous weapons don']",D,California
745,RepJimmyGomez, Last year House Democrats passed HR3 the LowerDrugCostsNow Act which would bring down prescription prices and help A,-0.07777777777777779,"['year house', 'hr3', 'lowerdrugcostsnow', 'prescription prices']",D,California
746,RepJimmyGomez, Democrats will never stop extending the hand of friendship to get the job done ForThePeople We will work to find commo,0.0,['forthepeople'],D,California
747,RepJimmyGomez,My good friend and colleague is delivering the response to tonight s SOTU address in Spanish She is a leader in our party making her voice heard in the efforts to EndGunViolence and protect those who come to this country in search of a better life WATCH,0.39999999999999997,"['good friend', 'sotu', 'party making', 'endgunviolence', 'watch']",D,California
748,RepJimmyGomez,After tonight s SOTU address we ll be hearing from Michigan s Under her leadership more of Michigan s WorkingFamilies have now been able to access quality HealthCare services and opportunities for a good paying jobs We need MORE governors like her Watch,0.55,"['sotu', 'michigan', 'michigan', 'workingfamilies', 'access quality', 'healthcare', 'more', 'watch']",D,California
749,RepJimmyGomez,Best part of tonight s SOTU address other than ripping s speech Finding out the signed and Can t wait to see them both in Dodger blue,0.2916666666666667,"['sotu', 's speech', 'finding', 'dodger']",D,California
750,NormaJTorres, California s housing today is in a state of gridlock a traffic jam of unmet needs brought on by years of policy that do,0.0,"['california', 'traffic jam', 'unmet needs']",D,California
751,NormaJTorres, A living hell Hundreds who have been deported from the U S back to El Salvador have been killed or abused as a new Huma,-0.02121212121212122,"['hundreds', 'el salvador', 'huma']",D,California
752,NormaJTorres,Thank you Fred for standing up for victims of gun violence ImWithFred,0.0,"['thank', 'fred', 'gun violence', 'imwithfred']",D,California
753,NormaJTorres, Proud to join my colleagues to WearWhite tonight 100 years after women gained the right to vote we s,0.5428571428571429,"['proud', 'wearwhite']",D,California
754,NormaJTorres, NewDem delivered the Democrats Spanish language response to the StateofTheUnion,0.0,"['newdem', 'spanish language response', 'stateoftheunion']",D,California
755,CongressmanRuiz,Join me for a conversation with my guest for tonight s State of the Union Elizabeth from Desert Mirage High School,0.16,"['join', 's state', 'elizabeth', 'mirage', 'high school']",D,California
756,CongressmanRuiz,On WorldCancerDay let s stand together to uplift cancer survivors and their families and recommit ourselves to finding a cure,0.0,"['worldcancerday', 's stand', 'uplift cancer survivors']",D,California
757,CongressmanRuiz,I cosponsored the Home Health Care Planning Improvement Act so that our seniors can have access to the home care they need I urge the House to vote on this bill so that we can expand access to home health care services and lower costs for Medicare patients,0.0,"['home health', 'care', 'improvement', 'home health care services', 'medicare']",D,California
758,CongressmanRuiz,At tonight s SOTU I want to hear how we can work together to improve lives and LowerDrugCosts ForThePeople StateOfHealthCare,0.0,"['sotu', 'lowerdrugcosts forthepeople stateofhealthcare']",D,California
759,CongressmanRuiz,As we celebrate BlackHistoryMonth I am reminded of local heroes like the late Major Thomas Jefferson Daniels III who fought for equality amp justice alongside the Tuskegee Airmen In November I was honored to present his daughters with the Congressional Gold Medal in his name,-0.059375,"['blackhistorymonth', 'local heroes', 'late major', 'thomas jefferson daniels iii', 'equality amp justice', 'tuskegee airmen', 'november', 'medal']",D,California
760,RepKarenBass,Somebody get my Speaker a trash can,0.0,['somebody'],D,California
761,RepKarenBass, What s at stake this year for the Black community Civil Rights Voting Rights Health Care Education Black Wealth C,-0.16666666666666666,"['black', 'voting', 'care', 'black']",D,California
762,RepKarenBass, As we commemorate BlackHistoryMonth the CBC is pleased to announce its National Black Leadership Summit on February 4,0.16666666666666669,"['blackhistorymonth', 'cbc', 'black', 'summit', 'february']",D,California
763,RepKarenBass,I was in Sudan last week and Eritrea last year Nigeria has the largest economy in Africa Banning countries because of the religion of the people there or the color of their skin makes us no better than the evil the Trump administration is allegedly trying to shut out,-0.27,"['sudan', 'eritrea', 'nigeria', 'africa banning', 'trump']",D,California
764,RepKarenBass,This just happened Again,0.0,[],D,California
765,RepLindaSanchez,Discurso de Trump parec a m s un programa de juegos de televisi n que un discurso presidencial dando premios por espect culo mientras le daba la espalda a la realidad,0.0,"['discurso', 'trump', 'm s un programa', 'televisi n que un discurso presidencial dando premios por espect culo mientras']",D,California
766,RepLindaSanchez,President Trump s speech tonight was more like a TV game show than a presidential address It s time for an agenda that actually puts the American people first Read my full SOTU statement,0.11666666666666665,"['trump', 's speech', 'tv game show', 'presidential address', 's time', 'american people', 'read', 'sotu']",D,California
767,RepLindaSanchez, Fact Checks This is false We will always protect patients with pre existing conditions,-0.4000000000000001,['fact checks'],D,California
768,RepLindaSanchez, Context Undocumented immigrants generally do not have access to federal health care programs Even legal immigran,0.0875,"['context undocumented', 'federal health care programs', 'legal immigran']",D,California
769,RepLindaSanchez, President Trump has taken our country backwards throughout his tenure Families have been torn apart More families a,0.5,"['trump', 'country backwards', 'families']",D,California
770,RepGilCisneros,I am also a proud cosponsor of the Museum of Asian Pacific American History and Culture Act to honor the history and important contributions of our AAPI community in our country Tune in to Dems hearing on creating Latinx and AAPI museums,0.30000000000000004,"['proud cosponsor', 'history', 'culture', 'important contributions', 'aapi', 'country tune', 'dems', 'latinx', 'aapi']",D,California
771,RepGilCisneros, Thank you for your support LatinoMuseumNow,0.0,"['thank', 'latinomuseumnow']",D,California
772,RepGilCisneros,Our latinx community needs to see themselves in our nation s museums and institutions I am proud to support the creation of a in our nation s capital 500 years of U S history should not be ignored LatinoMuseumNow,0.8,"['latinx community needs', 'nation s museums', 'nation s capital', 's history', 'latinomuseumnow']",D,California
773,RepGilCisneros,We need to take bold action to lower prescription drug prices and the Senate should pass HR3 not cater to Big Pharma We need to pass comprehensive immigration reform not build a wasteful ineffective wall We need to address climate change not ignore science SOTU,0.14444444444444446,"['bold action', 'prescription drug prices', 'hr3', 'pharma', 'comprehensive immigration reform', 'wasteful ineffective wall', 'address climate', 'ignore science', 'sotu']",D,California
774,RepGilCisneros,That includes supporting the Texas lawsuit to undo protections for pre existing conditions cutting enrollment outreach funding and implementing short term junk plans that have raised premiums SOTU,-0.11666666666666665,"['texas', 'undo protections', 'enrollment outreach', 'term junk plans', 'sotu']",D,California
775,RepRoybalAllard,We need a president who cares first and foremost about the American people Sadly this president has demonstrated time and time again that he cares only about his own needs and his own power Read my statement on his State of the Union address,0.15833333333333333,"['american people', 'sadly', 'own needs', 'own power', 'read', 'union address']",D,California
776,RepRoybalAllard,Heading to the Capitol tonight for the State of the Union address wearing white to salute the determined suffragists who won us the right to vote 100 years ago Honored to be part of our caucus of who fight with that same persistence ForThePeople every day,0.09523809523809523,"['heading', 'union address', 'honored', 'forthepeople']",D,California
777,RepRoybalAllard, CA 40 HIGH SCHOOLERS The deadline to enter 2020 s Lucille Roybal Allard Student Art Competition is Thursday Feb 6,0.16,"['ca', 'high schoolers', 'lucille roybal allard', 'art competition', 'feb']",D,California
778,RepRoybalAllard,The president should be rolling back his hateful travel ban but instead he s expanded it His decision will separate more families and continue to tarnish America s proud history as a nation of immigrants,0.43333333333333335,"['hateful travel ban', 'america', 'proud history']",D,California
779,RepRoybalAllard,As America battles China for the jobs of the 21st century I m fighting in Congress to stimulate the CA40 economy create and sustain good paying jobs in our local communities and support excellent job training and education for our residents,0.425,"['america', 'china', 'congress', 'ca40', 'sustain good', 'local communities', 'excellent job training']",D,California
780,RepMarkTakano, VA is one of the top service providers in the world for survivors of Military Sexual Trauma but veterans don t always k,0.3,"['va', 'top service providers', 'sexual trauma', 'veterans don t']",D,California
781,RepMarkTakano,While President Trump continues to put his interests above the needs of the American people I remain committed to working with my Democratic colleagues to advance our priorities and continue working ForThePeople Read my full SOTU statement,0.11666666666666665,"['trump', 'american people', 'democratic colleagues', 'forthepeople read', 'sotu']",D,California
782,RepMarkTakano,As a former public school teacher for more than 20 years I was also disappointed to hear President Trump s plan to give corporations and the wealthy 5 billion in tax credits to support private school vouchers,0.041666666666666664,"['public school teacher', 'trump', 's plan', 'tax credits', 'private school vouchers']",D,California
783,RepMarkTakano,President Trump is supporting a lawsuit that would dismantle the Affordable Care Act and end protections for people with pre existing conditions He has not expressed any support for H R 3 which is still stuck in Mitch McConnell s legislative graveyard,0.25,"['trump', 'care', 'h r', 'mitch mcconnell', 'legislative graveyard']",D,California
784,RepMarkTakano,asked me to describe Trump s SOTU speech in 3 words,0.0,"['trump', 'sotu']",D,California
785,KenCalvert,Congratulations Janiyah We should empower parents with the ability to chose the school that works best for them and their child,1.0,"['congratulations janiyah', 'empower parents']",R,California
786,KenCalvert,Welcome home Sgt Williams God Bless your family for all the sacrifices you and they have made for our nation What an incredible moment,0.8500000000000001,"['welcome', 'sgt williams god bless', 'incredible moment']",R,California
787,KenCalvert,has delivered on the promises he made to America and I believe the best is yet to come I look forward to working together with him and all of my colleagues to maintain our strong economy military and border SOTU,0.4444444444444444,"['america', 'strong economy', 'sotu']",R,California
788,KenCalvert,My response to the SOTU,0.0,['sotu'],R,California
789,KenCalvert,Our military is strong because we ve reversed Obama era cuts to training amp readiness while giving our servicemembers the tools and resources needed to eliminate threats like ISIS and Qasem Soleimani while investing in next generation weapons to ensure it s never a fair fight,-0.00416666666666668,"['obama', 'era cuts', 'training amp readiness', 'isis', 'qasem soleimani', 'generation weapons', 'fair fight']",R,California
790,RepMaxineWaters,To think that I would attend the SOTU to hear the message of an IMPEACHED president is a thought that in no way would be consistent w my fight and struggle against this dishonorable president I will certainly NOT be there,0.07142857142857142,"['sotu', 'impeached', 'consistent w', 'dishonorable president', 'not']",D,California
791,RepMaxineWaters,America needs to wake up GOP is willing to lie cheat amp steal for power They have no shame amp no guts They can t bring themselves to remove a lying criminal con man impeached president in an election year but they can STEAL a Supreme Court seat in an election year B S,-0.07500000000000001,"['america', 'lie cheat amp', 'shame amp', 'con man', 'election year', 'steal', 'supreme court seat', 'election year b s']",D,California
792,RepMaxineWaters,I ve never seen a more insufferable amp pathetic group of Senators than those in the GOP They ve chosen to strap themselves to a corrupt con man they KNOW is guilty They re all cowards None of them belong in the Senate They should go home and grow a backbone,-0.375,"['insufferable amp pathetic group', 'corrupt con man', 'know']",D,California
793,RepMaxineWaters, WATCH U S House Moment of Silence for Kobe Bryant amp Victims of Helicopter Crash,0.0,"['watch u', 's house', 'moment', 'silence', 'kobe bryant', 'victims', 'helicopter crash']",D,California
794,RepMaxineWaters, MOMENT OF SILENCE and led a moment of silence at the U S House in memory of John Keri and Alyssa A,0.0,"['moment of silence', 's house', 'john keri', 'alyssa']",D,California
795,RepBarragan,A LatinoMuseum will be an important step to making U S history more inclusive more accurate and more complete Let s not lose more histories heroes and memories LatinoMuseumNOW,0.41428571428571426,"['latinomuseum', 'important step', 's history', 'histories heroes', 'latinomuseumnow']",D,California
796,RepBarragan,Jobs amp Economy to Energy to NATO to Healthcare to Immigration to Iran Trump s SOTU was partisan misleading and full of Lies called it Manifesto of Mistruths No common ground No ClimateActionNow Here s a rundown of lies,0.25,"['jobs', 'economy', 'energy', 'healthcare', 'iran trump', 'sotu', 'lies', 'manifesto', 'mistruths', 'common ground', 'climateactionnow']",D,California
797,RepBarragan,Sham Senate Impeachment trial ends today No witnesses No new evidence in Why the articles of impeachment deserve a yes vote The president was afraid he was going to lose the next election so he decided to cheat,-0.21704545454545454,"['sham', 'impeachment', 'trial ends', 'new evidence', 'impeachment deserve', 'yes vote']",D,California
798,RepBarragan,Compton s Hector Barajas my SOTU guest tonight served honorably in the military came home then was deported Shameful US govt will give automatic citizenship if a soldier dies in war Why must they die We will not stop until we honor all vets amp change this horrific policy,-0.55,"['compton', 'hector barajas', 'sotu', 'shameful', 'us govt', 'automatic citizenship', 'vets amp', 'horrific policy']",D,California
799,RepBarragan,works ForThePeople,0.0,['forthepeople'],D,California
800,RepKatiePorter,announced support for HR3 In SOTU he called for bipartisan legislation that achieves the goal of dramatically lowering prescription drug prices and he will sign it into law without delay HR3 passed with bipartisan support in 2019 HR3withoutdelay,0.0,"['hr3', 'sotu', 'bipartisan legislation', 'prescription drug prices', 'hr3', 'bipartisan support', 'hr3withoutdelay']",D,California
801,RepKatiePorter,As the President gives his SOTU address I m listening for his plan to improve our healthcare system including mental health coverage My guest tonight is Dr Heather Huszti Chief Psychologist at who s seen our country s pediatric mental health crisis up close,-0.1,"['sotu', 'healthcare system', 'mental health coverage', 'dr heather huszti', 'psychologist', 'country s pediatric', 'mental health crisis']",D,California
802,RepKatiePorter,Our district is a leader in researching and treating cancer We are so fortunate to have top notch institutions like right in our backyard,0.3952380952380952,['top notch institutions'],D,California
803,RepKatiePorter,On WorldCancerDay we recommit ourselves to fighting for a future without cancer Last fall I was proud to speak at an event recognizing efforts to end childhood cancer and to share the story of my staffer Jordan who is a pediatric cancer survivor,0.26666666666666666,"['worldcancerday', 'childhood cancer', 'jordan', 'pediatric cancer survivor']",D,California
804,RepKatiePorter,The Admin s expanded travel ban emphasizes what our communities already know this ban has always been about prejudice and xenophobia That s why visitors are allowed but not permanent immigrants I m glad the House will soon consider legislation to end this discriminatory policy,0.5,"['admin', 'travel ban', 'permanent immigrants', 'discriminatory policy']",D,California
805,RepLouCorrea, Alondra will be at StateOfTheUnion as a guest of She is the second oldest in a mixed status family at the age,0.0,"['alondra', 'stateoftheunion', 'status family']",D,California
806,RepLouCorrea,The President is once again going after American s healthcare by attacking Medicaid This administration is again trying to take away lifesaving health care from seniors amp families I will not allow this Admin to undermine the promise of affordable dependable health care,0.0,"['american s healthcare', 'medicaid', 'health care', 'seniors amp families', 'admin', 'affordable dependable health care']",D,California
807,RepLouCorrea,Our state is in crisis We must do more to clean up our cities and help our homeless neighbors get back on their feet I urge Gov to send emergency housing resources to help Orange County,0.2888888888888889,"['homeless neighbors', 'gov', 'emergency housing resources', 'orange']",D,California
808,RepLouCorrea,Today is HolocaustRemembranceDay and the 75th anniversary of the liberation of Auschwitz We mourn the senselessly murdered of 6 million Jews amp others during the Holocaust,0.0,"['holocaustremembranceday', 'auschwitz', 'jews', 'amp others', 'holocaust']",D,California
809,RepLouCorrea,President Trump s Public Charge rule has been upheld As a nation of immigrants our ancestors arrived with empty pockets amp open minds to seek opportunity amp the American Dream SCOTUS gave the President permission to end that dream Lady Liberty s torch has been extinguished,-0.025,"['trump', 'empty pockets amp', 'open minds', 'opportunity amp', 'dream scotus', 'president permission', 'dream lady', 'liberty', 's torch']",D,California
810,RepLowenthal, Are you maintaining that the environmental study was cancelled because of career staff findings working on the study Ye,0.0,"['environmental study', 'career staff findings', 'ye']", D,California
811,RepLowenthal, this bill is necessary to ensure that the BoundaryWaters local residents and visitors do not have to worry about the tox,0.0,"['boundarywaters', 'local residents']", D,California
812,RepLowenthal, Trump wants to put a For Sale sign on millions of acres of land and water in the Boundary Waters We can t let the mining in,0.2,"['trump', 'sale', 'boundary waters']", D,California
813,RepLowenthal,ICYM My response to last night s SOTU,0.0,"['icym', 'night s', 'sotu']", D,California
814,RepLowenthal,We re working to deliver concrete results to the American people We re not done fighting for better infrastructure for a better climate and better healthcare We re not done fighting for accountability and to uphold the rule of law Our work will continue 9 9,0.32999999999999996,"['concrete results', 'american people']", D,California
815,RepHarley, As head into our two day series of hearings on the Trump Administration s attack on children we uplift o,0.0,"['day series', 'trump', 'administration s attack', 'uplift o']",D,California
816,RepHarley,The StateOfTheUnion would be stronger if addressed ClimateChange,0.0,"['stateoftheunion', 'climatechange']",D,California
