1286,RepGregPence,Today in Indiana we honor brave Hoosier Eva Kor Eva was a Holocaust survivor who dedicated her life to sharing her experiences so that history may not repeat itself To honor Eva s life and advocacy Governor Holcomb has declared today EvaEducationDay HolocaustRemembranceDay,0.8,"['indiana', 'honor brave', 'hoosier eva kor eva', 'holocaust', 'eva', 's life', 'advocacy governor', 'holcomb', 'evaeducationday holocaustremembranceday']"
1287,RepGregPence,75 years ago today 7 000 prisoners were set free from Auschwitz putting an end to 1 689 days of suffering On this day we remember reflect and most importantly never forget NeverAgain HolocaustRemembranceDay,0.2333333333333333,"['auschwitz', 'neveragain holocaustremembranceday']"
1288,RepAndreCarson, Creating good paying jobs Protecting our environment Building 21st century infrastructure Today u,0.35,"['creating', 'protecting', 'environment building', 'century infrastructure']"
1289,RepAndreCarson,The White House s Middle East plan is a non starter Palestinians were not even consulted in this one sided plan that inflames existing tensions The world will see it for what it is a scheme cooked up by an impeached president and an indicted prime minister,0.0,"['white house s', 'non starter', 'palestinians', 'prime minister']"
1290,RepAndreCarson,President Trump may have inherited a good economy but he s doing his best to run it into the ground His economic agenda caters to the super rich and mega corporations while making it harder for working families to get ahead That s a recipe for disaster TrumpBrokenPromises,0.41805555555555557,"['trump', 'good economy', 'economic agenda caters', 'mega corporations', 'trumpbrokenpromises']"
1291,RepAndreCarson, What are the symptoms of 2019 Novel Coronavirus 2019nCoV How does the virus spread Learn the answers to frequently asked q,0.1,"['novel coronavirus', 'learn']"
1292,RepAndreCarson,This morning I m presiding over The People s House Tune in now,0.0,['people s house tune']
1293,RepLarryBucshon,R I P Kobe Bryant As a basketball fan husband and father I am saddened by his death today in a tragic helicopter crash My prayers to his wife children parents and all those around the world who loved and admired him RIPMAMBA,-0.025000000000000022,"['p kobe bryant', 'basketball fan husband', 'tragic helicopter crash', 'wife children parents', 'ripmamba']"
1294,RepLarryBucshon, President Trump s legal team completely destroyed 3 days of Adam Schiff s false allegations in just 2 hours Today was de,-0.03333333333333335,"['trump', 'legal team', 'adam schiff', 'false allegations']"
1295,RepLarryBucshon, SIX FACTS that sink Dems case Transcript shows no conditionality Zelensky no quid pro quo pressure Ukraine didn t kn,0.0,"['six facts', 'dems', 'transcript', 'zelensky', 'ukraine', 'didn t kn']"
1296,RepLarryBucshon,Democrats know that President Trump will continue to appoint conservative judges to the federal courts including the Supreme Court if he is re elected Democrats are in a panic over this situation and are willing to railroad the President out of office to stop him Shameful,0.25,"['trump', 'conservative judges', 'federal courts', 'supreme court', 'shameful']"
1297,RepLarryBucshon,I just finished listening to the President s legal team present to the U S Senate It is clear that House Democrats do not have a case and are attempting to have the President removed from office because they don t like him and don t believe they can beat him at the ballot box,0.10000000000000002,"['president s', 'legal team', 's senate', 'don t', 'don t', 'ballot box']"
1298,RepTrey,ICYMI I joined to discuss why we need term limits a lobbying ban and spending reform to get to the root of a variety of problems Americans have with Congress and the way their federal government runs Take a look,0.0,"['icymi', 'term limits', 'congress', 'federal government runs']"
1299,RepTrey, Career politicians damage our country forcing Americans to live under laws that don t apply to the politicians that vote,0.13636363636363635,"['career', 'politicians damage', 'don t']"
1300,RepTrey, brandon New Spotlight on Freedom episode with Check it out,0.13636363636363635,"['spotlight', 'freedom episode']"
1301,RepTrey, Slate Run Elementary students met with U S Representative Trey Hollingsworth,0.3,"['run', 'elementary students', 's representative', 'trey hollingsworth']"
1302,RepTrey,As companies grow employers are offering the necessary training to fill their open jobs and help employees succeed for the long term,-0.016666666666666666,"['necessary training', 'open jobs', 'long term']"
1303,RepDavids, Today committee members gathered for a photo to mark the beginning of the second session of the 116th Congress We look,0.0,"['committee members', 'congress']"
1304,RepDavids,Our veterans have sacrificed so much to keep us safe So I m encouraging everyone in KS03 to show them our love and appreciation by dropping off a homemade Valentine s Day card at our offices for our 2nd annual Valentine s for Vets program Details,0.3,"['ks03', 'valentine', 's day card', 'valentine', 'vets', 'details']"
1305,RepDavids,My team holds pop up office hours across KS03 so we can bring our office to you Tomorrow we ll be at the KCK Main Library from 2 PM 5PM Learn more amp sign up here,0.3333333333333333,"['office hours', 'ks03', 'tomorrow', 'kck', 'main library', 'pm', 'learn']"
1306,RepDavids,During today s Sharice s Shift at I helped students navigate their class schedule visited the Veterans Center played some ping pong and importantly got the chance to rock my KCKCC Blue Devil socks,0.10000000000000002,"['sharice', 'shift', 'students navigate', 'class schedule', 'veterans', 'kckcc', 'devil']"
1307,RepDavids,Calling all students I m at the Student Success Center this morning for my latest Sharice s Shift stop by,0.2333333333333333,"['student success center', 'sharice', 'shift']"
1308,RepRonEstes,On my way to the White House for this historic ceremony Tune in ksleg,0.0,"['white house', 'historic ceremony tune']"
1309,RepRonEstes,This partnership between and Kansas wheat growers is great news for 400 000 KS04 residents that rely on the Cheney Reservoir for water as well as other projects in the future that can benefit from this pilot ksleg,0.225,"['kansas', 'wheat growers', 'great news', 'ks04', 'cheney reservoir', 'pilot ksleg']"
1310,RepRonEstes,Each child is unique and parents should have the opportunity to make education decisions that best meet their student s needs National School Choice Week is a great reminder that our District has many excellent public private parochial and homeschool options for young Kansans,0.471875,"['education decisions', 'student s needs', 'national school', 'great reminder', 'excellent public', 'homeschool options', 'kansans']"
1311,RepRonEstes, We have to remember always but it s never easy Alberto Israel survivor of Auschwitz On this Holocaust Remembrance D,-0.21666666666666667,"['alberto israel', 'auschwitz', 'holocaust remembrance d']"
1312,RepRonEstes,As one of just 18 members appointed to this commission U S Attorney General Barr commended the group at the swearing in by saying they truly reflect the best there is in law enforcement,0.525,"['s attorney', 'barr', 'law enforcement']"
1313,RepGuthrie, 1st time Democrats blocked 2nd time Democrats blocked 3rd time Democrats blocked,0.0,['1st time']
1314,RepGuthrie, HAPPENING NOW Democrats want to restrict how our Commander in Chief responds to national threats and to do so without any r,0.0,"['happening now', 'commander', 'chief responds', 'national threats']"
1315,RepGuthrie,This issue came to my attention while visiting the International Mail Facility at JFK Airport where I saw firsthand the dangers of counterfeit medical devices being smuggled into the U S Read more about the Safeguarding Therapeutics Act,0.16666666666666666,"['international mail', 'facility', 'jfk', 'medical devices', 'read', 'safeguarding therapeutics']"
1316,RepGuthrie,ICYMI I joined with to introduce the Safeguarding Therapeutics Act a bill that will protect American consumers from counterfeit medical devices,0.0,"['icymi', 'safeguarding therapeutics', 'american consumers', 'medical devices']"
1317,RepGuthrie, Congrats to senior Sean Hogan on receiving his appointment to the US Naval Academy,0.0,"['congrats', 'sean hogan', 'naval']"
1318,RepJohnYarmuth, Outside of wartime and recessions deficits have never been this high and have never increased consecu,0.08,['recessions deficits']
1319,RepJohnYarmuth, It means prioritizing policies that will help modernize our economy prepare our co,0.0,[]
1320,RepJohnYarmuth, CBO s report shows that there is a real need to address our fiscal issues over the,0.2,"['cbo', 'real need', 'fiscal issues']"
1321,RepJohnYarmuth, The reality is that President Trump and Republicans drove up deficits to instead gi,0.0,['trump']
1322,RepJohnYarmuth, Crumbling infrastructure Skyrocketing health care costs Widening student achievem,0.0,"['crumbling', 'skyrocketing', 'health care costs', 'widening', 'student achievem']"
1323,RepThomasMassie,I hope you can join me amp at the Second Amendment Rally in Frankfort Kentucky this coming Friday The event starts at 9 00am Dick and I will speak between 1 00pm and 2 00pm,0.0,"['amendment rally', 'frankfort kentucky', 'dick']"
1324,RepThomasMassie,In an hearing with about the Afghanistan Papers and other oversight of the 137 billion of spending on Nation Building in Afghanistan,-0.125,"['afghanistan papers', 'nation', 'afghanistan']"
1325,RepThomasMassie,Talking about the Second Amendment with of DC v Heller and this morning 2A brassywithmassie,0.0,"['amendment', 'dc', 'heller', 'morning 2a brassywithmassie']"
1326,RepThomasMassie,A special guest will join me at the 2A rally in Frankfort on Friday The rally starts at 9am Dick Heller and I plan to speak between 1 and 2 pm We both look forward to personally meeting the folks who come to the rally More info,0.28571428571428575,"['special guest', '2a rally', 'frankfort', 'dick heller']"
1327,RepThomasMassie,When the impeachment sham inevitably joins comey gate collusion delusion mueller investigation nothing burger and fake dossier in history s trash heap what hoax will the radical left deep state and left leaning media push next,-0.09999999999999999,"['impeachment sham', 'joins comey gate collusion delusion mueller investigation', 'fake dossier', 'history s trash heap']"
1328,RepHalRogers,Proud to receive an A rating on the s 1st National Pro Life Scorecard I count it a distinct honor amp duty to protect the sanctity of life amp to provide a voice for our innocent unborn children Learn more at,0.525,"['proud', 's 1st', 'pro', 'scorecard', 'distinct honor amp duty', 'life amp', 'innocent unborn children', 'learn']"
1329,RepHalRogers, Where do your legislators stand on LIFE Find out now WhyWeMarch ProLife,0.0,"['legislators stand', 'life find', 'whywemarch prolife']"
1330,RepHalRogers,3 3 President Trump rightfully stood firm against tyranny sending a clear message that no nation should tolerate Iran s destructive and destabilizing behavior and I pray that we can continue forward with efforts to deescalate tensions in the Middle East,-0.175,"['trump', 'clear message', 'iran', 's destructive', 'deescalate tensions']"
1331,RepHalRogers,2 3 I was relieved along w the rest of America to know that none of our troops were wounded by Iran s retaliating strikes Clearly Iran has improved its military force and missile range amp we must remain vigilant in our efforts to demonstrate our nation s strong sovereignty,0.14444444444444443,"['america', 'iran', 'clearly iran', 'military force', 'missile range amp', 'nation s', 'strong sovereignty']"
1332,RepHalRogers,After receiving a briefing this afternoon from the head of Joint Chiefs the Dept of Defense the CIA and State Department I feel reassured that President Trump s fortitude with Iran is appropriate and necessary 1 3,0.25,"['joint chiefs', 'dept', 'cia', 'state department', 'trump', 's fortitude', 'iran']"
1333,RepAndyBarr,My district is fortunate to have an amazing organization like call it home I stand with my colleagues in the fight to preserve our Minor League Baseball teams and the benefits they bring to our communities,0.31666666666666665,"['amazing organization', 'minor', 'league baseball teams']"
1334,RepAndyBarr,I remain firm in my belief that the future prosperity of this sport relies on uniformity throughout the industry and I will continue to work to increase the popularity and public confidence in thoroughbred horseracing throughout the nation,-0.06666666666666667,"['future prosperity', 'sport relies', 'public confidence']"
1335,RepAndyBarr, Congress must act to protect horses amp America s horseracing industry Our Horseracing Integrity Act sets national medica,0.0,"['horses amp', 'america', 'horseracing integrity', 'national medica']"
1336,RepAndyBarr,The result is support from a majority of Members of the House We must build on the momentum in Congress and the industry as a whole to ensure the safety of our athletes and increase the popularity public confidence and international competitiveness of the sport,0.06666666666666667,"['congress', 'public confidence', 'international competitiveness']"
1337,RepAndyBarr,The most recent draft of the Horseracing Integrity Act was developed through a highly deliberative and bipartisan process and takes into consideration a diversity of perspectives from all parts of the industry,0.19,"['horseracing integrity', 'bipartisan process']"
1338,SteveScalise,ADAM SCHIFF You simply can t have a fair trial without witnesses What a hypocrite This is the same Schiff who refused to call the witnesses Republicans requested when he was in charge,0.2333333333333333,"['adam schiff', 'fair trial', 'schiff']"
1339,SteveScalise, The President s peace proposal is a step toward ending tensions between Israel amp Palestine Peace requires compromise but Is,0.0,"['president s peace proposal', 'israel', 'palestine']"
1340,SteveScalise, The tide is turning against Schiff amp his impeachment zealots Defense team member Robert Ray along with,0.0,"['schiff', 'impeachment zealots defense team member', 'robert ray']"
1341,SteveScalise, It is encouraging to see the President continue the cause for world peace while House and Senate Democrats are distrac,0.0,['world peace']
1342,SteveScalise,The UK s decision to involve Huawei in the creation of their 5G network is a mistake It s not just a security risk for the UK It gives China a way to collect private data from people all over the world Nations should fight to protect their citizens data not put it at risk,0.0,"['uk', 's decision', 'huawei', '5g network', 'security risk', 'uk', 'china', 'private data', 'citizens data']"
1343,RepRichmond,I join the world in grief with the heartbreaking passing of NBA legend Kobe Bryant and his daughter Gianna I send my condolences to his wife family and fans during this tragic time This is a very sad reminder to keep your loved ones close because tomorrow is not promised,-0.37500000000000006,"['nba', 'kobe bryant', 'gianna', 'wife family', 'tragic time', 'sad reminder']"
1344,RepRichmond, The evidence is clear and overwhelming Donald J Trump is guilty Guilty of abusing his power guilty of soliciting fo,-0.18,"['donald j trump', 'guilty']"
1345,RepRichmond, The House came to fight for a trial that is fair to the American people The White House strategy hear no evil see no,0.3,"['american people', 'white house strategy']"
1346,RepRichmond, Today we honor a true patriot civil rights leader and American icon Dr Martin Luther King Jr inspires us every d,0.175,"['true patriot', 'civil rights leader', 'american icon', 'dr martin luther king jr']"
1347,RepRichmond,Dr Martin Luther King Jr lived his life in service to others through the practice of peace and social justice Let not only today but everyday serve as a reminder to honor him by following the footsteps of one of our world s foremost visionaries MLK2020,-0.04166666666666667,"['dr martin luther king jr', 'social justice', 'world s foremost visionaries', 'mlk2020']"
1348,RepClayHiggins,Congratulations to on its 1 000th shipment of LNG which is headed for France now The American LNG industry is a cornerstone of economic prosperity supporting American jobs and supplying the world with clean energy,0.16333333333333333,"['congratulations', '000th shipment', 'lng', 'france', 'lng', 'economic prosperity', 'american jobs', 'clean energy']"
1349,RepClayHiggins,This is a win for American freedom and for farmers ranchers and landowners across Louisiana and throughout the United States Under the new rule Americans will have greater autonomy to manage their own land,0.40727272727272734,"['american freedom', 'farmers ranchers', 'louisiana', 'new rule', 'own land']"
1350,RepClayHiggins,has kept his promise to redefine the WOTUS rule The new rule rolls back federal regulatory overreach eliminating the Obama admin s ridiculous interpretation that puddles ditches tractor tire ruts and farm ponds could be considered navigable waterways,-0.06565656565656565,"['wotus', 'new rule rolls', 'federal regulatory', 'obama', 'admin s', 'ridiculous interpretation', 'puddles ditches tractor tire ruts', 'farm ponds', 'navigable waterways']"
1351,RepClayHiggins,I m honored to receive an A rating from for my ProLife voting record My office will continue fighting to protect the unborn and to advance pro life legislation in Congress,0.0,"['prolife', 'pro life legislation', 'congress']"
1352,RepClayHiggins,Darkness cannot drive out darkness only light can do that Hate cannot drive out hate only love can do that Martin Luther King Jr,-0.1166666666666667,"['darkness', 'hate', 'martin luther king jr']"
1353,RepMikeJohnson, Schiff s case boils down to this We loathe Trump amp committed in 16 to impeach him After 3 yrs of bogus investigat,-0.15555555555555559,"['schiff', 's case', 'trump', 'bogus investigat']"
1354,RepMikeJohnson, The defense has rested its case and the only thing that has been proven beyond a reasonable doubt is that there is NO,0.1,"['reasonable doubt', 'no']"
1355,RepMikeJohnson, Watch how far Jake moves the goalposts on the Left s impeachment narrative in 90 seconds This goes from You particip,0.05,"['watch', 'jake', 'left', 's impeachment narrative']"
1356,RepMikeJohnson, Cipollone I couldn t say it better myself So I won t ShamImpeachment,0.5,"['cipollone', 'couldn t', 'shamimpeachment']"
1357,RepMikeJohnson, Aside from s 20 25 interruptions DC press record you have to love then cutting out our answer,-0.04999999999999999,"['aside', 'dc', 'press record']"
1358,RepAbraham, These 8 CBYX students hosted in Louisiana had a wonderful CivEdWeek conversation with From learning about yo,1.0,"['cbyx', 'louisiana', 'civedweek']"
1359,RepAbraham,Bold amp decisive leadership from amp Netanyahu is something we ve come to expect No other President in history has supported Israel so strongly Hopefully the Palestinians will come to the table and make this vision a reality,0.27638888888888885,"['bold', 'decisive leadership', 'netanyahu', 'israel', 'palestinians']"
1360,RepAbraham,I laugh when I hear hypocrites like Warren amp Pressley feigning outrage over the deportation of an Iranian with ties to terrorist organizations They condemn the people who keep us safe but run amp hide when things go badly To our DHS officials thank you,0.0333333333333334,"['warren', 'pressley', 'iranian', 'terrorist organizations', 'amp hide', 'dhs']"
1361,RepAbraham, Thanks for marching for life today,0.2,['thanks']
1362,RepAbraham,It was great to meet former tight end and pro life advocate at this year s for Life So many great people coming together to cherish God s creation,0.3842857142857143,"['tight end', 'pro life advocate', 'year s', 'great people', 'god', 's creation']"
1363,RepGarretGraves,going through pics from the weekend and this is a good one Washington Mardi Gras really does bring EVERYONE together,0.44999999999999996,"['washington mardi gras', 'everyone']"
1364,RepGarretGraves, President Trump s passion for life extends well beyond the MarchForLife His administration has confirmed pro life judges,0.4,"['trump', 's passion', 'marchforlife', 'pro life judges']"
1365,RepGarretGraves,if we re going to go out there and be advocating the federal government for hundreds of millions or over a billion dollars we ve got to make sure we re doing the right thing with the money,0.39285714285714285,"['federal government', 'right thing']"
1366,RepGarretGraves,Come over to my Instagram page and see some of my favorite LSUFootball National Championship pics from the game Give me a follow while you re there,0.04999999999999999,"['instagram', 'lsufootball', 'championship']"
1367,RepGarretGraves,,0.0,[]
1368,chelliepingree,Lilly Ledbetter worked 19 yrs at Goodyear before learning she was paid 20 less than her male coworkers OTD in 2009 President Obama signed a FairPay bill in her name giving employees more justice for pay discrimination Throwback to one of my first votes in Congress,0.14583333333333334,"['lilly ledbetter', 'goodyear', 'male coworkers', 'otd', 'obama', 'fairpay', 'pay discrimination', 'throwback', 'congress']"
1369,chelliepingree,I saw firsthand the irreparable harm of separating children from their parents at the US Mexico Border It s cruel and inhumane I ve signed on to this amicus brief urging the 9th Circuit to uphold the Flores Agreement b c familiesbelongtogether READ,-0.6333333333333333,"['irreparable harm', 'mexico', 's cruel', 'flores agreement', 'b c familiesbelongtogether', 'read']"
1370,chelliepingree,This is absolutely bananas which is still a fruit where I come from,0.2,[]
1371,chelliepingree,Those who do not learn history are doomed to repeat it 75 yrs after the Auschwitz liberation the Holocaust is fading from public memory The NeverAgain Education Act passed the House tonight I cosponsored this bill so WeRemember amp understand the consequences of bigotry,0.0,"['auschwitz', 'holocaust', 'public memory', 'neveragain', 'education act', 'weremember']"
1372,chelliepingree,Maine s natural beauty is protected through the Land amp Water Conservation Fund a bipartisan program to safeguard public lands 171 of my colleagues amp I are urging action on H R 3195 the bill to permanently FundLWCF amp protect public lands for generations to come,0.05,"['maine', 'natural beauty', 'land', 'amp water conservation fund', 'bipartisan program', 'public lands', 'colleagues amp', 'h r', 'fundlwcf', 'public lands']"
1373,RepGolden,Older workers shouldn t have to deal with age discrimination anywhere especially at work This month I helped pass H R 1230 which protects older Americans from discrimination in the workplace and holds employers accountable when they engage in discriminatory behavior 2 2,0.1111111111111111,"['older', 'workers shouldn t', 'age discrimination', 'h r', 'discriminatory behavior']"
1374,RepGolden,The rising cost of living and healthcare means many older Mainers put off retirement and stay in the workforce As the oldest state and one with a workforce shortage we can t afford to drive away older experienced workers with age discrimination 1 2,0.4083333333333333,"['mainers', 'workforce shortage', 'age discrimination']"
1375,RepGolden,Last year I helped pass thru the House the most comprehensive bill to get money out of politics in decades The Senate has refused to take it up but we ll keep pushing to get big money out of elections amp return our government to regular people It s time to EndCitizensUnited,0.125,"['comprehensive bill', 'big money', 'elections amp return', 'regular people', 's time', 'endcitizensunited']"
1376,RepGolden,Why hasn t Congress done more to defend workers rights against corporations Because too many unscrupulous corporations are able to throw money towards candidates and organizations who vilify working men and women for standing up for their rights The list goes on and on,0.5,"['hasn t', 'congress', 'workers rights', 'unscrupulous corporations']"
1377,RepGolden,Why hasn t Congress been able to pass laws to lower the cost of prescription drugs One reason is the massive advertisements big pharma are able to put on TV through dark money super PACs,0.19722222222222222,"['hasn t', 'congress', 'prescription drugs', 'massive advertisements', 'big pharma', 'dark money', 'pacs']"
1378,RepAndyHarrisMD,H 2B Visa Update my statement and the letter sent,0.0,['visa update']
1379,RepAndyHarrisMD,Today we remember the legacy and sacrifice of Dr Martin Luther King His unfailing love for his fellow Americans was a tremendous example for all and his efforts to ensure equal rights for all have made us a more perfect union,0.4666666666666666,"['dr martin luther king', 'tremendous example', 'equal rights', 'perfect union']"
1380,RepAndyHarrisMD,Thank you,0.0,['thank']
1381,RepAndyHarrisMD,Fake news,-0.5,['fake']
1382,RepAndyHarrisMD,I m sure you re proud of thinking that up all by yourself Dan Ad hominem attacks are all liberal socialists fall back on when they have no facts,0.43333333333333335,"['dan ad', 'hominem attacks', 'liberal socialists fall']"
1383,Call_Me_Dutch,We ve all seen the stories of rising anti Semitic and other hate crimes The forces of hatred that led to the Holocaust are resurging Now more than ever we must stand strong in our commitment to challenging bigotry wherever it arises WeRemember,0.10166666666666666,"['semitic', 'holocaust', 'challenging bigotry', 'weremember']"
