1264,RepWalorski,This modernized trade agreement will further dismantle trade barriers for manufacturers and farmers level the playing field for American workers and keep our nation s economic momentum going strong USMCA,0.15833333333333333,"['trade agreement', 'dismantle trade barriers', 'farmers level', 'american workers', 'nation s', 'economic momentum', 'usmca']"
1265,RepWalorski,With USMCA nearly across the finish line American farmers manufacturers and workers are another step closer to a historic win I was thrilled to cast my vote for USMCA last month and I couldn t be more excited to see it reach President Trump s desk,0.296875,"['usmca', 'finish line', 'american farmers manufacturers', 'usmca', 'couldn t', 'trump', 's desk']"
1266,RepWalorski,Check out my interview with Marketplace on the historic USMCA trade deal the Phase One agreement with China and how I m fighting for Hoosier farmers manufacturers and workers,0.0,"['marketplace', 'usmca', 'phase', 'china', 'hoosier', 'farmers manufacturers']"
1267,RepJimBanks,Any country that adopts Huawei will find themselves on the wrong side of the Silicon Curtain now descending Before welcoming Chinese influence freedom loving nations should look at HongKong and Taiwan and ask themselves Do we want to invite that here,0.033333333333333326,"['huawei', 'wrong side', 'silicon curtain', 'chinese influence freedom', 'hongkong', 'taiwan']"
1268,RepJimBanks,Social media users often shrug when warned that tech companies are collecting their data rifling through their photos videos This article should disabuse that naivety New tech is able to analyze your face and quickly discover your name address etc,0.25075757575757573,"['social media users', 'tech companies', 'photos videos', 'new tech', 'name address etc']"
1269,RepJimBanks, I m just a girl raining on your cute video parade with daily reminders that TikTok compromises your own security amp data,0.2125,"['cute video parade', 'daily reminders', 'tiktok', 'own security amp data']"
1270,RepJimBanks,Why in the world are Democrats allowing him to continue in his role Even the staunchest opponent of this president should at least admit that Schiff cannot be viewed as trustworthy and nonpartisan,-0.3,['schiff']
1271,RepJimBanks,And now we re learning that 4 Adam Schiff falsely stated a Lev Parnas text mentioned the President of Ukraine Zelensky when it was really the founder of Burisma Zlochevsky,-0.10000000000000003,"['re learning', 'adam schiff', 'lev parnas', 'ukraine zelensky', 'burisma zlochevsky']"
1272,RepJimBaird,This morning the first all female spacewalk occurred Congratulations to NASA astronauts Christina Koch and Jessica Meir They are an example of dreaming big working hard and staying determined I m proud of their efforts and the history they ve made,0.15166666666666667,"['female spacewalk', 'congratulations', 'nasa', 'christina koch', 'jessica meir']"
1273,RepJimBaird,Staff are hosting mobile office hours throughout the district in October Click the link below for times and locations If you need assistance with a federal agency or just want to meet our staff we encourage you to stop by,0.0,"['staff', 'mobile office hours', 'october click', 'federal agency']"
1274,RepJimBaird,Today is National POW MIA Recognition Day We must remember and honor those captured or still missing Please pause and reflect on the sacrifices made by our heroes,-0.2,"['pow mia recognition', 'please']"
1275,RepJimBaird,This Saturday our office will be conducting veteran interviews in partnership with the Library of Congress Veterans History Project If you know of a veteran who wants to share their story please let our office know Time slots are still available 317 563 5567,0.15000000000000002,"['veteran interviews', 'congress veterans history project', 'time slots']"
1276,RepJimBaird,I m proud to help support and as they work toward new discoveries and innovation in food safety for our world,0.4681818181818182,"['new discoveries', 'food safety']"
1277,SusanWBrooks,Today I had the pleasure of mtg w Mayor Alumbaugh of Mayor Eckstein of Hartford amp Mayor Rock of Gas City to discuss topics like economic development substance abuse issues in our communities veteran affairs amp more Thank you mayors for your time amp service IN05,0.2333333333333333,"['mtg w mayor', 'alumbaugh', 'eckstein', 'hartford', 'amp mayor', 'rock', 'gas city', 'economic development substance abuse issues', 'communities veteran affairs amp', 'thank', 'time amp service', 'in05']"
1278,SusanWBrooks,King sought equality amp humanrights for African Americans the economically disadvantaged amp all victims of injustice through peaceful protests Today is a time to reflect on social justice the progress our country has made amp the work we still have to do,0.14583333333333334,"['equality amp humanrights', 'peaceful protests', 'social justice']"
1279,SusanWBrooks,Today marks the 25th anniversary of the day of service that celebrates civil rights leader Martin Luther King Jr He was the most important voice of the American civil rights movement which worked for equal rights for all MLKDay,0.225,"['civil rights leader', 'martin luther king jr', 'important voice', 'american civil rights movement', 'equal rights', 'mlkday']"
1280,SusanWBrooks,Today I had the pleasure meeting w Mayor amp to discuss the important work they are doing for our communities We discussed ways to end gun violence improve infrastructure amp more Thank you Mayor Collier amp Mayor Hogsett for your hard work amp dedication,0.2027777777777778,"['pleasure meeting w mayor amp', 'important work', 'gun violence', 'infrastructure amp', 'thank', 'collier', 'amp mayor', 'hogsett', 'hard work amp dedication']"
1281,SusanWBrooks,IN rates 3rd highest in the nation for maternal mortality I m proud to introduce legislation w amp to ensure expectant mothers across the country will have better access to care w telehealth services,0.43333333333333335,"['in', 'maternal mortality', 'introduce legislation w amp', 'ensure expectant mothers', 'care w telehealth services']"
1282,RepGregPence,This MLKday we honor Dr King s tireless work for freedom and equality in our great nation and celebrate his legacy in the Civil Rights movement,0.8,"['mlkday', 'dr', 'king s tireless work', 'great nation']"
1283,RepGregPence,On this day in 1920 the Hoosier state became the 26th state to ratify the 19th Amendment Today we celebrate 100 years of women s right to vote 19thAmendment,0.2857142857142857,"['hoosier', '26th state', 'amendment', 'women s']"
1284,RepGregPence,Our freedom as Americans to practice our faith makes our nation the greatest in the world Today we honor our commitment to the First Amendment amp vow to protect our fundamental right of freedom of religion I d like to wish everyone of faith a happy NationalReligiousFreedomDay,0.5839285714285714,"['amendment', 'amp vow', 'fundamental right', 'nationalreligiousfreedomday']"
1285,RepGregPence,Signing USMCA into law will bring billions to our nation amp thousands of jobs for Americans a huge win for our farmers It s about time Congress got to the People s work instead of impeachment circus I applaud s dedication to our farmers amp manufacturers,0.6000000000000001,"['signing usmca', 'nation amp thousands', 'congress', 'people s work', 'impeachment circus', 's dedication', 'farmers amp manufacturers']"
1286,RepGregPence,I give my wholehearted support for the upcoming MarchForLife rallies taking place across the nation next week It is our duty to speak for those who cannot speak for themselves I am unwaveringly pro life and always will be,0.0,"['marchforlife', 'pro life']"
1287,RepAndreCarson,Say it again for the folks in the back,0.0,['say']
1288,RepAndreCarson,It was great to see s and many other folks at today s fundraiser for which was recently damaged by a fire This restaurant and its owners the Wilson Family have given so much to our community and now we must all unite to help them rebuild,0.275,"['s fundraiser', 'wilson']"
1289,RepAndreCarson, The Impeachment Trial of President Donald John Trump,0.0,"['impeachment trial', 'donald john trump']"
1290,RepAndreCarson,and at the where we heard from Kevin Richardson one of the Exonerated Five We must continue to right the wrongs of the past as Dr King did,0.01785714285714285,"['kevin richardson', 'exonerated', 'dr']"
1291,RepAndreCarson,It was an honor to gather with fellow Hoosiers to celebrate MLKDay at the Indiana Christian Leadership Conference s MLK birthday celebration at St John s Missionary Baptist Church,0.0,"['hoosiers', 'mlkday', 'indiana christian', 'conference s', 'mlk', 'birthday celebration', 'st john', 'baptist']"
1292,RepLarryBucshon,It was great to be back in the cath lab today to observe an innovative valve replacement procedure Innovation and technology advancements in healthcare are improving outcomes and helping lower costs,0.43333333333333335,"['cath lab', 'innovative valve replacement procedure', 'innovation', 'technology advancements']"
1293,RepLarryBucshon, US President spoke at wef20 telling the audience the United States is in the midst of an economic boom Find o,0.2,"['us president', 'economic boom', 'find']"
1294,RepLarryBucshon,Today at the University of Southern Indiana MLK Day luncheon in Evansville A great event as always honoring the life and legacy of Dr Martin Luther King Jr,0.4,"['indiana mlk', 'day luncheon', 'evansville', 'great event', 'dr martin luther king jr']"
1295,RepLarryBucshon,Today we honor the life and legacy of Dr Martin Luther King Jr Read this letter,0.0,['dr martin luther king jr read']
1296,RepLarryBucshon,Great news for Southwest Indiana,0.8,"['great news', 'indiana']"
1297,RepTrey,As companies grow employers are offering the necessary training to fill their open jobs and help employees succeed for the long term,-0.016666666666666666,"['necessary training', 'open jobs', 'long term']"
1298,RepTrey,Like many here in Indiana manufacturers across the country are set to increase spending on training programs as high skilled high paid manufacturing jobs are on the rise in our booming economy,0.33,"['indiana', 'training programs']"
1299,RepTrey, Professor Mandy Rispoli right is meeting with Indiana Senators and Indiana members of Congress in DC to discuss the shorta,0.2857142857142857,"['professor mandy rispoli', 'indiana', 'indiana', 'congress', 'dc']"
1300,RepTrey,Passed the Senate USMCA is one step closer to becoming law and providing economic certainty for Hoosier farmers and manufacturers This updated trade deal is a win for Indiana and our American economy On to the desk,0.36250000000000004,"['passed', 'usmca', 'economic certainty', 'hoosier', 'indiana', 'american economy']"
1301,RepTrey, mandres Always a pleasure meeting with and talking about Hoosiers with disabilities and special education teachers https,0.35714285714285715,"['pleasure meeting', 'hoosiers', 'special education teachers https']"
1302,RepDavids,We re not letting a little weather get us down join us this afternoon for a roundtable discussion on the importance of early childhood education Please note even if reserved tickets are sold out you are still welcome to attend,0.13923611111111112,"['roundtable discussion', 'early childhood education', 'please']"
1303,RepDavids,Glad to recognize our one of our Congressional App Challenge winners Samuel of His team s app compiles life saving texting and calling hotlines for those in crisis The work of students like Samuel is making a difference in KS03 and beyond,0.5,"['glad', 'app challenge', 'samuel', 'team s app compiles life', 'samuel', 'ks03']"
1304,RepDavids, Each generation helps the other evolving what can be will be amp must be innovation happens here An honor to be a part,-0.125,[]
1305,RepDavids,The epidemic of missing and murdered indigenous women has gone unnoticed for far too long While that may be slowly changing our work to keep Native women amp girls safe is far from over I ll keep pushing for bills like VAWA to address this issue,-0.007142857142857161,"['indigenous women', 'native', 'women amp girls', 'vawa']"
1306,RepDavids,Today marks 10 years since the disastrous CitizensUnited decision which gave special interests near unlimited ability to influence our elections I voted for H R 1 to end the dominance of big money in politics caused by this decision amp return power to the people,-0.0607142857142857,"['citizensunited', 'special interests', 'h r', 'big money', 'decision amp return power']"
1307,RepRonEstes,Responding to US pressure this week I m glad France has yielded on its digital tax on American companies As I write in today s American tech innovation is the envy of the world but shouldn t be subject to double taxation by other governments,0.029761904761904767,"['responding', 'us pressure', 'france', 'digital tax', 'american companies', 'american tech innovation', 'shouldn t', 'double taxation']"
1308,RepRonEstes,2 2 Today laid off workers from any industry can visit to discover information on finding a job training education community resources health care and more Together we are working to keep our world class workforce here in KS AirCapitaloftheWorld,0.5,"['job training education community resources health care', 'together', 'world class workforce', 'ks aircapitaloftheworld']"
1309,RepRonEstes,Kansans are known for standing together as a family The Air Capital Commitment is our way to support those affected by the Boeing 737 MAX production suspension One specific effort is a newly launched webpage providing streamlined information and resource connections 1 2,0.06818181818181818,"['kansans', 'capital commitment', 'boeing', 'max', 'production suspension', 'specific effort', 'resource connections']"
1310,RepRonEstes,FLASHBACK Last year I wrote about why the US needed to challenge France s digital tax on American companies I m glad to see the strategy by and working as France has now paused on its digital tax,0.1,"['flashback', 'france', 's digital tax', 'american companies', 'france', 'digital tax']"
1311,RepRonEstes,As I have done from the start I ll continue to support s efforts to push back against unfair digital taxes on US tech companies and encourage world leaders to work together on an international resolution,-0.125,"['support s efforts', 'unfair digital taxes', 'us tech companies', 'world leaders', 'international resolution']"
1312,RepGuthrie, Congrats to senior Sean Hogan on receiving his appointment to the US Naval Academy,0.0,"['congrats', 'sean hogan', 'naval']"
1313,RepGuthrie, E amp C GOP Leader and request info on efforts and barriers to Alzheimer s Dis,0.0,"['amp c gop leader', 'request info', 'alzheimer', 'dis']"
1314,RepGuthrie,This morning I m leading a Oversight and Investigations Subcommittee hearing on state efforts to combat the opioid crisis Watch live at 10 am ET 9 am CT,0.13636363636363635,"['oversight', 'investigations subcommittee', 'state efforts', 'opioid crisis', 'watch', 'et', 'ct']"
1315,RepGuthrie, BREAKING News E amp C GOP Leader and press top opioid manufacturers for answe,0.5,"['breaking', 'amp c gop leader', 'press top opioid manufacturers']"
1316,RepGuthrie,I just voted no on Speaker Pelosi s War Powers Resolution that would undermine President Trump s authority Read my full statement,0.35,"['pelosi', 's war', 'powers resolution', 'trump', 's authority', 'read', 'full statement']"
1317,RepJohnYarmuth, It can take families generations to overcome the effects of economic inequality We need to take steps NOW to create a,0.2,"['families generations', 'economic inequality', 'now']"
1318,RepJohnYarmuth, Trump s lawyer asked Why are we here We are here sir because President Trump solicited foreign interference in the 202,-0.125,"['trump', 's lawyer', 'trump', 'foreign interference']"
1319,RepJohnYarmuth, Before I was a member of Congress I was an American soldier serving in Iraq and Afghanistan So when we talk about troo,0.0,"['congress', 'american soldier', 'iraq', 'afghanistan']"
1320,RepJohnYarmuth, Trump s lawyer claimed the House isn t ready to present our case We re ready The House calls John Bolton to testify,0.13333333333333333,"['trump', 's lawyer', 'house isn t', 'house calls', 'john bolton']"
1321,RepJohnYarmuth, FACT CHECK President Trump s counsel lied when he said the President wasn t allowed to participate in Judiciary impeac,0.0,"['fact check', 'trump', 's counsel', 'president wasn t', 'judiciary']"
1322,RepThomasMassie,Congrats Henry County They re saying this was the biggest fiscal court meeting in 20 years I fully support this 2A movement in Kentucky,0.0,"['congrats henry', 'fiscal court meeting', '2a movement', 'kentucky']"
1323,RepThomasMassie,Uh yeah,0.0,['uh']
1324,RepThomasMassie,I support the citizens of Virginia who peacefully petitioned their government I plan to attend the Second Amendment rally in Frankfort Kentucky on January 31st,0.125,"['virginia', 'amendment', 'frankfort kentucky', 'january']"
1325,RepThomasMassie, Sheriff Richard Vaughan of Grayson County VA If the bills go through as proposed they will not be enforced They a,0.0,"['richard vaughan', 'grayson', 'va']"
1326,RepThomasMassie,Love this sign hat tip to Boaz s FB page,0.5,"['love', 'hat tip', 'boaz', 'fb']"
1327,RepHalRogers,3 3 President Trump rightfully stood firm against tyranny sending a clear message that no nation should tolerate Iran s destructive and destabilizing behavior and I pray that we can continue forward with efforts to deescalate tensions in the Middle East,-0.175,"['trump', 'clear message', 'iran', 's destructive', 'deescalate tensions']"
1328,RepHalRogers,2 3 I was relieved along w the rest of America to know that none of our troops were wounded by Iran s retaliating strikes Clearly Iran has improved its military force and missile range amp we must remain vigilant in our efforts to demonstrate our nation s strong sovereignty,0.14444444444444443,"['america', 'iran', 'clearly iran', 'military force', 'missile range amp', 'nation s', 'strong sovereignty']"
1329,RepHalRogers,After receiving a briefing this afternoon from the head of Joint Chiefs the Dept of Defense the CIA and State Department I feel reassured that President Trump s fortitude with Iran is appropriate and necessary 1 3,0.25,"['joint chiefs', 'dept', 'cia', 'state department', 'trump', 's fortitude', 'iran']"
1330,RepHalRogers,Soleimani ordered the killings of Americans and facilitated the siege of our embassy in Iraq With this enemy of our country and our democracy now vanquished I hope Iran appreciates the strength of our military as well our desire for peace and stability in the Middle East,-0.05,"['soleimani', 'iraq', 'iran']"
1331,RepHalRogers,From our family to yours have a very Merry Christmas and a Happy New Year,0.37878787878787873,"['merry christmas', 'happy', 'new year']"
1332,RepAndyBarr,I ll be live with this morning at 9 a m on Tune in at 590 AM or online at,0.13636363636363635,[]
1333,RepAndyBarr,I enjoyed meeting with Fayette Commonwealth s Attorney Lou Anna Red Corn today to discuss how our offices can work together on issues including the drug epidemic and child advocacy centers,0.25,"['fayette commonwealth', 's attorney', 'lou anna', 'corn', 'drug epidemic', 'child advocacy centers']"
1334,RepAndyBarr,I was happy to have the opportunity to attend the Lexington Unity Breakfast this morning to celebrate the life and legacy of Dr King MLKDAY2029,0.8,"['lexington unity breakfast', 'dr', 'mlkday2029']"
1335,RepAndyBarr,I was honored to be part of Right to Life of Central Kentucky s 14th annual Vigil for Life held at Faith United Community Church in Nicholasville,0.14285714285714285,"['right', 'kentucky', 'vigil', 'faith', 'community church', 'nicholasville']"
1336,RepAndyBarr,I was proud to discuss the work of to reduce hunger for veterans in Kentucky during a recent HVAC hearing,0.4,"['kentucky', 'hvac']"
1337,SteveScalise, Not the Senate s job to mop up the mess made in the House by the Democrats Biden admitted that he went to Ukraine an,-0.175,"['senate s job', 'biden', 'ukraine']"
1338,SteveScalise, That s what this ImpeachmentSham is all about,0.0,['impeachmentsham']
1339,SteveScalise,There it is folks A Democrat Impeachment Manager admitted the reason they re doing this is because going to court wouldn t have been quick enough to get this done before the election Now we know why we re really here So Dems can try to rig the 2020 election,0.17777777777777778,"['democrat impeachment', 'court wouldn t', 'dems']"
1340,SteveScalise,Looks like Dems got all the way to the Senate before realizing their phony case doesn t hold up when they can t rig the rules Let s be clear It s not the Senate s job to mop up Schiff s mess,-0.037499999999999985,"['looks', 'dems', 'phony case doesn t hold', 'senate s job', 'schiff', 's mess']"
1341,SteveScalise, if you re fed up with Democrats being so obsessed with tearing down that they re willing to tear America apart to do it,-0.13518518518518519,['america']
1342,RepRichmond, Today we honor a true patriot civil rights leader and American icon Dr Martin Luther King Jr inspires us every d,0.175,"['true patriot', 'civil rights leader', 'american icon', 'dr martin luther king jr']"
1343,RepRichmond,Dr Martin Luther King Jr lived his life in service to others through the practice of peace and social justice Let not only today but everyday serve as a reminder to honor him by following the footsteps of one of our world s foremost visionaries MLK2020,-0.04166666666666667,"['dr martin luther king jr', 'social justice', 'world s foremost visionaries', 'mlk2020']"
1344,RepRichmond, Proud to join to introduce a resolution com,0.8,"['proud', 'resolution com']"
1345,RepRichmond,She sure is my friend What a historic week it s been for New Orleans and all of Louisiana,0.21212121212121213,"['historic week', 'orleans', 'louisiana']"
1346,RepRichmond, New Orleans is used to setbacks but we keep fighting We never give up And we always always bounce back Steve that,0.06818181818181818,"['orleans', 'steve']"
1347,RepClayHiggins,I m honored to receive an A rating from for my ProLife voting record My office will continue fighting to protect the unborn and to advance pro life legislation in Congress,0.0,"['prolife', 'pro life legislation', 'congress']"
1348,RepClayHiggins,Darkness cannot drive out darkness only light can do that Hate cannot drive out hate only love can do that Martin Luther King Jr,-0.1166666666666667,"['darkness', 'hate', 'martin luther king jr']"
1349,RepClayHiggins,has taken historic action to address unfair Chinese trading practices and level the playing field for American industry The Phase One agreement is a major win for Louisiana farmers and businesses,0.06607142857142857,"['historic action', 'american industry', 'phase', 'louisiana']"
1350,RepClayHiggins, We heard that and might be interested in tonight s CFBPlayoff Championship game Who w,-0.07500000000000001,"['cfbplayoff championship', 'who']"
1351,RepClayHiggins, While Democrats are busy obsessing with their partisan impeachment scam American workers are winning and the American econ,0.15,"['partisan impeachment scam', 'american workers', 'american econ']"
1352,RepMikeJohnson, Another bombshell turns out to be a dud Adam Schiff ought to prove he can manage basic facts before he tries to mana,-0.05,"['adam schiff', 'basic facts']"
1353,RepMikeJohnson, New Impeachment Video The Senate Exists for Moments Like This HoldTheLine,0.13636363636363635,"['impeachment video', 'exists', 'holdtheline']"
1354,RepMikeJohnson,Another bombshell turns out to be a dud Adam Schiff ought to prove he can manage basic facts before he tries to manage an impeachment Kudos to and for bringing this mischaracterization of the Parnas evidence to light,0.10000000000000002,"['adam schiff', 'basic facts', 'kudos', 'parnas']"
1355,RepMikeJohnson, HANNITY NOW Wall to wall coverage of today s Senate impeachment trial Reaction from,0.0,"['hannity now wall', 'wall coverage', 's senate impeachment trial']"
1356,RepMikeJohnson,LIVE TV ALERT I ll be joining on Fox News at 9 20pm ET 8 20pm CT to discuss the ImpeachmentTrial,0.13636363636363635,"['live', 'alert', 'fox', 'et', 'ct', 'impeachmenttrial']"
1357,RepAbraham,Today we pause to celebrate the contributions of Dr Martin Luther King Jr who dedicated his life to giving a voice to those struggling to be heard,0.0,['dr martin luther king jr']
1358,RepAbraham,What a privilege it was to fly with President on Air Force One to see our Tigers win the National Championship,0.8,"['air force', 'tigers', 'championship']"
1359,RepAbraham,Mr Willie Belton was a respected political leader war veteran amp civil rights leader who marched with Dr Martin Luther King Jr He was awarded the Bronze Star amp Purple Heart for heroism in the Korean War amp the Louisiana Medal of Honor for community service May he rest in peace,0.0,"['mr willie belton', 'political leader war veteran amp', 'civil rights leader', 'dr martin luther king jr', 'bronze', 'star amp', 'purple heart', 'korean', 'war amp', 'louisiana medal', 'community service', 'may']"
1360,RepAbraham,I spoke to last night about the President s new trade deal with China and the Democrats ongoing impeachment charade They ve been trying to unseat him for three years but he just keeps on WINNING,0.21212121212121213,"['president s', 'new trade', 'china', 'impeachment charade', 'winning']"
1361,RepAbraham,Congratulations to on signing his phase one trade deal with China today and shame on do nothing Nancy for trying to upstage it with her impeachment nonsense,0.0,"['congratulations', 'china', 'nancy', 'impeachment nonsense']"
