628,DorisMatsui,PFAS chemicals have been linked to cancer and impaired child development For years the EPA has failed to regulate forever chemicals like PFAS and Congress historic action on this bill is a critical action to address this public health challenge,-0.05000000000000001,"['pfas', 'child development', 'epa', 'pfas', 'congress', 'historic action', 'critical action', 'public health challenge']"
629,DorisMatsui,Today I proudly voted to pass H R 535 the PFAS Action Now Act This is a monumental step forward to protect the public from dangerous health harming PFAS chemicals found in our air and water,0.07500000000000001,"['h r', 'pfas', 'monumental step', 'dangerous health', 'pfas']"
630,RepBera,Reminder I m hosting my first CA07 town hall of the year TONIGHT I hope to see you there,0.25,"['reminder', 'ca07', 'town hall', 'tonight']"
631,RepBera,President Trump has made 901 false or misleading claims related to healthcare since taking office three years ago,-0.20000000000000004,['trump']
632,RepBera,Congratulations to graduate Alyssa Nakken on becoming the first female coach in history The are lucky to have you,0.2583333333333333,"['congratulations', 'alyssa nakken', 'female coach']"
633,RepBera,I was proud to vote for HR1 the For the People Act This one in a generation legislative package ends the dominance of big money in politics and ensures clean and fair elections ForThePeople,0.4666666666666667,"['hr1', 'people act', 'legislative package ends', 'big money', 'fair elections', 'forthepeople']"
634,RepBera,Today marks 10 yrs since the CitizensUnited decision I m proud to receive an A from End Citizens United for my efforts to strengthen our democracy by getting big money out of politics Special interests shouldn t be able to drown out the voices of American families,0.33142857142857146,"['citizensunited', 'big money', 'special interests shouldn t', 'american families']"
635,RepPaulCook,I strongly condemn this act of racism against the Sikh Center in Orangevale CA As Vice Chair of the American Sikh Caucus I recognize that we must be vigilant and stand united against those who seek to divide us with prejudice and hate Our country has no place for racism,-0.1166666666666667,"['sikh', 'orangevale ca', 'chair', 'sikh caucus']"
636,RepPaulCook,After attending a bipartisan briefing on Iraq and Iran this afternoon I released the following statement,0.0,"['iraq', 'iran']"
637,RepPaulCook,3 3 The government of Iran is the number one sponsor of terrorism worldwide and we must proceed cautiously while remaining resolute in protecting our country and in defending freedom,0.0,"['iran', 'terrorism worldwide']"
638,RepPaulCook,2 3 Soleimani ran Iran s terrorist Quds Force for over a decade and has orchestrated countless terror attacks including the attack on the American Embassy in Baghdad earlier this week,0.0,"['soleimani', 'iran', 's terrorist', 'quds', 'countless terror attacks', 'american embassy', 'baghdad']"
639,RepPaulCook,1 3 The Pentagon reports that the U S military has killed General Qassem Soleimani a brutal terrorist responsible for the deaths of hundreds of American service members and killing thousands of civilians in Iraq Syria and across the Middle East,-0.13214285714285715,"['pentagon reports', 'qassem soleimani', 'brutal terrorist', 'american service members', 'iraq syria']"
640,RepMcNerney, On this MLKDay we honor the legacy of a great man whose voice transformed the lives of people all around the world,0.8,"['mlkday', 'great man']"
641,RepMcNerney,This year marks the 25th anniversary of the day of service that honors Dr Martin Luther King Jr As we celebrate his life and the contributions he made to our nation I hope you ll join me in recommitting to finding ways to best serve our own community,0.8,"['year marks', 'dr martin luther king jr', 'own community']"
642,RepMcNerney,Next Thursday January 23rd I ll be hosting an open house event at my Antioch office from 6 00 7 30 PM I m looking forward to hearing from you about the issues that are important to our community,0.13333333333333333,"['january', 'open house event', 'antioch', 'pm']"
643,RepMcNerney,I ll be hosting the an open house event at my Stockton office next Wednesday January 22nd from 6 00 7 30 PM Hope to see you there,0.0,"['open house event', 'stockton', 'january', 'pm hope']"
644,RepMcNerney,The climatecrisis is the greatest threat of our time We need bold action and that s why I m proud to join my E amp C colleagues to announce our CLEANfuture proposal,0.5583333333333333,"['bold action', 'amp c colleagues', 'cleanfuture']"
645,RepJoshHarder,TOMORROW I ll be hosting my first one on one meetings of the new year Come and check off your meet my Representative resolution,0.19318181818181818,"['tomorrow', 'new year', 'representative resolution']"
646,RepJoshHarder,Washington is a disgusting cesspool and it s only gotten worse since the Citizens United decision opened the floodgates for dark money It s time to clean this place up,-0.23666666666666664,"['dark money', 's time']"
647,RepJoshHarder,Homelessness is an emergency right now and it s only getting worse The time to solve it is now,-0.038095238095238106,['homelessness']
648,RepJoshHarder,In case you missed it We need to treat the homelessness crisis as the emergency it is Read my plan,0.0,"['homelessness crisis', 'read']"
649,RepJoshHarder,Health care costs just keep skyrocketing The Senate needs to take up our bill to lower drug costs NOW,0.0,"['health care costs', 'senate needs', 'drug costs', 'now']"
650,RepDeSaulnier,47 years ago the Supreme Court upheld a woman s constitutional right to choose Since then countless attacks have been launched against women s reproductive freedom I will continue to fight for access to health care for all women RoevWade,0.14285714285714285,"['supreme court', 'woman s', 'constitutional right', 'countless attacks', 'women s reproductive freedom', 'health care', 'roevwade']"
651,RepDeSaulnier,Thank you to and for hosting student town halls today I enjoyed answering such thoughtful and inspiring questions,0.35,"['thank', 'student town halls', 'such thoughtful']"
652,RepDeSaulnier,Join and me this Thursday at Alhambra High School for the latest updates on the impeachment of President Trump RSVP,0.33,"['join', 'alhambra', 'high school', 'trump rsvp']"
653,RepDeSaulnier,The influence of money in politics is a threat to our democracy On the 10th Anniversary of CitizensUnited we must continue to fight for meaningful campaign finance reform to make our government more equitable transparent and accountable ForThePeople,0.5,"['citizensunited', 'meaningful campaign finance reform', 'equitable transparent', 'forthepeople']"
654,RepDeSaulnier,Today the Senate opened the impeachment trial of President Trump Watch live at the link below,0.13636363636363635,"['impeachment trial', 'trump watch']"
655,SpeakerPelosi, The House came to fight for a trial that is fair to the American people The White House strategy hear no evil see no,0.3,"['american people', 'white house strategy']"
656,SpeakerPelosi, The second article of impeachment was for obstruction of Congress covering up witnesses and documents from the American,0.0,['congress']
657,SpeakerPelosi,President Trump confessed and then he tried to cover it up Remember how we got here and why we need to DefendOurDemocracy,0.0,"['trump', 'remember', 'defendourdemocracy']"
658,SpeakerPelosi,Tonight our bipartisan delegation concluded our visit to Poland by laying roses at the last remaining portion of the Ghetto Wall in Krakow s Jewish quarter to honor the victims and survivors of the Holocaust,0.0,"['bipartisan delegation', 'poland', 'ghetto wall', 'krakow', 'jewish quarter', 'holocaust']"
659,SpeakerPelosi,The House has filed a brief in the Fourth Circuit Court of Appeals condemning the Trump Admin s use of government initiatives to stoke a campaign of fear amp discrimination against America s immigrant communities Read my full statement here,0.11666666666666665,"['fourth', 'circuit court', 'trump admin', 'government initiatives', 'amp discrimination', 'america', 's immigrant communities', 'read', 'full statement']"
660,RepBarbaraLee,The American people deserve a real trial not a cover up DefendOurDemocracy,0.1,"['american people deserve', 'real trial', 'defendourdemocracy']"
661,RepBarbaraLee,For the first time in US History an aircraft carrier has been named after an African American Doris Miller was a hero to thousands and exemplified courage in the face of adversity This is a well deserved honor,0.08333333333333333,"['history', 'aircraft carrier', 'african', 'doris miller']"
662,RepBarbaraLee,We could have spent this money on teachers or Pell Grants or health care for veterans but instead Trump is wasting taxpayer funds on his ridiculous and xenophobic wall NoWall,-0.21666666666666667,"['pell grants', 'health care', 'trump', 'taxpayer funds', 'xenophobic wall', 'nowall']"
663,RepBarbaraLee,When we allow our elections to be controlled by a few wealthy donors we compromise the agency of the American people in choosing our leaders We need to restore our democracy and overturn CitizensUnited,0.09999999999999999,"['wealthy donors', 'american people', 'citizensunited']"
664,RepBarbaraLee,The American people deserve to hear the truth but Mitch McConnell is determined to cover up Trump s crimes We need an open and honest process in the light of day not a rushed trial hidden from the public DefendOurDemocracy,0.1388888888888889,"['american people deserve', 'mitch mcconnell', 'trump', 's crimes', 'honest process', 'defendourdemocracy']"
665,RepSpeier,Those who ve waged war on abortion rights have seen our power as we took to the streets for the Women s March and we marched to the ballot box in 2018 Get ready for 2020 because we will not go back,0.1,"['abortion rights', 'march', 'ballot box']"
666,RepSpeier,On the 47th anniversary of RoevWade the fight for abortion rights is as critical as ever SCOTUS will hear a case on Louisiana s draconian admitting privileges that would leave only 1 clinic amp 1 doctor to provide all abortions Dozens of other states have equally backward laws,-0.03125,"['47th anniversary', 'roevwade', 'abortion rights', 'scotus', 'louisiana', 's draconian', 'clinic amp', 'dozens', 'backward laws']"
667,RepSpeier,Sekulow just told bald faced lies to the Chief Justice of the Supreme Court Republicans WERE allowed in the SCIF I was there Many Rs CHOSE not to show up,0.5,"['sekulow', 'supreme court', 'were', 'scif', 'rs chose']"
668,RepSpeier,Bolton s evidence will come out it s just a question of when History AND voters will remember what the Senate does or doesn t do in the coming days SenateImpeachmentTrial,0.0,"['bolton', 's evidence', 'history and', 'doesn t', 'senateimpeachmenttrial']"
669,RepSpeier,This MLKDay2020 let us look to Dr King s example as a beacon of light who inspires us to be our best despite those seeking to divide us As Dr King wisely intoned Darkness cannot drive out darkness only light can do that Hate cannot drive out hate only love can do that,0.1555555555555555,"['mlkday2020', 'dr', 'king s example', 'dr', 'darkness', 'hate']"
670,RepSwalwell, President Trump confessed and then he tried to cover it up Remember how we got here and why we need to DefendOurDemocr,0.0,"['trump', 'remember', 'defendourdemocr']"
671,RepSwalwell, America won t get a fair trial if witnesses don t testify tells And I think that s what s m,0.7,"['america', 'fair trial', 'witnesses don t', 's m']"
672,RepSwalwell, I grew up reading about show trials in authoritarian nations abroad I didn t expect to see one of our two major parties e,0.0625,"['show trials', 'authoritarian nations', 'didn t', 'major parties e']"
673,RepSwalwell, This is an impeachment case against the President The most important documents are going to be at the White House The,0.3,"['impeachment case', 'important documents', 'white house']"
674,RepSwalwell, The misconduct set out in those articles is the most serious ever charged against a president begins th,0.08333333333333334,[]
675,RepJimCosta,I m hopeful this state initiative can build on the work we ve already done to transform lives and help our vulnerable populations find a safe place to call home,0.0,"['state initiative', 'vulnerable populations', 'safe place']"
676,RepJimCosta,More recently I led the effort to secure 2 billion in grants loans and related assistance for rural housing projects in the December 18 2019 spending bill and cosponsored fellow Valley Rep Josh Harder s bill to funnel additional federal money to resolve the homeless crisis,0.13333333333333333,"['grants loans', 'december', 'fellow valley', 'rep josh harder', 's bill', 'additional federal money', 'homeless crisis']"
677,RepJimCosta,By securing money for the Veterans Affairs Supportive Housing program we ve also been successful in significantly reducing the number of homeless veterans in Fresno and Merced,0.5416666666666666,"['veterans', 'supportive', 'housing program', 'homeless veterans', 'fresno', 'merced']"
678,RepJimCosta,Throughout my career I ve worked to combat homelessness both in the CA State Legislature and here in Congress I ve helped secure tens of millions of federal dollars to address this issue through programs like Continuum of Care and various other HUD initiatives,0.09166666666666667,"['throughout', 'ca', 'state legislature', 'congress', 'federal dollars', 'continuum', 'care', 'hud']"
679,RepJimCosta,Homelessness in the Valley is a persistent crisis I welcome Governor Newsom s announcement of 11 5 million in emergency grants to tackle homelessness in Fresno and salute him for another strong signal of his commitment to the Valley,0.6166666666666667,"['homelessness', 'persistent crisis', 'newsom', 's announcement', 'emergency grants', 'fresno', 'strong signal']"
680,RepRoKhanna,Yesterday we watched the president s lawyers try to get clever sound bites from personal attacks and propaganda are laying out a reasoned facts based legal argument for a fair trial,0.22777777777777777,"['yesterday', 'president s lawyers', 'sound bites', 'personal attacks', 'legal argument', 'fair trial']"
681,RepRoKhanna,Reproductive rights are human rights 47 years after RoevWade we shouldn t have to keep repeating that undeniable truth,0.0,"['reproductive', 'human rights', 'roevwade', 'shouldn t', 'undeniable truth']"
682,RepRoKhanna,Thank you to everyone who came out yesterday to our MedicareForAll town hall Every American should have quality affordable health care Medicare for all is going to get us there,0.0,"['thank', 'medicareforall', 'town hall', 'affordable health care', 'medicare']"
683,RepRoKhanna, town hall tonight at the Newark Pavilion in Newark Jan 21 at 7 30pm CA17,0.0,"['town hall', 'newark pavilion', 'newark jan', 'ca17']"
684,RepRoKhanna,Prosecuting reporters for doing their work will have chilling effect on journalism across the world I m crafting legislation to protect journalists from being prosecuted over their published work,-0.5,['prosecuting']
685,RepAnnaEshoo,Today is the only federal holiday designated as a national day of service It is only appropriate that we honor Dr King by encouraging all Americans to volunteer to improve their communities Thank you to all the volunteers in San Jose today who embraced the spirit of Dr King,0.16666666666666666,"['federal holiday', 'national day', 'dr', 'thank', 'san jose', 'dr']"
686,RepAnnaEshoo, It s NationalBiotechnologyMonth We re using biotech for new space solutions is researching how to grow p,0.13636363636363635,"['nationalbiotechnologymonth', 'new space solutions']"
687,RepAnnaEshoo,has delivered on our ForThePeople agenda at every step The House passed over 400 bills last year More than 275 are bipartisan They re sitting on s desk Perhaps you two will go down as the laziest Senate Majority Leader and President in history,0.11481481481481481,"['forthepeople', 's desk', 'laziest senate', 'majority']"
688,RepAnnaEshoo,It s about time Congress exercised its war powers authority under the Constitution This is long overdue,-0.05,"['congress', 'war powers authority', 'long overdue']"
689,RepAnnaEshoo, Today and wrote the calling on the agency to updat,0.0,[]
690,RepZoeLofgren, Democratic Rep Zoe Lofgren is working her third impeachment,0.0,['rep zoe lofgren']
691,RepZoeLofgren, Congress and the American people deserve the full truth There is no plausible reason why any wouldn t want to hear all of,0.033333333333333326,"['american people deserve', 'full truth', 'plausible reason', 'wouldn t']"
692,RepZoeLofgren,Impeachment is a grave amp solemn matter It s a stress test for our democracy I hope every Senator is prepared to seriously consider amp vote honestly with an open mind for the future of our democracy 3 3,0.06666666666666667,"['impeachment', 'grave amp solemn matter', 'stress test', 'amp vote', 'open mind']"
693,RepZoeLofgren,As the only member of Congress who has participated as part of the Judiciary Committees for all three modern impeachment proceedings I must be clear that this is not something I sought or relish 2 3,0.10000000000000002,"['congress', 'judiciary', 'modern impeachment proceedings']"
694,RepZoeLofgren,It is with honor amp determination that I accept this responsibility to fulfill my oath of office to hold the president accountable as an impeachment manager alongside amp 1 3,0.0,"['honor amp determination', 'impeachment manager']"
695,RepJimmyPanetta,Today marks 47 years since the Supreme Court decided RoevWade ensuring that a woman s reproductive health decisions are her own As a member of the Pro Choice Caucus I am committed to defending a woman s right to choose and to protecting access to health care,0.44285714285714284,"['supreme court', 'roevwade', 'woman s reproductive health decisions', 'pro', 'caucus', 'woman s', 'health care']"
696,RepJimmyPanetta,Congress and the American people need a full accounting of what happened at Al Asad Air Base,-0.15000000000000002,"['american people need', 'al asad', 'base']"
697,RepJimmyPanetta,Nearly a year ago I voted to pass HR1 the ForThePeople Act to honor our promise to get dark money out of politics I am also a proud co sponsor of the DemocracyForAll amendment to EndCitizensUnited We must ensure that our government works for the people,0.25,"['hr1', 'forthepeople', 'dark money', 'proud co sponsor', 'democracyforall', 'endcitizensunited']"
698,RepJimmyPanetta,Today marks ten years since the Supreme Court s Citizens United decision which allows groups with hidden agendas even foreign actors to influence elections without disclosing their political donations We must EndCitizensUnited,-0.07291666666666666,"['supreme court s', 'foreign actors', 'political donations', 'endcitizensunited']"
699,RepJimmyPanetta,Covered California s open enrollment closes on January 31st Enroll here,0.0,"['covered california', 'enrollment closes', 'january', 'enroll']"
700,RepTjCox,Congratulations to Kern County and the Salvation Army on their recent grant funding from California s HCD for the Emergency Solution Grants Program This funding will help meet the needs to combat homelessness in the Central Valley,0.0,"['congratulations', 'kern', 'salvation army', 'recent grant', 'california', 'hcd', 'emergency solution grants program', 'central valley']"
701,RepTjCox,I am humbled and honored to recognize the anniversary of this tragedy It is crucial that we recognize injustices of the past and stand up for the Armenians who suffered in Baku 30 years ago,-0.125,"['armenians', 'baku']"
702,RepTjCox,The Senate has stalled 275 bipartisan bills passed by the House and over 80 of the total bills we ve passed It s been an honor to work for the people of the Central Valley throughout this year but we need the Senate to do their job workingforthepeople,0.0,"['bipartisan bills', 'total bills', 'central valley', 'job workingforthepeople']"
703,RepTjCox,Our country is better today thanks to his inspiration and sacrifice Thank you to all who honor the life of Dr King through acts of service today MLK2020,0.35,"['thank', 'dr', 'mlk2020']"
704,RepTjCox,Today our nation unites to celebrate a great American leader whose courage moved our nation toward a more perfect union Dr King inspired a movement that changed the course of American history,0.45999999999999996,"['nation unites', 'great american leader', 'perfect union', 'dr', 'american history']"
705,RepDevinNunes,With USMCA s passage moving forward in the Senate secures another vital trade deal today with China Highlights include China s purchase of 200 billion of U S goods and promises to remedy issues like intellectual property theft,0.2,"['usmca', 's passage', 'senate secures', 'vital trade', 'china highlights', 'china', 's purchase', 's goods', 'intellectual property theft']"
706,RepDevinNunes,Catch my interview with from earlier today to hear my thoughts on the strike against Iran Quds Force commander Qassem Soleimani,0.0,"['iran quds', 'force commander', 'qassem soleimani']"
707,RepDevinNunes,After a year of delays the House has passed USMCA to help American workers and farmers Deepest thanks to and for fighting to get this vital deal to the finish line,0.10000000000000002,"['usmca', 'american workers', 'deepest', 'finish line']"
708,RepDevinNunes,Lower taxes higher wages and greater investment in our economy The Tax Cuts and Jobs Act has been a roaring success,0.35000000000000003,"['lower', 'cuts', 'jobs']"
709,RepDevinNunes,Better late than never House Democrats finally join and agree to pass USMCA Thank you to and for negotiating a strong deal that will deliver great economic benefits to American workers and farmers,0.23333333333333334,"['usmca thank', 'great economic benefits', 'american workers']"
710,GOPLeader,President Trump has the best squad to push back against this sham impeachment Give them a follow Jordan,0.26666666666666666,"['trump', 'sham impeachment', 'jordan']"
711,GOPLeader, The American people should know there s a 3rd option when it comes to addressing climate change It s not the absurd G,-0.16666666666666666,['american people']
712,GOPLeader,While Chairman Nadler wastes taxpayer time on a partisan impeachment sham he is failing to do his actual job on the Judiciary Committee The Senate has unanimously passed a ban on fentanyl The same legislation languishes on Nadler s desk,-0.1,"['nadler', 'wastes taxpayer time', 'partisan impeachment sham', 'actual job', 'judiciary', 'legislation languishes', 'nadler', 's desk']"
713,GOPLeader,Speaker Pelosi s impeachment managers Chairman Schiff who has repeatedly lied amp tried to hide the facts Chairman Nadler who said a partisan impeachment is like overturning an election Rep Jeffries who voted to impeach a year before the Ukraine call even took place,0.0,"['pelosi', 's impeachment managers chairman', 'schiff', 'facts chairman', 'nadler', 'partisan impeachment', 'rep jeffries', 'ukraine']"
714,GOPLeader, WATCH Sen Hirono who has already said she will vote to convict him tells CNN that House Dems didn t do their job,0.0,"['watch sen hirono', 'cnn', 'dems', 'didn t']"
715,RepCarbajal,That s a wrap Thank you CA24 for coming out engaging in our democracy and making your voices heard At our town halls we talk about the good the bad and the ugly I like to think there is a lot of good and more to come,0.15000000000000005,"['thank', 'ca24', 'town halls']"
716,RepCarbajal,Celeste is experiencing homelessness amp asked what we can do for more safe parking for those getting back on their feet Celeste got me thinking why can t we make better use of unused parking lots for safety My team and I will look asap to see what Congress amp can do,0.375,"['celeste', 'homelessness amp', 'celeste', 'congress']"
717,RepCarbajal,A professor asked Have I visited detention centers at the border Yes Tornillo TX and Alamo Gordo NM These facilities were not a place any of us would want children to be They were woken up at 5am deprived of play not cared for It s a tragedy I m fighting for better,0.5,"['have', 'detention centers', 'tornillo tx', 'alamo gordo nm']"
718,RepCarbajal,Received a question on impeachment and partisanship In the House we upheld our oath to defend the Constitution As they set the terms of the trial our U S Senators must put country over party We need a fair trial we need witnesses and documents,0.7,"['received', 'fair trial']"
719,RepCarbajal,David wants to know If Democrats take the majority in the Senate what are the legislative priorities for Congress Sign my California Clean Coast Act into law Robust infrastructure Bold climate action RaiseTheWage LowerDrugCosts Comprehensive immigration reform,0.24999999999999997,"['david', 'legislative priorities', 'congress sign', 'california clean', 'coast act', 'robust', 'bold', 'climate action', 'raisethewage lowerdrugcosts comprehensive', 'immigration reform']"
720,RepKatieHill,I yield the balance of my time for now but not forever,0.0,[]
721,RepKatieHill,Tomorrow I will join my colleagues to vote to affirm the impeachment inquiry and then deliver my final floor speech You can tune into my speech on sometime between 12 30 and 1 30pm ET See you then,0.0,"['tomorrow', 'impeachment inquiry', 'final floor speech', 'et']"
722,RepKatieHill,It is with a broken heart that today I announce my resignation from Congress This is the hardest thing I have ever had to do but I believe it is the best thing for my constituents my community and our country See my official statement below,0.3,"['congress', 'hardest thing', 'official statement']"
723,RepKatieHill, TickFire Morning Update,0.0,['tickfire morning update']
