1915,RepStefanik,THREAD Great to attend the Fulton Montgomery Regional Chamber of Commerce 2020 Cheers to Business event tonight in Gloversville Big congratulations to all of the NY21 winners Ruggiero Realty Crystal Grove Diamond Mine amp Campground,0.4,"['thread', 'fulton montgomery', 'regional chamber', 'cheers', 'business event', 'gloversville', 'big congratulations', 'ny21', 'ruggiero realty', 'crystal grove', 'diamond', 'mine amp', 'campground']"
1916,RepStefanik,The 2nd NY21 stop was to Electro Metrics a leading producer of antennas and sensors for broadband RF communications One of my top priorities is growing our North Country manufacturing amp expanding opportunities for defense contractors to work with the,0.25,"['ny21', 'electro metrics', 'rf', 'top priorities', 'north country', 'defense contractors']"
1917,RepBrindisi,Thanks to everyone who came out to our town hall in Broome County We talked about our fight to keep the Rumble Ponies in Binghamton our legislation to lower prescription drug costs and our work to strengthen infrastructure in the Southern Tier,0.1,"['thanks', 'town hall', 'broome', 'rumble ponies', 'binghamton', 'prescription drug costs', 'tier']"
1918,RepBrindisi,in Endicott employs thousands of people in NY22 and their flight control technology plays a major role in our national defense and regional economy We saw their operations up close during our visit today I ll keep fighting for them on,0.0625,"['endicott', 'ny22', 'flight control technology plays', 'major role', 'national defense', 'regional economy']"
1919,RepBrindisi,We had a great Older Americans town hall at Broome West Senior Center We heard from Southern Tier seniors about their priorities like protecting Social Security lowering prescription drug costs and supporting our Veterans,0.19166666666666665,"['older', 'town hall', 'broome', 'senior', 'tier', 'social security', 'prescription drug costs', 'veterans']"
1920,RepBrindisi,Join us at our Broome County town hall TONIGHT JAN 21 at 5 30pm at Maine Endwell Middle School See you there,0.0,"['join', 'broome', 'county town hall', 'tonight jan', 'maine endwell', 'middle school']"
1921,RepBrindisi,just launched their newest website in 59 languages We need to make sure everyone in NY22 is counted in the census so we can continue to have a voice in Washington Questions Call our Utica office at 315 732 0713,0.5,"['ny22', 'washington', 'call', 'utica']"
1922,RepTomReed,Today we went to Binghamton University visited with the local College Republicans chapter and had a meeting with the school President to discuss the restriction of free speech on campus following an event where economist Art Laffer was shouted off stage This is not acceptable,0.13333333333333333,"['binghamton', 'local college', 'school president', 'free speech', 'art laffer']"
1923,RepTomReed,It was great visiting local farmers today to talk about all the benefits of USMCA for our dairy producers,0.4,"['local farmers', 'usmca', 'dairy producers']"
1924,RepTomReed, You know what they say Nothing says solemn and somber like fist bumps and signing celebrations with souvenir pens,0.0,"['fist bumps', 'souvenir pens']"
1925,RepTomReed, REP TOM REED NEW YORK IS BEING LEFT BEHIND,-0.08787878787878789,['rep tom reed new york is being left behind']
1926,RepTomReed,While I have no doubt is working hard on his flag redesign I wanted to give him at least one more option,-0.030555555555555558,['flag redesign']
1927,RepJohnKatko,This weekend I joined the Vietnamese Community of Syracuse for the second annual Lunar New Year festival in Syracuse This celebration of Vietnamese culture and tradition featured food games and entertainment It was great to be in attendance,0.31212121212121213,"['syracuse', 'lunar', 'new year festival', 'syracuse', 'food games']"
1928,RepJohnKatko,Glad to be a part of the Greater Manlius Chamber of Commerce State of our Community last night to answer questions and talk with local residents,0.25,"['glad', 'manlius', 'commerce state', 'local residents']"
1929,RepJohnKatko,Yesterday I voted in favor of the Protecting Older Workers Against Discrimination Act bipartisan amp commonsense legislation that will level the playing field for older workers in CNY by restoring the ability to combat age discrimination in the workplace,0.16666666666666666,"['yesterday', 'protecting older', 'against discrimination', 'bipartisan amp commonsense legislation', 'cny', 'age discrimination']"
1930,RepJohnKatko,It was great meeting with Slovakia s Ambassador to the United States Ivan Kor ok We had a robust discussion regarding election security and the threat posed by foreign actors,0.39166666666666666,"['great meeting', 'slovakia', 's ambassador', 'ivan kor', 'robust discussion', 'election security', 'foreign actors']"
1931,RepJohnKatko,I applaud and for providing community organizations in Central New York with the necessary funds through the Continuum of Care Program to reduce homelessness in our region,0.04545454545454545,"['community organizations', 'york', 'necessary funds', 'continuum', 'care program']"
1932,RepJoeMorelle,47 years later and we are still fighting to ProtectRoe and protect a woman s right to choose what happens to her body I am proud to protect womens fundamental healthcare rights and will always stand as an ally in the fight for reproductive health,0.36190476190476195,"['protectroe', 'woman s', 'fundamental healthcare rights', 'reproductive health']"
1933,RepJoeMorelle,Organizations like the Young Adult Manufacturing Training Employment Program are critical to connecting workers to fulfilling long term jobs and helping employers meet demand Thank you so much for hosting me today and for all you do to help our community and economy thrive,0.07,"['organizations', 'adult manufacturing training employment program', 'long term jobs', 'thank', 'economy thrive']"
1934,RepJoeMorelle,On National Day of Racial Healing let us reflect on the racism and oppression communities of color have endured not just in the past but too often still today Let s commit to listening hearing and learning so we may work together toward a more equitable future HowWeHeal,0.08333333333333333,"['national day', 'racial healing', 'oppression communities', 'equitable future', 'howweheal']"
1935,RepJoeMorelle,That s why last year I was proud to co sponsor and vote to pass HR1 to protect our elections and ensure government works ForThePeople and I ll always keep fighting to safeguard the sanctity of our democracy,0.4,"['co sponsor', 'hr1', 'ensure government', 'forthepeople']"
1936,RepJoeMorelle,It s been 10 years since the Citizens United decision which weakens our democracy and prioritizes profits over people We need to increase transparency in our elections limit the influence of special interests and EndCitizensUnited once and for all,0.35714285714285715,"['prioritizes profits', 'elections limit', 'special interests', 'endcitizensunited']"
1937,RepBrianHiggins, Collaborative new effort to bring more live jazz to region,0.25757575757575757,"['collaborative', 'new effort']"
1938,RepBrianHiggins,More on this collaboration via Grant allows Colored Musicians Club to cross Main Street divide,0.2222222222222222,"['grant', 'colored musicians', 'main street']"
1939,RepBrianHiggins,Joined the Historic Colored Musicians Club amp to announce the Point Nine Collaborative representing the 9 miles between the two iconic organizations The Cullen Foundation is backing the partnership supporting the work of resident artists amp new public events,0.17727272727272728,"['joined', 'historic colored musicians', 'club amp', 'collaborative', 'iconic organizations', 'cullen', 'resident artists amp', 'new public events']"
1940,RepBrianHiggins,Happening today,0.0,['happening']
1941,RepBrianHiggins,It seems like just yesterday that Patrick Kane Sr and I were lacing up our skates at Caz Rink Today the WNY community joins him in celebrating s 1000 points,0.0,"['patrick kane sr', 'caz rink', 'wny', 'community joins']"
1942,RepSteveChabot,Today in addition to reading House Mouse to the students at C O Harrison Elementary I took a birthday photo with two students that I share a birthday with Happy Birthday guys and keep up the good work,0.6,"['reading house mouse', 'c o', 'harrison', 'birthday photo', 'happy birthday', 'good work']"
1943,RepSteveChabot,I just read House Mouse to students at C O Harrison Elementary in Delhi Township and presented the school with a flag that was flown over the Capitol It is always a pleasure to spend time with you all,0.3,"['house mouse', 'c o', 'harrison', 'delhi']"
1944,RepSteveChabot,ICYMI Here are my remarks from the s hearing on the Soleimani strike and our policy toward Iran,0.0,"['icymi', 's hearing', 'soleimani', 'iran']"
1945,RepSteveChabot,Today we honor and celebrate the life of Dr Martin Luther King Jr,0.0,['dr martin luther king jr']
1946,RepSteveChabot,I recently met with Pinto It is always great to hear about the work UC is doing for our community Thanks for the update on the 1819 Innovation Hub and UC s record enrollment Read more about the 1819 Innovation Hub here,0.375,"['pinto', 'uc', 'thanks', 'innovation hub', 'uc', 's record enrollment', 'read', 'innovation hub']"
1947,RepBradWenstrup, Thank you to US Representative Brad Wenstrup for speaking to our Government classes this morning Representative Wenstr,0.0,"['thank', 'us representative', 'brad wenstrup', 'government classes', 'morning representative', 'wenstr']"
1948,RepBradWenstrup,Great read in the by as the Senate impeachment trial begins,0.8,['senate impeachment trial']
1949,RepBradWenstrup,The President continues to secure better trade deals with our global trading partners Click to read my full statement on the signing of the Phase One trade agreement with China yesterday,0.3125,"['trade deals', 'click', 'full statement', 'phase', 'trade agreement', 'china']"
1950,RepBradWenstrup,To doubt the reasoning behind the airstrike against Soleimani is an insult to every American who has sacrificed their life in defense of this nation,-0.2,['soleimani']
1951,RepBradWenstrup,killed and maimed Like Rep Mast I served with some of the individuals whose names are etched on the wall honoring the fallen from the war on terror,-0.2,['rep mast']
1952,RepBeatty,Looks like wants MORE tax cuts for the super wealthy and well connected GOPTaxScam,0.3833333333333333,"['looks', 'more', 'tax cuts', 'goptaxscam']"
1953,RepBeatty,Today marks 47 years since Roe v Wade and I m committed as ever to protecting reproductive care and women s health RoeVsWade,0.0,"['roe', 'wade', 'reproductive care', 'women s health', 'roevswade']"
1954,RepBeatty,Even Republicans want Impeachment witnesses called,0.0,['impeachment']
1955,RepBeatty, We call for EndCitizensUnited and for the U S Senate to pass HR1 to get big money out of politics and reform our cam,0.0,"['endcitizensunited', 's senate', 'hr1', 'big money']"
1956,RepBeatty, The Impeachment Trial of President Donald John Trump,0.0,"['impeachment trial', 'donald john trump']"
1957,Jim_Jordan,produced erroneous information as evidence to support his impeachment sham Just another example of Schiff misleading the American people,-0.2333333333333333,"['erroneous information', 'impeachment sham', 'schiff', 'american people']"
1958,Jim_Jordan, Let s talk about fairness,0.0,[]
1959,Jim_Jordan,Chuck Schumer complains about the schedule which may go into the dark of night REMEMBER Adam Schiff conducted 18 depositions from a bunker in the basement of the Capitol,-0.15,"['chuck schumer', 'remember adam schiff']"
1960,Jim_Jordan, It s quite amazing to see talk about fairness when he denied Republicans fairness witnesses and due proc,0.23750000000000004,"['fairness witnesses', 'due proc']"
1961,Jim_Jordan,Great to be in Marysville OH as signs the White House Pledge to America s Workers Our economy is booming Ohio is growing and Honda is reaffirming its long standing commitment to advance the skills of its current and future workforce,0.15,"['marysville oh', 'white house', 'pledge', 'america', 'ohio', 'honda', 'future workforce']"
1962,boblatta,Martin Luther King Jr s dream of equality for all Americans dramatically challenged revolutionized amp strengthened our country May we always remember his example his sacrifice amp his ideals MLKDay,0.0,"['martin luther king jr', 's dream', 'may', 'sacrifice amp', 'mlkday']"
1963,boblatta,Congratulations to John Beall for being selected to the board amp for his years of service to conservation issues in the US Thanks to Kendra Wecker Chief of for all you do for hunters amp anglers ODNR,0.2,"['congratulations', 'john beall', 'board amp', 'conservation issues', 'thanks', 'kendra wecker', 'hunters amp anglers', 'odnr']"
1964,boblatta,The pursuit of religious freedom sparked the birth of our nation The freedom to worship as you wish is a freedom in our country that we must protect amp defend every day Everyone should be able to exercise the basic human right of religious freedom ReligiousFreedomDay,0.13095238095238096,"['religious freedom', 'everyone', 'basic human', 'religious freedom', 'religiousfreedomday']"
1965,boblatta, Klick and Mike Stover present with a Wheat Advocate Award in Washington to thank him for his unwaverin,0.0,"['klick', 'mike stover', 'wheat advocate', 'washington']"
1966,boblatta,The USMCA just passed the Senate amp is on its way to desk to be signed into law After meeting amp speaking with farmers manufacturers amp businesses in OH5 Ohioans want amp need improved regulatory cooperation so they can thrive in a 21st century economy amp workforce,0.0,"['usmca', 'senate amp', 'farmers manufacturers amp businesses', 'oh5 ohioans', 'amp need', 'regulatory cooperation', 'century economy amp workforce']"
1967,RepBillJohnson,So after months of running a completely unfair and rigged impeachment inquiry against in the House Dems suddenly now care about a fair procedure What a joke,0.06666666666666665,"['impeachment inquiry', 'dems', 'fair procedure']"
1968,RepBillJohnson,Today we remember one of the greatest men in American History Dr Martin Luther King Jr His work allowed Americans of all colors to pursue the American Dream on their own terms I m thankful for leaders like Dr King who fought for what is right even though it was hard,0.2656746031746032,"['history dr martin luther king jr', 'dream', 'own terms', 'm thankful', 'dr']"
1969,RepBillJohnson,You are the salt of the earth But if the salt loses its saltiness how can it be made salty again It is no longer good for anything except to be thrown out and trampled underfoot You are the light of the world A town built on a hill cannot be hidden Matthew 5 13 14,0.15833333333333335,['matthew']
1970,RepBillJohnson,On Sunday morning show now,0.0,['morning show']
1971,RepBillJohnson,ICYMI The Dow broke 29 000 USMCA passed the Senate Phase One of the US China trade deal was signed 145 000 jobs were added Unemployment remains at 3 5 While Dems have been focused on impeachment is getting real work done for Americans,0.2,"['icymi', 'dow', 'usmca', 'phase', 'china', 'unemployment', 'dems']"
1972,RepBobGibbs, What a disappointment Democrats just blocked a vote on a resolution supporting the Iranian protestors This is not the tim,-0.175,['iranian']
1973,RepBobGibbs, Impeachment was urgent only when it seemed politically convenient What s afraid of,-0.19999999999999998,['impeachment']
1974,RepBobGibbs,The Iranian government would be wise to understand our resolve in keeping our people safe and the extent to which we will use American strength to maintain regional and global stability,0.3,"['iranian', 'american strength', 'global stability']"
1975,RepBobGibbs,Iran has become the international equivalent of a schoolyard bully and our response made sure they think twice before continuing to antagonize the United States Appeasement and pallets of cash were never going to work in our favor,0.25,"['iran', 'appeasement']"
1976,RepBobGibbs,The killing of Qassem Soleimani was justified and necessary in sending a clear signal to Iran and their terrorist proxies that America will not stand by while our forces civilian personnel assets and allies are threatened or attacked,0.16666666666666666,"['qassem soleimani', 'clear signal', 'iran', 'terrorist proxies', 'america', 'forces civilian personnel assets']"
1977,WarrenDavidson,GoodNews,0.0,['goodnews']
1978,WarrenDavidson,Great to join you all Thanks to all who attended,0.5,['thanks']
1979,WarrenDavidson,Honored to join this morning to talk about s visit to Davos and the thriving US economy,0.0,"['honored', 's visit', 'davos', 'us economy']"
1980,WarrenDavidson,It s always great to start the day at Fox studios in NYC Tune in at 10 15 to catch me on PS Congratulations on your 10 yr anniversary Stu,0.8,"['fox', 'nyc', 'ps congratulations', 'yr anniversary', 'stu']"
1981,WarrenDavidson,DefendFreedom Martin Luther King Jr is a great example of how one person can truly make a difference Those whom he inspired have helped and are still helping to change the world,0.8,"['defendfreedom martin luther king jr', 'great example']"
1982,RepMarcyKaptur,Today we honor Rev Dr Martin Luther King Jr who dedicated his life to fighting for justice amp equality Dr King urged us all to stand up to prejudice amp meet violence w nonviolence His teachings inspired countless people in the struggle for what is right Equality for All,0.14285714285714285,"['rev dr martin luther king jr', 'justice amp equality', 'dr', 'prejudice amp meet violence w nonviolence', 'countless people', 'equality']"
1983,RepMarcyKaptur,Our elections should be driven by and for the people not big moneyed special interests That s why I ve introduced a Constitutional Amendment nullifying Citizens United and giving power over our democracy back to the voters EndCitizensUnited,0.11904761904761905,"['special interests', 'constitutional amendment', 'endcitizensunited']"
1984,RepMarcyKaptur,USMCA would be the law of the land for decades yet it doesn t include a single provision to address climate change or protect the environment The climate crisis is here and the American people can t afford another NAFTA style do nothing trade deal,-0.03571428571428571,"['usmca', 'doesn t', 'address climate', 'climate crisis', 'american people', 'nafta']"
1985,RepMarcyKaptur,The Trump Administration must immediately do right by these servicemembers and answer why it misled the American public and Congress,0.09523809523809523,"['trump', 'american public', 'congress']"
1986,RepMarcyKaptur,The Administration reported that no Americans were harmed in Iran s attack on al Asad airbase yet today we learn that 11 servicemembers were wounded during the attack amp transported out of Iraq to receive medical treatment for traumatic brain injuries,0.0,"['iran', 's attack', 'asad', 'attack amp', 'iraq', 'medical treatment', 'traumatic brain injuries']"
1987,RepMikeTurner, With the impeachment trial starting today joins us live to talk with with what we can expect,0.06818181818181818,['impeachment trial']
1988,RepMikeTurner,Today I wrote to Director Christopher Wray amp Foreign Intelligence Surveillance Court FISC Judge Rosemary Collyer urging adoption of my proposed reform to prevent politically funded opposition research from being used as evidence in the FISC READ,-0.0625,"['christopher wray', 'intelligence surveillance', 'fisc', 'rosemary collyer', 'opposition research', 'fisc read']"
1989,RepMikeTurner,I successfully advocated for a year long extension of the Health Care Coverage Tax Credit which many Delphi Salaried Retirees rely on to afford health care to be included in the appropriations package that passed the House yesterday Learn more here,0.425,"['care coverage', 'credit', 'delphi salaried retirees', 'health care', 'appropriations package', 'learn']"
1990,RepMikeTurner,Major funding included in today s appropriations packages for OH10 120 9M for reauthorization of NAHA access to millions in additional funding for scholarships amp research for Learn more by clicking here,0.28125,"['s appropriations packages', 'oh10', 'naha', 'scholarships amp research', 'learn']"
1991,RepMikeTurner,I strongly support this year s NDAA To learn about how the bill bolsters helps address PFAS and further addresses military sexual assault click here,0.20833333333333331,"['year s', 'ndaa', 'bill bolsters', 'pfas', 'military sexual assault click']"
1992,RepMarciaFudge,Ten years ago the CitizensUnited decision gave special interests unprecedented power to influence our elections Last year the House passed the ForThePeople Act to get money out of politics and return power to the American people It s time for the Senate to take up HR1,0.19142857142857142,"['ten', 'citizensunited', 'special interests', 'unprecedented power', 'forthepeople', 'return power', 'american people', 's time', 'hr1']"
1993,RepMarciaFudge,Today we celebrate Dr Martin Luther King Jr s life of sacrifice in pursuit of justice We also must take this day to recognize there is still work to do as we strive to fulfill his dream of a more equal fair and just America,0.39999999999999997,"['dr martin luther king jr', 's life', 'equal fair', 'america']"
1994,RepMarciaFudge,Nutritious school meals enable students to stay healthy and focused in the classroom The President s decision to rollback s meal standards damages the progress we ve made towards improving school nutrition amp reveals his disregard for the health of our students,0.5,"['nutritious', 'school meals', 'enable students', 'president s decision', 'rollback s meal standards damages', 'school nutrition amp reveals']"
1995,RepMarciaFudge,I support the states in their lawsuit and I m here to put the White House on notice that my colleagues and I will continue to fight them on these cuts HandsOffSNAP For my full statement visit,0.175,"['white house', 'handsoffsnap', 'full statement visit']"
1996,RepMarciaFudge,The GAO concluded the President broke the law when he withheld funds from Ukraine for his own political gain It s apparent now more than ever the President s actions were illegal and unconstitutional The Senate must hold a full amp fair trial,0.24285714285714283,"['gao', 'withheld funds', 'ukraine', 'own political gain', 'president s actions', 'full amp fair trial']"
1997,RepBalderson,The Indiana Kentucky Ohio Regional Council of Carpenters represents more than 35 000 tradespeople across the tri state area Enjoyed learning more about their strategies for meeting the demands of Ohio s growing economy,0.5,"['indiana kentucky ohio', 'regional council', 'carpenters', 'tri state area', 'enjoyed', 'ohio']"
1998,RepBalderson,Honoring the life and legacy of Dr Martin Luther King by empowering our next generation of leaders this morning at the Scholarship Fund Prayer Breakfast Congrats to all this year s scholarship recipients MLKDay,0.0,"['honoring', 'dr martin luther king', 'scholarship', 'prayer breakfast congrats', 'year s scholarship recipients', 'mlkday']"
1999,RepBalderson,Today we honor the life and legacy of Dr Martin Luther King Jr who dedicated his life to spreading the messages of justice equality and respect His courage and leadership will continue to inspire generations of Americans to come MLKDay,0.0,"['dr martin luther king jr', 'justice equality', 'inspire generations', 'mlkday']"
2000,RepBalderson,One of the fundamental things that makes the United States great is our freedom of religion Today we celebrate this freedom no matter your background or beliefs ReligiousFreedomDay,0.8,"['fundamental things', 'religiousfreedomday']"
2001,RepBalderson,Thrilled to see the Senate pass USMCA earlier today One step closer to ratification of a deal that will help Ohio s ag amp manufacturing industries,0.3,"['thrilled', 'usmca', 'ohio', 's ag amp']"
2002,RepTimRyan,After 47 years RoeVWade stands strong today despite repeated attacks in OH and across the nation I will continue to fight for a woman s right to choose Every woman deserves the right to make choices about her health amp future with dignity,0.2511904761904762,"['roevwade', 'oh', 'woman s', 'health amp']"
2003,RepTimRyan,Great to meet Struthers dynamic new mayor Catherine Cercone Miller I look forward to partnering with her and her team Very exciting times in Struthers,0.3315909090909091,"['struthers', 'dynamic new mayor', 'catherine cercone miller', 'exciting times', 'struthers']"
2004,RepTimRyan,Thanks for having me It was great learning more about the vital work is doing in Boardman to provide our kids with mental health support,0.3,"['thanks', 'great learning', 'vital work', 'boardman', 'mental health support']"
2005,RepTimRyan,Increasing access to democracy is not a partisan issue That s why I m proud of my A rating from We should overturn Citizens United and the Senate should pass the ForThePeople Act without delay DemocracyForAll,0.8,"['partisan issue', 'forthepeople', 'democracyforall']"
2006,RepTimRyan,Ten years ago today CitizensUnited gave wealthy special interests unprecedented influence in our elections making it much harder for everyday people to be heard We must work to fight this undue influence and strengthen our democracy It s time for the Senate to pass HR 1,0.19285714285714287,"['ten', 'citizensunited', 'wealthy special interests', 'unprecedented influence', 'everyday people', 'undue influence', 's time', 'hr']"
2007,RepDaveJoyce, TipTuesday GSA s VETS 2 Governmentwide Acquisition Contract is the only GWAC set aside exclusively for Service Disabled Vete,-0.1,"['tiptuesday gsa', 'vets', 'governmentwide acquisition contract', 'gwac', 'disabled vete']"
