,user,tweetText,simplePolarity,nouns,party,state
1951,Jim_Jordan, Hunter Biden flew to China on an official visit with Joe Biden in 2013 Hunter ended up inking a deal for his hedge fund,0.0,"['hunter biden', 'china', 'official visit', 'joe biden', 'hunter', 'hedge fund']",R,Ohio
1952,Jim_Jordan,Here s what we know Hillary Clinton contrived the Russia hoax to distract from her email scandal The Obama Biden Administration knowingly pushed Clinton s phony allegations Democrats lied for years to cover it up Will the media correct their past stories on collusion,-0.375,"['hillary clinton', 'russia', 'email scandal', 'obama biden', 'clinton', 's phony allegations', 'will', 'past stories']",R,Ohio
1953,Jim_Jordan,The Obama Biden Administration knew it was hoax They knew the Trump Campaign didn t collude with Russia They knew they were wasting taxpayer money But they didn t care,0.0,"['obama biden', 'trump campaign', 'didn t collude', 'russia', 'taxpayer money', 'didn t care']",R,Ohio
1954,Jim_Jordan,We now know that John Brennan and Hillary Clinton conjured up the phony Russian hoax with the Obama Biden Administration to distract Americans from the Clinton email scandal The witch hunt was worse than we ever thought,-0.2,"['john brennan', 'hillary clinton', 'russian hoax', 'obama biden', 'clinton', 'email scandal', 'witch hunt']",R,Ohio
1955,boblatta,Yesterday I met with Michael Koester amp Jeff Starner at the Koester Corp in Napoleon OH5 who shared how the PPP was a lifeline as they navigate COVID19 Koester amp Starner said the PPP was a major success for the company amp its employees More,0.28750000000000003,"['yesterday', 'michael koester', 'jeff starner', 'koester corp', 'napoleon oh5', 'ppp', 'covid19 koester', 'starner', 'ppp', 'major success', 'company amp']",R,Ohio
1956,boblatta,The U S must win the technological race against China I m proud to introduce the Beat CHINA for 5G Act which works to close the digitaldivide amp will improve connectivity in communities across the country Learn more about our bicameral bill,0.7000000000000001,"['technological race', 'china', 'china', '5g act', 'digitaldivide amp', 'learn', 'bicameral bill']",R,Ohio
1957,boblatta, Friday s jobs report marks the 5th month of unemployment decline since the start of COVID19 661 000 American jobs w,0.0,"['s jobs', '5th month', 'unemployment decline', 'covid19', 'american jobs w']",R,Ohio
1958,boblatta, the and s track record shows we know how to create a strong economy Together we are,0.4333333333333333,"['s track record shows', 'strong economy', 'together']",R,Ohio
1959,boblatta,I signed a resolution condemning the Democrats plan to pack the SupremeCourt Any attempt to increase the number of Justices to the Supreme Court would undermine our democratic values amp destroy the credibility of our justice system,-0.2,"['supremecourt', 'justices', 'supreme court', 'democratic values amp', 'justice system']",R,Ohio
1960,RepBillJohnson,Kamala Harris amp Joe Biden need to get their stories straight on fracking And the Green New Deal And Supreme Court packing And raising taxes on working families Mike Pence won easily while Harris was reduced to smirking head shaking No wonder they don t do press conferences,0.14242424242424243,"['kamala harris', 'joe biden', 'deal', 'supreme court', 'mike pence', 'harris', 'don t', 'press conferences']",R,Ohio
1961,RepBillJohnson,Just a reminder was right about Defending the police Reopening schools Confronting China The liberal media fought him on every single point and they were flat out wrong It s no wonder Americans are not listening to the media anymore,-0.07767857142857143,"['defending', 'reopening', 'confronting china', 'liberal media']",R,Ohio
1962,RepBillJohnson,We must have a bipartisan COVID deal for the American people like the deal released a few weeks ago But instead of negotiating would rather have no deal and blame the President than make compromises to help the American people,-0.06666666666666667,"['covid', 'american people', 'american people']",R,Ohio
1963,RepBillJohnson, Happy Birthday to our House Republican Whip,0.8,"['birthday', 'republican whip']",R,Ohio
1964,RepBillJohnson,Great news Prayers for a continued speedy recovery Mr President,0.8,"['great news', 'prayers', 'speedy recovery', 'mr']",R,Ohio
1965,RepBobGibbs,Today I introduced the CSA Reform Act It reforms s carrier safety programs to ensure our nation s truck drivers and roads are safe using the most up to date amp accurate safety data Read more at,0.47500000000000003,"['csa reform', 'reforms s carrier safety programs', 'nation s truck drivers', 'date amp', 'accurate safety data', 'read']",R,Ohio
1966,RepBobGibbs,Unbelievable would rather pass nothing and let those still struggling twist in the wind than pass even extensions of programs we previously passed This was never about COVID relief It was only about political posturing for the election,-0.10416666666666666,['covid'],R,Ohio
1967,RepBobGibbs, Additional coverage of accepting an official Congressional record to commemorate the for its 100th seas,0.0,"['additional', 'official congressional record', '100th seas']",R,Ohio
1968,RepBobGibbs, Today at The Hall Victoria VanBuskirk Knox from the office of U S presented with an official,0.0,['victoria vanbuskirk knox'],R,Ohio
1969,RepBobGibbs,Unemployment continues to fall the Great am American Comeback continues,0.4,"['unemployment', 'comeback']",R,Ohio
1970,WarrenDavidson,Hope you can tune in,0.0,['hope'],R,Ohio
1971,WarrenDavidson,FactsMatter Fully declassified needs to be followed swiftly by fully accessible Then people will see how coordinated dishonest and criminal this conduct was and has been Justice and an accurate history are both needed,0.018750000000000017,"['factsmatter fully', 'accurate history']",R,Ohio
1972,WarrenDavidson,No veteran should have to worry that contracting coronavirus will threaten the benefits they earned while serving our country Read more about my new bill to protect veterans benefits in,0.21212121212121213,"['read', 'new bill', 'veterans benefits']",R,Ohio
1973,WarrenDavidson,Congratulations to all the hard working Ohioans at Collins Aerospace Thank you for your contributions to our national defense OH08,-0.2916666666666667,"['congratulations', 'ohioans', 'collins aerospace thank', 'national defense', 'oh08']",R,Ohio
1974,WarrenDavidson,GoodNews,0.0,['goodnews'],R,Ohio
1975,RepMarcyKaptur,We ve fought this administration tooth and nail to keep our region s environmental and economic priorities alive After this 24 million federal investment the improvements along this waterway and the civic pride that goes along with it are awe inspiring,0.26666666666666666,"['administration tooth', 'region s environmental', 'economic priorities', 'federal investment', 'civic pride']",D,Ohio
1976,RepMarcyKaptur,This is why we fight It was an honor to be on the shores of the restored Black River in Lorain as this historic federal partnership under the Great Lakes Restoration Initiative is celebrated,0.24583333333333335,"['black', 'lorain', 'historic federal partnership', 'lakes restoration initiative']",D,Ohio
1977,RepMarcyKaptur, Beautiful day in Lorain Ohio Today RA Thiede and had a fantastic tour of habitat restoration and remediat,0.625,"['beautiful', 'lorain ohio', 'ra thiede', 'fantastic tour', 'habitat restoration']",D,Ohio
1978,RepMarcyKaptur,I speak with Ohio families every day who are barely holding on and for whom additional help is desperately needed Trump s decision will harm millions of Ohioans in countless ways The callousness of this President knows no bounds,-0.18333333333333332,"['ohio', 'additional help', 'trump', 's decision', 'harm millions', 'ohioans', 'countless ways']",D,Ohio
1979,RepMarcyKaptur,President Trump is literally running for re election on his failed economic record and failure to negotiate fair trade deals His haphazard and careless approach to trade policy has ONCE AGAIN resulted in a record high trade deficit,-0.12238095238095237,"['trump', 're election', 'economic record', 'fair trade deals', 'careless approach', 'trade policy', 'once again', 'record high trade deficit']",D,Ohio
1980,RepMikeTurner, Having participated in observance of war games in Poland I know how important our presence in Poland is in deterren,0.4,"['war games', 'poland', 'poland']",R,Ohio
1981,RepMikeTurner,Today I took another step to support and assist SmallBiz in our community during COVID19 PPP loans provided to date over 820 million across 7 300 small businesses in OH10 It is imperative the House votes on an extension of the PPP program,-0.25,"['smallbiz', 'covid19 ppp', 'small businesses', 'oh10', 'house votes', 'ppp']",R,Ohio
1982,RepMikeTurner,Today I led 14 Members of Congress in urging to restore Delphi Salaried Retirees pensions Read more here,0.5,"['congress', 'delphi salaried retirees', 'read']",R,Ohio
1983,RepMikeTurner, Joe Biden should have known better Obama was a novice on trade policy But Joe Biden had 40 years of history of off,0.5,"['joe biden', 'obama', 'trade policy', 'joe biden']",R,Ohio
1984,RepMikeTurner, Trump Mulls Returning Pensions to 20K Delphi Workers Stolen by Obama Biden,0.0,"['trump mulls', 'pensions', 'delphi', 'stolen', 'obama biden']",R,Ohio
1985,RepMarciaFudge,More than 2 Million Ohioans have requested their absentee ballots It is not too late to request your absentee ballot but be sure to do so as soon as possible to ensure your voice is heard Here s how to get started,0.175,"['million ohioans', 'absentee ballots', 'absentee ballot']",D,Ohio
1986,RepMarciaFudge,It has been more than 18 months since the House passed bipartisan legislation to reauthorize and strengthen the Violence Against Women Act Senator McConnell continues to refuse to bring this bill to the Senate floor DomesticViolenceAwarenessMonth,0.5,"['bipartisan legislation', 'violence against', 'act senator', 'mcconnell', 'senate floor', 'domesticviolenceawarenessmonth']",D,Ohio
1987,RepMarciaFudge,Voters broke records across Ohio on the first day of early voting yesterday Have you made a plan to vote Here is the early voting schedule in Ohio from now until election day,0.15,"['ohio', 'have', 'ohio', 'election day']",D,Ohio
1988,RepMarciaFudge,Two things I can t believe I have to say 1 It is never too close to an election to help struggling families workers businesses and communities 2 Relief for millions of Americans is more important than filling a Supreme Court seat,0.45,"['families workers businesses', 'relief', 'supreme court seat']",D,Ohio
1989,RepMarciaFudge,The President and Senate continue to be in denial of a disease ravaging the American people and economy Action on additional relief for Americans should be the priority not ramming through a Supreme Court Justice before election day,0.05,"['american people', 'economy action', 'additional relief', 'supreme court justice', 'election day']",D,Ohio
1990,RepBalderson, The PaycheckProtectionProgram was essential to sustain our economy is taking swift action to forgive loans for Ame,0.05,"['paycheckprotectionprogram', 'swift action', 'ame']",R,Ohio
1991,RepBalderson,Columbus area residents check out this week s pop up testing locations,0.0,"['columbus', 'area residents check', 'week s']",R,Ohio
1992,RepBalderson,Great conversation with this morning The healthcare industry has had to shift gears changing how they provide critical care to patients while adhering to social distancing guidelines Telehealth has helped with this which is why I ve worked to champion its expansion,0.2777777777777778,"['great conversation', 'healthcare industry', 'critical care', 'telehealth']",R,Ohio
1993,RepBalderson, Thank you to and his team for meeting with today during ACCLegConf and committing to health access,0.0,"['thank', 'acclegconf', 'health access']",R,Ohio
1994,RepBalderson,Thank you Governor DeWine I appreciate your partnership as we ve worked together to deliver relief to Ohioans throughout the pandemic Our work isn t over and I m glad to have your support and we continue restoring our way of life here in Ohio,0.5,"['thank', 'dewine', 'ohioans', 'work isn t', 'ohio']",R,Ohio
1995,RepTimRyan,Who better to represent our nation abroad than those who sacrificed for their country I m proud to have introduce this legislation with my colleague to waive passport fees for our Purple Heart recipients,0.65,"['who', 'waive passport fees', 'purple heart']",D,Ohio
1996,RepTimRyan,The President made a lot of big promises about saving manufacturing in this country He came to Lordstown amp told Ohioans not to sell their houses Today we re down gt 700 000 manufacturing jobs our trade deficit is up 18 amp China is eating our lunch on the world economic stage,0.014814814814814808,"['lordstown', 'ohioans', 'trade deficit', 'china', 'economic stage']",D,Ohio
1997,RepTimRyan,More than HALF of Americans are at risk of getting their power utilities shut off as we head into winter and this president refuses to make a deal to get them the help they need,0.16666666666666669,"['half', 'power utilities shut', 'president refuses']",D,Ohio
1998,RepTimRyan,Just thinking about how I could get my hair cut every two weeks for 85 years straight and still not even spend close to 70 000 on my hair,0.2,[],D,Ohio
1999,RepTimRyan,Small bars amp restaurants are barely making it as it is Now the President has refused to pass additional COVID relief That s only hurting folks like this,-0.06666666666666667,"['small', 'amp restaurants', 'covid']",D,Ohio
2000,RepDaveJoyce,thinks I need to post more photos of him too,0.5,[],R,Ohio
2001,RepDaveJoyce,Always great to have a fellow Buckeye in Northeast Ohio Was proud to join him amp other dedicated GreatLakes protectors today to highlight the progress we ve made as well as our ongoing efforts to restore preserve one of the USA s greatest natural resources,0.515,"['buckeye', 'ohio was', 'greatlakes', 'usa', 'natural resources']",R,Ohio
2002,RepDaveJoyce,Overdoses killed more Ohioans in May than in any month in 14 yrs I ve written to amp will keep working w local police recovery experts to combat the opioidcrisis amid COVID19 We must work together to prevent these deaths,0.09999999999999999,"['overdoses', 'ohioans', 'may', 'w local police recovery experts', 'covid19']",R,Ohio
2003,RepDaveJoyce,Kelly and I are keeping this officer in our prayers God bless all of our brave men and women in law enforcement,0.8,"['kelly', 'god', 'brave men', 'law enforcement']",R,Ohio
2004,RepDaveJoyce,Praying both and have a speedy recovery,0.0,"['praying', 'speedy recovery']",R,Ohio
2005,RepSteveStivers,2 2 and I m calling on the leaders of both parties to get back to the table and negotiate in good faith,0.35,['good faith'],R,Ohio
2006,RepSteveStivers,1 2 Across the country and in Ohio s 15th District small businesses are hanging on by a thread and families continue to struggle to pay the rent amid record high unemployment It s irresponsible for Washington to play partisan games during a once in a generation crisis,-0.045,"['across', 'ohio', 'small businesses', 'record high unemployment', 's irresponsible', 'washington', 'partisan games', 'generation crisis']",R,Ohio
2007,RepSteveStivers,The CARES Act funding worked to keep businesses and organizations throughout OH15 running Yesterday I met with the Lancaster Fairfield Public Transit system Director Carrie Woody to hear how this relief helped them and what challenges they re facing now,0.0,"['cares', 'oh15', 'yesterday', 'lancaster fairfield', 'transit', 'system director', 'carrie woody']",R,Ohio
2008,RepSteveStivers,This event has consistently spurred policy ideas amp local initiatives to support preventative measures treatment housing amp employment assistance for those battling addiction As opioid related deaths have spiked during COVID19 these conversations are more important than ever,0.22999999999999998,"['policy ideas amp local initiatives', 'support preventative measures treatment housing amp employment assistance', 'covid19']",R,Ohio
2009,RepSteveStivers,For the past 7 years I ve hosted an Opioid amp Addiction Roundtable to collaborate with local experts on solutions to combat the addiction epidemic This year I am holding a series of socially distanced roundtables throughout OH15 Today we kicked off the series in Lancaster,-0.07222222222222223,"['opioid', 'addiction', 'local experts', 'addiction epidemic', 'oh15', 'lancaster']",R,Ohio
2010,RepAGonzalez,As part of NationalFirePreventionWeek I had the privilege of recognizing the achievements of fire department These men and women have a combined 560 years of service ensuring our community is safe Grateful for their dedication to OH16,0.5,"['nationalfirepreventionweek', 'fire department', 'grateful', 'oh16']",R,Ohio
2011,RepAGonzalez,Visits to small businesses all across OH16 amp discussions with families at all income levels make it clear our people are resilient but our work is not done to recover from this pandemic As I said last week on the House floor Congress must deliver Negotiations must continue,-0.04999999999999999,"['visits', 'small businesses', 'oh16', 'amp discussions', 'income levels', 'house floor', 'congress', 'negotiations']",R,Ohio
2012,RepAGonzalez,Financial literacy is a critical component to the economic health of our region and I was glad to have been able to share information and resources featuring with you at our great financial literacy event yesterday afternoon My thanks to all who attended,0.275,"['financial', 'critical component', 'economic health', 'great financial literacy event']",R,Ohio
2013,RepAGonzalez,Spent a large part of the day in Wooster today to see and hear first hand about where more assistance is needed as we work to combat the effects of the COVID 19 pandemic on our small businesses our farms and our communities We are InThisTogetherOhio,0.12285714285714286,"['spent', 'large part', 'wooster', 'covid', 'small businesses', 'inthistogetherohio']",R,Ohio
2014,RepAGonzalez,Thank you for the work that you are doing to grow the downtown Wooster area It is great to see private public partnerships at work in Wayne County to bring new jobs and small businesses to the community,0.13727272727272727,"['thank', 'wooster', 'private public partnerships', 'wayne', 'new jobs', 'small businesses']",R,Ohio
2015,repkevinhern,Last week I introduced the Energy Poverty Prevention and Accountability Act EPPA with the goal of ensuring ALL Americans have access to affordable and reliable energy I m honored to have 17 co sponsors amp counting support this common sense legislation,-0.15,"['energy poverty prevention', 'accountability', 'eppa', 'all', 'reliable energy', 'co sponsors amp', 'common sense legislation']",R,Oklahoma
2016,repkevinhern,Please join me in prayer for amp as they recover from COVID 19 Like so many Americans the Trumps tested positive for the disease despite showing no symptoms I have every hope their status will remain positive amp they will both have a swift recovery,0.3181818181818182,"['please', 'covid', 'trumps', 'positive amp', 'swift recovery']",R,Oklahoma
2017,repkevinhern,Great work Ofc Crosier Fine example of Tulsa s bravest working to keep us safe,0.5722222222222223,"['great work', 'ofc crosier', 'fine example', 'tulsa', 's bravest']",R,Oklahoma
2018,repkevinhern, At today s subcommittee hearing witnesses discussed the Paycheck Protection Program forgiveness process and suggested ideas t,0.0,"['s subcommittee hearing witnesses', 'paycheck protection program', 'forgiveness process', 'ideas t']",R,Oklahoma
2019,repkevinhern,My prayers are with the two officers wounded in Louisville last night,0.0,['louisville'],R,Oklahoma
2020,RepMullin, WATCH Axios hosts a conversation on how the pandemic has worsened social and racial inequities in the American,0.016666666666666666,"['watch axios', 'racial inequities']",R,Oklahoma
2021,RepMullin,The Chinese Communist Party CCP and its tyrannical government remain a top threat not only to the United States but the entire globe Their hostile behavior over the past year has demonstrated their goal of eroding freedom and growing their communist influence,0.05,"['chinese communist party', 'ccp', 'tyrannical government', 'top threat', 'entire globe', 'hostile behavior', 'past year']",R,Oklahoma
2022,RepMullin,The letters urge recipients to register by November 21st in order to receive their payment by the end of the year If you received a letter visit the website to claim your payment,0.0,"['letters urge recipients', 'november', 'letter visit']",R,Oklahoma
2023,RepMullin,Attention Non Filers The IRS mailed letters to Americans who typically don t file federal income tax returns who may be eligible for but have not registered to claim an Economic Impact Payment,0.016666666666666677,"['attention non filers', 'irs', 'don t file', 'federal income tax returns', 'impact payment']",R,Oklahoma
2024,RepMullin,While Speaker Pelosi amp the socialist Left are trying to defund our law enforcement destroy our economy amp dismantle our institutions Republicans are fighting for our country We will restore our way of life rebuild the greatest economy in history and renew the American Dream,0.2,"['pelosi', 'left', 'law enforcement', 'economy amp dismantle', 'dream']",R,Oklahoma
2025,RepFrankLucas,Congratulations for being named a 2020 School Our children are our future and with this School award it s clear is investing in the futures of each and every student in Sapulpa,0.05000000000000001,"['congratulations', 'school award', 'sapulpa']",R,Oklahoma
2026,RepFrankLucas,ATTENTION HS SENIORS Each year I have the honor to nominate a limited number of seniors to attend our nation s military service academies The deadline to apply is quickly approaching Friday October 16th APPLY OR LEARN MORE,0.08214285714285714,"['attention hs seniors', 'nation s', 'military service academies', 'october', 'apply or learn more']",R,Oklahoma
2027,RepFrankLucas,Last week announced a 2M investment in Woodward Oklahoma EDA plays a critical role in supporting locally driven business development strategies helping create jobs and strengthening regional economies Read more,0.15,"['2m investment', 'woodward oklahoma eda', 'critical role', 'business development strategies', 'regional economies', 'read']",R,Oklahoma
2028,RepFrankLucas,Oklahoma s cattle ranchers have been hit hard by COVID 19 amp food supply chain disruptions I m proud to join Ranking Member and others in introducing the PRICE Act legislation providing solutions to ease the burdens felt by ranchers,0.25416666666666665,"['oklahoma', 's cattle ranchers', 'covid', 'amp food', 'chain disruptions', 'ranking member', 'price', 'act legislation']",R,Oklahoma
2029,RepFrankLucas,Lynda and I join millions across America in praying for and and all of those impacted by the coronavirus I hope my fellow Oklahomans join me in continuing to follow guidelines of washing your hands wearing a mask and practicing social distancing,0.03333333333333333,"['lynda', 'america', 'oklahomans']",R,Oklahoma
2030,TomColeOK04,Did you know that celebrated its 50th birthday over the weekend Very proud of OK04 s own unique partnership with the agency through located at NOAAat50 50YearsOfNOAA,0.58125,"['ok04', 'own unique partnership', 'noaaat50']",R,Oklahoma
2031,TomColeOK04,DEADLINE REMINDER OK04 middle amp high school students planning to enter must submit final apps no later than 11am CT on Monday October 19 Congress4CS More info amp submissions portal,0.132,"['deadline reminder ok04', 'middle amp high school students', 'final apps', 'ct', 'october', 'congress4cs', 'info amp submissions portal']",R,Oklahoma
2032,TomColeOK04,As discussions continue between Speaker Pelosi amp Secretary Mnuchin this week I remain hopeful for a breakthrough amp that a bipartisan deal can be reached on coronavirus relief one that both chambers of Congress can actually pass amp will sign,0.0,"['pelosi', 'amp secretary', 'mnuchin', 'breakthrough amp', 'coronavirus relief', 'congress']",R,Oklahoma
2033,TomColeOK04,There is no doubt that China is angling for greater power amp recognition in the world order making it even more urgent for the U S to take serious amp coordinated steps to counter its malign behavior Very encouraged by TaskForce s recommendations,0.21666666666666667,"['china', 'power amp recognition', 'world order making', 'serious amp', 'malign behavior', 'taskforce', 's recommendations']",R,Oklahoma
2034,TomColeOK04,My prayers are with President Donald Trump and First Lady Melania Trump as they quarantine and recover after testing positive for COVID 19 I have every confidence that they will beat this virus,0.23863636363636365,"['donald trump', 'melania trump', 'covid']",R,Oklahoma
2035,RepKendraHorn,TRIO Programs have a proven track record of building bridges for our most vulnerable students to overcome challenges in accessing amp successfully completing higher education This bill would expand access to counseling tutoring mentoring and tech to 330k students across America,0.25,"['trio programs', 'track record', 'vulnerable students', '330k students', 'america']",D,Oklahoma
2036,RepKendraHorn,I m proud to introduce the the bipartisan Coronavirus College Access and Completion Emergency Relief Act with amp to support TRIO programs including access to counseling tutoring mentoring and technology to help students enter and complete college,0.45,"['coronavirus', 'access', 'completion emergency relief', 'trio', 'complete college']",D,Oklahoma
2037,RepKendraHorn,And it s fully paid for To double the EITC my plan reverses 2018 tax cuts for individuals earning over 400k eliminates loopholes for big pharma companies and restores the tax rate for foreign subsidiaries Let s stop giving the biggest benefits to the wealthiest Americans,-0.041666666666666664,"['eitc', 'plan reverses', 'tax cuts', 'big pharma companies', 'tax rate', 'foreign subsidiaries']",D,Oklahoma
