,user,tweetText,simplePolarity,nouns,party,state
601,RepLaMalfa,The PPP saved 12 million jobs in rural America Speaker Pelosi has stalled for weeks to revive this tested and effective program As more businesses close their doors for good each day now is not the time to play politics with the approximately 135 billion in PPP reserves,0.27999999999999997,"['ppp', 'america', 'pelosi', 'effective program', 'ppp']",R,California
602,RepLaMalfa,All Evacuation Orders and Warnings have been lifted in Butte County Please use caution and follow local guidelines as you return to your homes,0.0,"['evacuation orders', 'warnings', 'butte', 'please', 'local guidelines']",R,California
603,RepLaMalfa,Praying that and have a safe and speedy recovery from COVID19,0.5,"['praying', 'speedy recovery', 'covid19']",R,California
604,RepLaMalfa, ButteCo Per the Town of Paradise Facebook page In conjunction with CAL FIRE the U S Forest Service and the Butte County Sh,0.0,"['butteco per', 'facebook', 'cal fire', 's forest service', 'butte', 'sh']",R,California
605,RepHuffman,Getting a flu shot is more important than ever to avoid overburdening hospitals and risking unnecessary emergency room exposure Get your flu shot today to keep yourself and those around you safe and healthy Find a nearby location,0.3,"['flu shot', 'unnecessary emergency room exposure', 'flu shot', 'find', 'nearby location']",D,California
606,RepHuffman,Just because ignores a problem doesn t make it go away Our forum looked at climate impacts to communities like the Gwich in in Alaska and my own in Northern CA We must ProtectTheArctic from reckless drilling,0.6,"['problem doesn t', 'climate impacts', 'gwich', 'alaska', 'ca', 'protectthearctic']",D,California
607,RepHuffman, Thank you and for continuing to champion efforts to protect the Arctic National Wildlife Refug,0.0,"['thank', 'champion efforts', 'arctic', 'wildlife refug']",D,California
608,RepHuffman,Reminder Chair called for a vote on a lifeline bill for the tens of thousands of airline workers being laid off House Republicans obstructed it Time and again House and Senate Republicans are blocking relief for the folks who need it most,0.5,"['reminder chair', 'lifeline bill', 'airline workers']",D,California
609,RepHuffman,Update The deadline to register for an Economic Impact Payment has been extended to Nov 21 If you don t normally file taxes you can learn more and register here,0.2833333333333333,"['update', 'impact payment', 'nov', 'don t', 'file taxes']",D,California
610,RepGaramendi,The President is holding our nation s health and economy hostage Citizens and small businesses across the country will suffer Trump s decision to end negotiations and focus on the approval of his nominee to the Supreme Court is entirely destructive dangerous and irresponsible,-0.48333333333333334,"['nation s health', 'economy hostage', 'small businesses', 'trump', 's decision', 'supreme court']",D,California
611,RepGaramendi,I m joining on at 3 pm PT 6 pm ET to discuss the President s health and more,0.5,"['pt', 'et', 'president s health']",D,California
612,RepGaramendi, THIS WEEKEND on insideCApolitics Joi,0.0,"['this weekend', 'joi']",D,California
613,RepGaramendi,Patti and I are wishing the President and First Lady a full and speedy recovery from COVID 19 and our prayers are with every person that has been afflicted by this virus Please wear a mask physical distance and stay safe,0.275,"['patti', 'speedy recovery', 'covid', 'please', 'physical distance']",D,California
614,RepGaramendi, ALERT Napa County sent an extreme fire danger message to evacuate its residents and it accidentally went to multiple cou,-0.0625,"['alert napa', 'extreme fire danger message', 'multiple cou']",D,California
615,RepMcClintock,Great discussion with CEO Morgan Gace during the virtual State of the County Tune in at the link below calaverascounty,0.8,"['great discussion', 'ceo morgan gace', 'virtual state', 'county tune']",R,California
616,RepMcClintock,The Copperopolis Post Office is officially open to serve the community at its new location 101 Town Square Road Copperopolis CA 95228,0.06818181818181818,"['copperopolis', 'post office', 'new location', 'town square road', 'copperopolis ca']",R,California
617,RepMcClintock, CreekFire Additional Evacuations News Release,0.0,"['creekfire additional evacuations', 'release']",R,California
618,RepMcClintock, Additional Evacuation orders issued at 7 00 am this morning for the CreekFire Fresno County has added two additional,0.0,"['additional evacuation', 'creekfire fresno']",R,California
619,RepMcClintock,I think COVID just made a big mistake taking on the President and First Lady Sending my best wishes and prayers to President and for a swift recovery,0.4166666666666667,"['covid', 'big mistake', 'sending', 'swift recovery']",R,California
620,RepThompson,Great to join the first meeting of my 2020 Student Leadership Council These local students have distinguished themselves in their community and joined my council to build their leadership skills and learn how to better serve our district Can t wait to see what they accomplish,0.3875,"['local students', 'leadership skills']",D,California
621,RepThompson,Tune in to watch today s Sonoma County Virtual Community Meeting live with me and other county officials on our recovery from the GlassFire,0.005681818181818177,"['sonoma', 'virtual', 'meeting', 'county officials', 'glassfire']",D,California
622,RepThompson,Watch live for a briefing from Napa County officials on the GlassFire,0.13636363636363635,"['watch', 'napa', 'county officials', 'glassfire']",D,California
623,RepThompson,The President needs to stop the political games and come back to the table so we can pass the HeroesAct and help our local governments,0.0,"['president needs', 'political games', 'heroesact', 'local governments']",D,California
624,RepThompson,Our state and local governments are on the tip of the spear responding to this crisis and without aid firefighters police officers teachers could lose their jobs and our community will suffer,0.0,"['local governments', 'aid firefighters police officers teachers']",D,California
625,DorisMatsui,I joined my colleagues to express our concerns over the proposed rule that sets arbitrary limitations on student visas If implemented the rule would undermine our leadership in higher education and put the careers of our international students at risk,0.049999999999999996,"['arbitrary limitations', 'student visas', 'international students']",D,California
626,DorisMatsui,The Administration has dragged their feet for months on coming to the aid of Americans amp the need for a decisive response from the federal government has only grown more severe We must continue to work to save jobs get resources to our communities amp keep our families healthy,0.3333333333333333,"['decisive response', 'federal government', 'communities amp', 'families healthy']",D,California
627,DorisMatsui,The President s announcement is unacceptable our American heroes should be given the resources they need to put money in their pockets and weather this crisis Working American families the unemployed and the most vulnerable cannot simply wait out for better days ahead,0.08333333333333333,"['president s announcement', 'american heroes', 'working', 'american families']",D,California
628,DorisMatsui,By instructing his representatives to walk away from coronavirus relief negotiations the President is showing that he is completely unwilling to embrace bipartisan solutions even if they save American lives and provide for the essential needs of the American people,0.025,"['coronavirus relief negotiations', 'bipartisan solutions', 'american lives', 'essential needs', 'american people']",D,California
629,DorisMatsui,The FCC s announcement to reinforce its decision to rollback netneutrality continues policies that could hinder the ability of Americans to access the online content they choose We must make sure the internet remains an open platform for free expression and innovation,0.3,"['fcc', 's announcement', 'rollback netneutrality', 'online content', 'open platform', 'free expression']",D,California
630,RepBera, Ballot drop boxes are in place and ready for your ballots You ll find them in many convenient places you already visit li,0.35,"['ballot', 'drop boxes', 'convenient places', 'visit li']",D,California
631,RepBera,Great to meet virtually with teachers from CA07 teachers are our everyday superheroes They are going extraordinary lengths to make sure our students receive a safe and high quality education I ll keep fighting to ensure they receive federal support,0.34888888888888886,"['ca07', 'everyday superheroes', 'extraordinary lengths', 'high quality education', 'federal support']",D,California
632,RepBera,Over 200 000 Americans have died from COVID19 millions are out of work and families are still being evicted from their homes Instead of leading our country towards a bipartisan relief deal the President has given up on the American people,0.0,"['covid19', 'bipartisan relief', 'american people']",D,California
633,RepBera, Thank you for hosting your 5th Annual Brain Health Forum We greatly appreciate your leadership on behalf o,0.8,"['thank', 'annual', 'brain health', 'forum', 'behalf o']",D,California
634,RepBera,Slow the spread Wear a mask,-0.30000000000000004,['wear'],D,California
635,RepPaulCook,I wish the and a swift recovery from COVID 19 The Coronavirus is a very real threat that our nation is still fighting to overcome We must all continue to do our part in keeping each other safe and healthy,0.28375,"['swift recovery', 'covid', 'coronavirus']",R,California
636,RepPaulCook,As the second female appointed to the Court and first Jewish woman Justice Ginsberg 87 served 27 years on the Supreme Court A trailblazer amp inspiration to many she loomed large and her contributions to our justice system will live on My condolences to her family and friends,0.1572356215213358,"['jewish woman justice', 'ginsberg', 'supreme court', 'trailblazer amp inspiration', 'justice system']",R,California
637,RepPaulCook,Much of the American West has experienced horrific wildfires this year That s why I cosponsored HR 7978 to protect our communities from the threat of wildfires I m hopeful Congress will act quickly to pass this bill so the President can sign it into law,0.06666666666666667,"['horrific wildfires', 'hr', 'congress']",R,California
638,RepPaulCook,This past week two deputies were ambushed while in their patrol car Please take a moment to read this alert If anyone has information on this please call 323 890 5500 My prayers are with them and their families,-0.25,"['past week', 'patrol car', 'please']",R,California
639,RepPaulCook,Today is LaborDay Thank you to all the workers who contribute to our communities every day especially during these uncertain times America s working families are the reason for our nation s strength and prosperity,0.0,"['laborday thank', 'uncertain times', 'america', 'nation s strength']",R,California
640,RepMcNerney, Today Republicans blocked the House from delivering urgent relief for tens of thousands of airline workers standing on,0.0,"['urgent relief', 'airline workers']",D,California
641,RepMcNerney,I m hosting a virtual information session for high school students interested in attending a military service academy on Wednesday October 7 2020 from 6 00 PM 8 00 PM PT Representatives from my office and various service academies will be available for questions,0.14200000000000002,"['virtual information session', 'high school students', 'military service academy', 'october', 'pm', 'pm pt', 'various service academies']",D,California
642,RepMcNerney,575 days That s how long it s been since the House passed HR8 the Bipartisan Background Checks Act and how long McConnell has ignored the bill Today as gun deaths continue to rise as our nation is sheltered in place we WearOrangeMasks to urge the Senate to take action,0.0,"['hr8', 'bipartisan background checks', 'mcconnell', 'gun deaths', 'wearorangemasks']",D,California
643,RepMcNerney,Participating in our democracy is critically important If you re not registered to vote NationalVoterRegistrationDay is a great day to do it Visit now to get registered,0.6000000000000001,"['nationalvoterregistrationday', 'great day', 'visit']",D,California
644,RepMcNerney,Today is NationalVoterRegistrationDay Registering to vote and updating your voter registration information are the first steps to being VoteReady in the upcoming election Register to vote at,0.25,"['nationalvoterregistrationday registering', 'voter registration information', 'voteready', 'election register']",D,California
645,RepJoshHarder,Folks we re moving in the right direction Let s keep it up social distance and be safe,0.273015873015873,"['folks', 'right direction', 'social distance']",D,California
646,RepJoshHarder,Thanks to for inviting me to come serve food last night for a special drive through National Night Out,0.18571428571428572,"['thanks', 'special drive', 'national night']",D,California
647,RepJoshHarder,This is SO cool congrats to Megan and Katie,0.35,"['so', 'cool congrats', 'megan', 'katie']",D,California
648,RepJoshHarder,Such a shame This can t be about political points It s about helping our small businesses our teachers and our families,-0.08333333333333333,"['political points', 'small businesses']",D,California
649,RepJoshHarder,Folks last week I voted to pass a new COVID relief bill that would send you another stimulus check and provide millions to keep our small businesses open and to safely reopen our schools But the Senate is still refusing to vote on it We need a deal now,0.07727272727272727,"['folks', 'covid', 'relief bill', 'stimulus check', 'small businesses']",D,California
650,RepDeSaulnier,I ve filled out the Census have you Why wait when much needed funding for our community is on the line Complete it at BeCounted,0.23333333333333336,"['census', 'complete', 'becounted']",D,California
651,RepDeSaulnier,Congrats to Jennifer Doudna of on winning the 2020 Nobel Prize in Chemistry GoBears,0.5,"['congrats', 'jennifer doudna', 'nobel', 'chemistry gobears']",D,California
652,RepDeSaulnier,put out a damning report on the world s four largest tech companies which highlights sweeping violations of antitrust laws and uncompetitive practices harmful to consumers It s time to BreakThemUp,0.0,"['world s', 'tech companies', 'antitrust laws', 'uncompetitive practices harmful', 's time', 'breakthemup']",D,California
653,RepDeSaulnier,ICYMI Chilling new details of the extent of the Trump Administration s cruel child separation policy that took even breastfeeding moms away from their infants,-0.4545454545454546,"['icymi chilling', 'new details', 'trump', 'administration s cruel child separation policy']",D,California
654,RepDeSaulnier,Important read from my friend and Bay Area colleague on amp Senate Republicans refusing to work with to address the worst public health amp economic crises of our lifetime,-0.09999999999999999,"['bay area colleague', 'amp senate', 'public health amp', 'economic crises']",D,California
655,SpeakerPelosi,President Trump has shown his true colors walking away from coronavirus relief negotiations and refusing to give real help to poor children the unemployed and America s hard working families,-0.035416666666666666,"['trump', 'true colors', 'coronavirus relief negotiations', 'real help', 'poor children', 'america']",D,California
656,SpeakerPelosi,We must ensure that Americans have access to the testing tracing and treatment that they need to make it through this crisis especially communities of color which have been so disproportionately affected by this pandemic MSNBCLive,0.0,['msnbclive'],D,California
657,SpeakerPelosi,We must crush this coronavirus and protect the Affordable Care Act to ensure Americans have access to the health care they need now more than ever FamiliesFirst,0.5,"['care', 'health care', 'familiesfirst']",D,California
658,SpeakerPelosi, As Americans confront the ongoing challenges brought on by the pandemic this week House Democrats passed another bill,0.0,['week house'],D,California
659,SpeakerPelosi,Chairman perfectly illustrates the community level impact of this health amp economic crisis We have a duty to deliver relief for our fellow Americans HeroesAct,0.6,"['community level impact', 'health amp', 'economic crisis', 'heroesact']",D,California
660,RepBarbaraLee,Wear a mask to protect yourself and keep your community safe,0.5,['wear'],D,California
661,RepBarbaraLee,Let s be clear white supremacy is a national security threat DHS called it the most persistent and lethal threat in the homeland We must condemn it in all forms to keep our country safe,0.275,"['clear white supremacy', 'national security threat', 'dhs', 'lethal threat']",D,California
662,RepBarbaraLee, The Congressional Black Caucus Statement on Letter to Secretary Mnuchin on Withheld Stimulus Payments to Incarcerated I,-0.16666666666666666,"['black caucus statement', 'letter', 'mnuchin', 'withheld stimulus payments', 'incarcerated']",D,California
663,RepBarbaraLee,Millions are suffering during this crisis Trump and the Senate GOP must stop the cruelty and pass the Heroes Act,0.0,"['millions', 'trump', 'senate gop', 'heroes']",D,California
664,RepBarbaraLee,Abortions are safe effective health care Don t let Trump a science and COVID denier tell you otherwise Listen to the medical professionals,0.3666666666666667,"['abortions', 'safe effective health care', 'don', 'trump', 'covid', 'listen', 'medical professionals']",D,California
665,RepSpeier,I m a practicing Catholic I don t think it has any relevance in the Supreme Court Pence never answered the question about Roe v Wade,0.0,"['don t', 'supreme court', 'pence', 'roe', 'wade']",D,California
666,RepSpeier,answer the question VP Pence,0.0,['vp pence'],D,California
667,RepSpeier,Why does he get 15 seconds 29 seconds 30 seconds Stop this,0.0,['stop'],D,California
668,RepSpeier,Stop letting Pence exceed his time We need to automatically turn off mica when time has expired,0.0,"['stop', 'pence']",D,California
669,RepSpeier,Pence just said they will follow the science Laughable More like science fiction,0.0,"['pence', 'science fiction']",D,California
670,RepSwalwell,Hey genius you run the government If there was a document that could prove your innocence you would produce it You can t Because there s nothing innocent about you,0.5,['hey'],D,California
671,RepSwalwell,Who wants to tell him,0.2,['who'],D,California
672,RepSwalwell,Here s the bottom line couldn t stop the virus from coming couldn t save Americans from dying and couldn t re start our recovery Like every President he was tested Unlike almost all he failed you,-0.5,"['bottom line couldn t', 'couldn t', 'couldn t re']",D,California
673,RepSwalwell,The President of the United States knowingly spread Covid Period We are living through a murderous presidency,0.0,"['covid period', 'murderous presidency']",D,California
674,RepSwalwell,Mr President this is excellent news I m so thrilled you will be able to witness democracy s roar on November 3 Vote,0.7000000000000001,"['mr', 'excellent news', 'democracy s roar', 'november', 'vote']",D,California
675,RepJimCosta,An historic moment for FCC and west Fresno paving the way for a more prosperous future for everyone who lives and works in this community,0.16666666666666666,"['historic moment', 'fcc', 'fresno', 'prosperous future']",D,California
676,RepJimCosta,Cuando no votamos la gente en poder piensa que no contamos Con nuestra comunidad bajo amenaza no podemos quedarnos en casa este Noviembre El poder del voto Latino transformar nuestro pa s a ser un pa s m s justo m s libre y m s seguro NuestroVotoNuestraVoz,0.0,"['cuando', 'poder piensa que', 'con', 'nuestra comunidad bajo amenaza', 'podemos quedarnos', 'casa este', 'noviembre el', 'poder del voto', 'latino', 'transformar nuestro pa s', 'ser un pa s m s justo m s libre y m s seguro', 'nuestrovotonuestravoz']",D,California
677,RepJimCosta,This HispanicHeritageMonth we celebrate the history of Latino activism and struggle There is no better way to honor that history than by ensuring we all vote OurVoteOurVoice,-0.25,"['hispanicheritagemonth', 'latino', 'ourvoteourvoice']",D,California
678,RepJimCosta,In January I introduced a resolution calling for the recognition of Coach Flores significant achievements in the sport and for his induction into the Pro Football Hall of Fame I cant think of no one more deserving,0.4916666666666667,"['january', 'flores', 'significant achievements', 'pro', 'football hall', 'fame']",D,California
679,RepJimCosta,Manufacturing is the backbone of America s economy This Manufacturing Day I want to thank the essential makers of this great nation and join them in raising awareness of the industry s need for future creators MFGDay20,0.26666666666666666,"['manufacturing', 'america', 's economy', 'manufacturing', 'essential makers', 'great nation', 'industry s need', 'future creators', 'mfgday20']",D,California
680,RepRoKhanna,There are more active COVID cases in the White House than in the entirety of Australia It did not have to be this way,0.12222222222222223,"['covid', 'white house', 'australia']",D,California
681,RepRoKhanna,This August 900 wildfires blazed across our state Millions struggled to breathe thousands fled their homes hundreds lost their livelihoods Join and I tomorrow at 2pm ET on IG Live to talk climate crisis environmental justice and the future of our country,0.06818181818181818,"['august', 'millions', 'breathe thousands', 'homes hundreds', 'join', 'et', 'ig live', 'climate crisis environmental justice']",D,California
682,RepRoKhanna,A safe workplace is never a luxury No employee should be forced to come to work where there is a known outbreak and no one should have to choose between their health and their paycheck We need monthly stimulus checks,0.09999999999999998,"['safe workplace', 'monthly stimulus checks']",D,California
683,RepRoKhanna,This government has absolutely let down our country,0.022222222222222213,[],D,California
684,RepRoKhanna,This pandemic isn t over 40 000 more Americans will become infected today Hundreds of thousands will file for unemployment this week Over 35 million won t be able to make rent next month,0.3333333333333333,"['pandemic isn t', 'hundreds']",D,California
685,RepAnnaEshoo,By walking away from the opportunity to help defeat COVID stabilize our economy and come to the aid of millions of Americans in great need President Trump has abandoned America My full statement,0.575,"['covid', 'great need president', 'trump', 'america', 'full statement']",D,California
686,RepAnnaEshoo,Tell FEMA if your address phone number changes If you have home damage you must have a FEMA inspection to be eligible for aid Staying in touch moves your application forward You can also keep in touch w FEMA by creating an account at or w FEMA app,0.0,"['fema', 'address phone number changes', 'home damage', 'fema', 'staying', 'touch w', 'fema', 'fema']",D,California
687,RepAnnaEshoo,Reminder from on czulightningcomplex fire recovery If you applied for Federal Disaster Aid due to wildfire related losses FEMA urges you to STAY IN TOUCH Update your file or get answers to questions by calling FEMA at 1 800 621 3362,-0.0625,"['reminder', 'czulightningcomplex fire recovery', 'disaster', 'fema', 'stay in touch update', 'fema']",D,California
688,RepAnnaEshoo, Thank you to Menlo teachers past and present on WorldTeachersDay for your dedication enthusiasm innovation and good hu,0.15,"['thank', 'menlo', 'teachers past', 'worldteachersday', 'dedication enthusiasm innovation', 'good hu']",D,California
689,RepAnnaEshoo, The deadline to apply for CZULightningComplex disaster assistance is Oct 21 Get started today,0.0,"['czulightningcomplex', 'disaster assistance', 'oct']",D,California
690,RepZoeLofgren,I hope the President amp First Lady have a swift amp complete recovery It s a reminder to everyone to wear a mask wash your hands social distance amp take COVID 19 seriously,0.012499999999999997,"['president amp', 'swift amp', 'complete recovery', 'social distance amp', 'covid']",D,California
691,RepZoeLofgren, Dems BREAKING and introduce the Judicial Ads Act legislation to combat dark money in judicia,-0.15,"['dems breaking', 'judicial ads', 'act legislation', 'dark money']",D,California
692,RepZoeLofgren, Dems Chairperson The Heroes Act 2 0 answers the calls of state and local election officials poll workers a,0.0,"['dems chairperson', 'heroes', 'local election officials poll workers']",D,California
693,RepZoeLofgren, Dems It s NationalVoterRegistrationDay Today we raise awareness about the importance of registering to vote in deciding th,0.0,"['dems', 'nationalvoterregistrationday']",D,California
694,RepZoeLofgren,Justice Ruth Bader Ginsburg was a personal hero to many women myself included She defended equality freedom amp justice until the end I never could have broken any glass ceilings without her paving the way I am heartbroken amp forever grateful RestInPower,0.033333333333333326,"['ruth bader ginsburg', 'personal hero', 'equality freedom amp justice', 'glass ceilings', 'heartbroken amp', 'restinpower']",D,California
695,RepJimmyPanetta,As we experience an unprecedented fire year please do your part to prevent wildfires by practicing fire safety and taking steps to protect your home FirePreventionWeek,0.6,"['unprecedented fire year', 'fire safety', 'firepreventionweek']",D,California
696,RepJimmyPanetta,To learn more about the recovery process please visit if you are in Santa Cruz County or if you are in Monterey County,0.5,"['recovery process', 'santa cruz', 'monterey']",D,California
