,user,tweetText,simplePolarity,nouns,party,state
1224,RodneyDavis,Stopped by yesterday in Decatur to meet the new president Dr James Reynolds President Reynolds received his Ph D in Biology from another institution I have the honor to represent Best of luck to him in his new role,0.42424242424242414,"['stopped', 'decatur', 'new president', 'dr james reynolds', 'reynolds', 'ph d', 'biology', 'new role']",R,Illinois
1225,RepUnderwood,As Chairwoman of the Subcommittee on Cybersecurity Infrastructure Protection and Innovation I m calling on Facebook Twitter and YouTube to take immediate actions to prevent efforts of voter suppression interference and disinformation,0.0,"['chairwoman', 'subcommittee', 'cybersecurity infrastructure protection', 'innovation', 'facebook twitter', 'youtube', 'immediate actions', 'voter suppression interference']",D,Illinois
1226,RepUnderwood,In 2016 social media platforms were used by foreign adversaries to attempt to silence Black voters and sow racial division Four years later election related disinformation targeting Black voters remains a growing threat,-0.07083333333333332,"['social media platforms', 'foreign adversaries', 'black', 'racial division', 'black']",D,Illinois
1227,RepUnderwood,A new report found that insulin prices in the U S are 5 to10 times higher than in other countries My Chronic Condition Copay Elimination Act would eliminate out of pocket costs for insulin and other life saving medications,0.03409090909090909,"['new report', 'insulin prices', 'to10 times', 'chronic condition copay elimination', 'pocket costs']",D,Illinois
1228,RepUnderwood, COVID 19 is still present in Illinois Protect yourself your family and your community Wear a face covering to prevent the spr,0.0,"['covid', 'illinois protect', 'wear']",D,Illinois
1229,RepUnderwood,That s why I supported the Heroes Act to provide urgently needed resources to states to do just that,0.0,['heroes'],D,Illinois
1230,RepShimkus,Today will be my last day posting to this account You can still follow my personal updates including the verse I share each morning from my devotion on other social media platforms Thank you to all those who have followed and engaged with me here on Twitter for many years,0.08166666666666667,"['personal updates', 'social media platforms', 'thank', 'twitter']",R,Illinois
1231,RepShimkus,What questions do you have for Facebook,0.0,['facebook'],R,Illinois
1232,RepShimkus,Psalm 3 3 4 But You O Lord are a shield about me I was crying to the Lord with my voice And He answered me from His holy mountain,-0.2,"['psalm', 'o lord']",R,Illinois
1233,RepShimkus,,0.0,[],R,Illinois
1234,RepShimkus,Last week I had the opportunity to meet with RSVP volunteers who serve Champaign and Douglas counties Today we recognize them and all those who participate in national service NationalServiceWorks,0.0,"['rsvp', 'champaign', 'douglas', 'national service', 'nationalserviceworks']",R,Illinois
1235,RepKinzinger,Just because we re approaching November doesn t mean we have to stop legislating by consensus building We need to get serious about good faith negotiating in Congress amp we need to get serious about energy independence amp reducing emissions NuclearMatters,-0.055833333333333325,"['november', 'doesn t', 'consensus building', 'good faith', 'congress', 'energy independence amp', 'nuclearmatters']",R,Illinois
1236,RepKinzinger,As the son of a retired elementary teacher I know how important a good education is for shaping the next generation Today we celebrate the incredible teachers in IL16 amp around the world who work tirelessly to help give hope amp opportunity to our students WorldTeachersDay,0.45999999999999996,"['elementary teacher', 'good education', 'incredible teachers', 'il16', 'hope amp opportunity', 'worldteachersday']",R,Illinois
1237,RepKinzinger, HN Kinzinger task force unveil report on threats from Chinese government,0.0,"['hn kinzinger', 'task force unveil report', 'chinese government']",R,Illinois
1238,RepKinzinger,A true servant leader and strong advocate for the Rockford community Sending my prayers and condolences to the McNamara family,0.3916666666666666,"['true servant leader', 'strong advocate', 'rockford', 'sending', 'mcnamara']",R,Illinois
1239,RepKinzinger,Manufacturing creates thousands of jobs amp spurs strong economic growth here in Illinois amp across the country I m proud to represent this hardworking industry here in IL16 amp remain committed to supporting them as we restore rebuild amp renew America MFGDay2020,0.42083333333333334,"['manufacturing', 'creates thousands', 'jobs amp spurs', 'strong economic growth', 'illinois', 'il16', 'america mfgday2020']",R,Illinois
1240,RepCheri,Registering online takes only a few minutes Visit to get started VoterRegistration,-0.1,"['registering', 'visit', 'voterregistration']",D,Illinois
1241,RepCheri,The President s decision today discards the sacrifices made by millions of Americans over the past eight months and throws any hard fought progress toward recovery out the window The American people deserve a leader who will show up not give up,-0.18055555555555558,"['president s decision', 'american people deserve']",D,Illinois
1242,RepCheri,What we do now impacts the health of our people and the health of our nation The President should join House Democrats and pass much needed relief 3 3,0.2,[],D,Illinois
1243,RepCheri,Refusing to negotiate in good faith is refusing to take action to heal a country in pain We must persist for those who we have lost those who are sick those unemployed and those struggling to feed their families 2 3,0.028571428571428543,"['refusing', 'good faith']",D,Illinois
1244,RepCheri,I m grateful President Trump received the highest quality medical care amp treatment after his COVID 19 diagnosis The millions of Americans who have tested positive for COVID and hundreds of thousands who have died deserve an effort from him worthy of their loss and sacrifice,0.18686868686868685,"['grateful president', 'trump', 'medical care amp treatment', 'covid', 'covid']",D,Illinois
1245,RepLaHood,Thank you to for the decades of service to our nation both in Congress and in the Army Congressman Shimkus set the gold standard for Illinois legislators The people of Illinois are better off because of his service and I want to wish him well in retirement,0.25,"['thank', 'congress', 'army congressman', 'shimkus', 'gold standard', 'illinois', 'illinois']",R,Illinois
1246,RepLaHood, In an effort led by and co sponsored by and the House Foreign Af,-0.125,['af'],R,Illinois
1247,RepLaHood,I am grateful to the Peoria Area Food Bank for their support for those in need particularly during these difficult times Thanks to PCCEO President amp CEO McFarland A Bragg II Robin Gathers amp Wayne Cannon for welcoming me amp discussing some of their initiatives,-0.04444444444444445,"['peoria', 'difficult times', 'thanks', 'pcceo', 'president amp', 'ceo mcfarland', 'bragg ii robin gathers', 'wayne cannon']",R,Illinois
1248,RepLaHood, is proud to honor and with its inaugural Champion of Value,0.8,"['inaugural champion', 'value']",R,Illinois
1249,RepLaHood,I met with local Lebanese community leaders in Peoria today to discuss the American aid efforts in Lebanon after the tragic blast in August I am grateful for our strong Lebanese community with over 7 000 families of Lebanese descent in the Greater Peoria area,0.03666666666666666,"['lebanese', 'community leaders', 'peoria', 'american aid efforts', 'lebanon', 'tragic blast', 'august', 'lebanese', 'lebanese', 'peoria']",R,Illinois
1250,RepVisclosky,Any time any of us see an act of intolerance for whatever reason it could be religious race sex we have got to put our foot down and say No more,-0.13518518518518519,['religious race sex'],D,Indiana
1251,RepVisclosky,Thank you to everyone who attended one of my 2020 Town Forums I will continue to work as hard as I can throughout this year to grow the Northwest Indiana economy create more good paying job opportunities and improve our quality of place,0.30277777777777776,"['thank', 'forums', 'indiana', 'job opportunities']",D,Indiana
1252,RepVisclosky,Honored to attend the Gary Frontiers MLKDay celebration this weekend We must all be part of the discussion to promote equality and speak out when we perceive acts of intolerance As Dr King stated Our lives begin to end the day we become silent about things that matter,0.0,"['honored', 'gary frontiers mlkday', 'perceive acts', 'dr']",D,Indiana
1253,RepVisclosky,Reminder Town Forums are occurring this Friday and Saturday Click below to find a Town Forum near you,0.1,"['reminder', 'forums', 'click', 'forum']",D,Indiana
1254,RepVisclosky,I am looking forward to the 2020 Town Forums and hearing directly from residents about their issues of concern and how I can best serve and represent their interests this coming year Click below for the complete schedule,0.4000000000000001,"['forums', 'click', 'complete schedule']",D,Indiana
1255,RepWalorski,STARTING SOON My office will be going LIVE on Facebook and on Zoom in one hour to provide information about Medicare and answer your questions This year s FREE Medicare 101 starts at 1pm ET and more details can be found at,0.2590909090909091,"['starting soon', 'live', 'facebook', 'zoom', 'medicare', 'year s', 'free medicare', 'et']",R,Indiana
1256,RepWalorski,The coronavirus crisis has impacted every American but it hasn t changed what we re fighting for That s why I ve made a commitment to renew the American Dream and secure better opportunities for every generation Visit CommitmenttoAmerica,0.225,"['coronavirus crisis', 'hasn t', 'dream', 'visit commitmenttoamerica']",R,Indiana
1257,RepWalorski,If you want to learn more about Medicare don t forget to join us online for a free informational session tomorrow On Tuesday October 6th at 1pm ET my office will be hosting virtual Medicare 101 on Zoom and Facebook Get the details at,0.45,"['medicare', 'don t', 'free informational session', 'october', 'et', 'medicare', 'zoom', 'facebook']",R,Indiana
1258,RepWalorski,REMINDER Tomorrow October 6th 1pm ET my office is hosting a free virtual event to explain the basics of Medicare and answer your questions ahead of the enrollment period which begins 10 15 Find out how to join us on Zoom and Facebook at,0.4,"['reminder tomorrow october', 'et', 'free virtual event', 'medicare', 'enrollment period', 'find', 'zoom', 'facebook']",R,Indiana
1259,RepWalorski,On Tue Oct 6th 1pm ET Medicare experts will be available to you They ll share knowledge answer questions and help you understand what you need to know about Medicare Join us on Zoom and Facebook for a free Medicare 101 informational session,0.4,"['tue oct', 'et medicare', 'll share knowledge', 'medicare join', 'zoom', 'facebook', 'medicare', 'informational session']",R,Indiana
1260,RepJimBanks,Received the NAHB Defender of Housing Award for this Congress Interacted with local business leaders at a roundtable Rode in a combine with Roger Hadley Allen County Farm Bureau President Still more to do,0.25,"['received', 'nahb defender', 'housing award', 'congress interacted', 'local business leaders', 'rode', 'roger hadley allen', 'county farm bureau president']",R,Indiana
1261,RepJimBanks,Defund Planned Parenthood,0.0,['defund planned parenthood'],R,Indiana
1262,RepJimBanks,Packing the Supreme Court is the greatest threat to our democracy that I can imagine,1.0,"['packing', 'supreme court']",R,Indiana
1263,RepJimBanks,Qassem Soleimani was responsible for the death of hundreds of American troops in Iraq amp elsewhere I m glad authorized the strike that killed Soleimani America amp the world is safer for it How Democrats like Biden and Harris could oppose this is unfathomable,0.12499999999999999,"['qassem soleimani', 'american troops', 'iraq', 'soleimani america', 'biden', 'harris']",R,Indiana
1264,RepJimBanks, Pence China is to blame for the coronavirus Fact check True,0.35,"['pence china', 'fact', 'true']",R,Indiana
1265,RepJimBaird,In today s constantly connected global economy adding 300 people in rural Indiana to the network is a huge feat For rural communities it means completing that challenging last mile This connectivity means a whole new world of opportunity,0.13737373737373737,"['global economy', 'indiana', 'huge feat', 'rural communities', 'whole new world']",R,Indiana
1266,RepJimBaird,It s time for Congress to help renew the American Dream to it s citizens House Republicans Commitment to America agenda does this,0.0,"['s time', 'congress', 'dream', 's citizens house', 'commitment', 'america']",R,Indiana
1267,RepJimBaird,Last week I had the privilege of honoring West Lafayette police officer Brian Danosky on the House floor He went above the call of duty and saved a young man s life,0.03333333333333333,"['lafayette', 'police officer', 'brian danosky', 'house floor', 'young man s life']",R,Indiana
1268,RepJimBaird,Staff will be hosting mobile office hours across the district in the next few weeks If you need assistance I encourage you to call and schedule an appointment,-0.1,"['staff', 'mobile office hours']",R,Indiana
1269,RepJimBaird,The Farmers to Families Food Box Program distributed more than 100 million food boxes to families in need due to COVID 19 Many thanks to the many farmers participating in this program,0.315,"['families', 'program', 'food boxes', 'covid']",R,Indiana
1270,SusanWBrooks, The justice gap is real and the pandemic unfortunately is going to make it even greater warns Indiana Rep,0.06666666666666667,"['justice gap', 'indiana rep']",R,Indiana
1271,SusanWBrooks,Wishing a safe and healthy recovery for my dear friend,0.5,"['wishing', 'healthy recovery', 'dear friend']",R,Indiana
1272,SusanWBrooks,ICYMI Yesterday the House passed an Olympic sports oversight package Rep Susan Brooks R Ind was among the leaders of the effort which really first got under way after the Indianapolis Star broke open the scandal of abuse by USA Gymnastics,0.125,"['icymi yesterday', 'olympic sports oversight package', 'rep susan brooks r ind', 'indianapolis', 'usa gymnastics']",R,Indiana
1273,SusanWBrooks,Prayers for a swift safe and full recovery for and,0.425,"['prayers', 'full recovery']",R,Indiana
1274,SusanWBrooks,October marks BreastCancerAwarenessMonth 1 in 8 women in the U S will develop breast cancer in their lifetime Earlier this week the House passed my bipartisan bill which promotes breast cancer education amp regular breast cancer screenings gt gt,0.0,"['october', 'breastcancerawarenessmonth', 'breast cancer', 'bipartisan bill', 'promotes breast cancer education amp', 'regular breast cancer screenings gt gt']",R,Indiana
1275,RepGregPence,Pence will do a fantastic job against left wing Kamala Harris tonight at the VPdebate He understands the American People treasure our Constitutional rights our front line police and tax cuts for all Americans and are the team for THE PEOPLE,0.13333333333333333,"['pence', 'fantastic job', 'kamala harris', 'vpdebate', 'american people treasure', 'constitutional', 'front line police', 'tax cuts', 'the people']",R,Indiana
1276,RepGregPence, One party wants to restore rebuild and renew the American Dream writes The other party wants to defund,0.06875,['dream'],R,Indiana
1277,RepGregPence,We have two paths before us Republican law amp order economic growth boundless patriotism or Democrat rioting in streets defunding frontline police bankrupting middle class w socialism Read my CommitmentToAmerica oped,0.0,"['republican', 'law amp order', 'economic growth boundless patriotism', 'democrat', 'frontline police', 'middle class w socialism', 'read', 'commitmenttoamerica']",R,Indiana
1278,RepGregPence,Happy to hear President is leaving Walter Reed Medical Center and is returning to the The man is a fighter I continue to pray he and recover fully and feel better than ever,0.30000000000000004,"['walter reed', 'medical center']",R,Indiana
1279,RepGregPence,Was proud to stand with my colleagues in the Indiana Delegation last night in support of fellow Hoosier Judge Amy Coney Barrett Judge Barrett is exceptionally qualified and is a brilliant nominee for Supreme Court Justice by President,0.5916666666666667,"['was', 'indiana delegation', 'hoosier', 'amy coney barrett', 'barrett', 'brilliant nominee', 'supreme court justice']",R,Indiana
1280,RepAndreCarson,Read more,0.5,['read'],D,Indiana
1281,RepAndreCarson,Access to healthy amp affordable food should be a right not a luxury Unfortunately many neighborhoods known as food deserts lack this necessity That s why I have reintroduced the Food Deserts Act to help facilitate more locally owned grocery stores in these communities,0.3571428571428571,"['access', 'healthy amp', 'affordable food', 'deserts', 'grocery stores']",D,Indiana
1282,RepAndreCarson,Happy WorldTeachersDay Teachers always go above and beyond but they really outdid themselves this year Today and every day we thank them for their dedication their knowledge and their passion for teaching no matter the circumstances,0.3333333333333333,['worldteachersday'],D,Indiana
1283,RepAndreCarson,Pres Trump claims that Americans shouldn t live in fear of COVID19 What he doesn t realize is that taking steps to protect ourselves amp loved ones from the virus isn t cowardly It s smart The only thing we rightfully fear is his disastrous response to this pandemic,0.07012987012987013,"['pres trump', 'shouldn t', 'covid19', 'doesn t', 'virus isn t', 's smart', 'disastrous response']",D,Indiana
1284,RepAndreCarson, Finch The White House has access to the best testing the best physicians Ronny Jackson notwithstanding the best scientists a,0.75,"['finch', 'white house', 'ronny jackson']",D,Indiana
1285,RepLarryBucshon, Nancy Pelosi calls confronting China a diversion She calls Middle East peace deals a distraction She calls Republicans,0.0,"['nancy pelosi', 'china', 'peace deals']",R,Indiana
1286,RepLarryBucshon,,0.0,[],R,Indiana
1287,RepLarryBucshon,,0.0,[],R,Indiana
1288,RepLarryBucshon,,0.0,[],R,Indiana
1289,RepLarryBucshon,,0.0,[],R,Indiana
1290,RepTrey,By the numbers our Hoosier manufacturers Employ almost 20 of Indiana s workforce Account for almost 30 of Indiana s economic output Export 21 6 billion to free trade partners around the globe MFGDay20,0.30000000000000004,"['hoosier', 'employ', 'indiana', 's workforce', 'account', 'indiana', 'economic output', 'export', 'free trade partners', 'mfgday20']",R,Indiana
1291,RepTrey,Today is NationalManufacturingDay a day to recognize the ingenuity and perseverance of American manufacturing and all it contributes to our country and economy MFGDay20,0.0,"['nationalmanufacturingday', 'mfgday20']",R,Indiana
1292,RepTrey,At a farm roundtable in Washington County a farmer shared his stories of costly black vulture attacks and his inability to protect his livestock because of the federal bureaucracy We turned this into meaningful action for farmers across the country,0.14444444444444446,"['washington', 'costly black vulture attacks', 'federal bureaucracy', 'meaningful action']",R,Indiana
1293,RepTrey,Passed the House the Livestock Protection Act which would fix the federal bureaucracy and allow Hoosiers to protect their livestock from predatory black vultures has passed the House and the Senate soon to be signed by the President,-0.16666666666666666,"['passed', 'livestock protection', 'federal bureaucracy', 'hoosiers', 'black vultures']",R,Indiana
1294,RepTrey,My statement on why I voted yes to table H Res 1148 a resolution on statues in the U S Capitol that doesn t help American families and businesses move forward and bounce back from this pandemic,0.0,"['h res', 's capitol', 'doesn t', 'american families']",R,Indiana
1295,RepDavids,People are counting on us for bipartisan leadership But no matter what the President says I will keep doing everything that I can to get this virus under control to save lives and to save our economy,0.0,['bipartisan leadership'],D,Kansas
1296,RepDavids,Kansans have been waiting for months for desperately needed relief But today the President has said he now will no longer participate in bipartisan negotiations on a coronavirus relief bill This is completely unacceptable,-0.25,"['kansans', 'bipartisan negotiations', 'coronavirus relief bill']",D,Kansas
1297,RepDavids,I m glad to have helped secure 3 75 million in federal funds to help boost testing for the coronavirus in KS University of KS Med Center will use these funds to increase testing amp contract tracing of coronavirus cases in our most vulnerable communities,0.16,"['federal funds', 'ks', 'ks med', 'amp contract', 'coronavirus cases', 'vulnerable communities']",D,Kansas
1298,RepDavids,The coronavirus remains a serious threat to our health and economy Please do your part wear a mask practice social distancing and wash your hands We all have to work together to save lives and livelihoods,-0.15,"['serious threat', 'please', 'mask practice']",D,Kansas
1299,RepDavids,Our team has made several updates to our Coronavirus Resource Center to help Kansas families Find out more about testing in our area help with finding a new job financial aid help for small businesses and more We re here to serve you however we can,0.11233766233766233,"['coronavirus resource', 'kansas', 'find', 'new job', 'financial aid', 'small businesses']",D,Kansas
1300,RepRonEstes,I recently introduced a bipartisan resolution to condemn the Digital Services Taxes imposed on American tech companies by foreign governments Both parties need to stand up to discriminatory practices that harm American workers and consumers,-0.025,"['bipartisan resolution', 'digital', 'taxes', 'american tech companies', 'foreign governments', 'parties need', 'discriminatory practices', 'american workers']",R,Kansas
1301,RepRonEstes, Republicans the and want to restart restore and regrow our economy We ve done it before throu,0.0,['restart restore'],R,Kansas
1302,RepRonEstes,A heartfelt message from the President We are still praying for a full recovery and are grateful for the many doctors and nurses across the country caring for those infected,0.2833333333333333,"['heartfelt message', 'full recovery']",R,Kansas
1303,RepRonEstes,Sept 15 through Oct 15 is Hispanic Heritage Month Today we highlight Carlos Mayans born in Havana Cuba who served as mayor of Wichita Read more on my Facebook page,0.5,"['sept', 'oct', 'hispanic', 'month', 'carlos mayans', 'havana cuba', 'wichita read', 'facebook']",R,Kansas
1304,RepRonEstes,Today is the 50th anniversary of the tragic plane crash that took the lives of 31 Wichita State football players coaches and supporters We remember the young lives lost and continue to pray for healing for their families and our community,-0.325,"['tragic plane crash', 'wichita', 'state football players coaches', 'young lives']",R,Kansas
1305,RepGuthrie, NEW Chair amp introduce bicameral,0.13636363636363635,"['new chair', 'amp introduce']",R,Kentucky
1306,RepGuthrie,I m praying for President and and wishing them a speedy recovery from the coronavirus This news is a reminder that this virus can impact anyone Please continue to stay safe,0.5,"['speedy recovery', 'please']",R,Kentucky
1307,RepGuthrie,This week I introduced the Strengthening Our Youth Apprenticeships Act to help create apprenticeship programs for students Read more about my bipartisan bill with Rep and,0.5,"['strengthening', 'apprenticeships', 'apprenticeship programs', 'read', 'bipartisan bill', 'rep']",R,Kentucky
1308,RepGuthrie,I am confident that any COVID 19 vaccine that is approved by the FDA will be safe and effective and the experts who testified at our hearing today agree Read more about our hearing on vaccines,0.525,"['covid', 'fda', 'read']",R,Kentucky
1309,RepGuthrie,The House also passed the AI for Consumer Product Safety Act which included my legislation with and Rep the Blockchain Innovation Act,0.0,"['ai', 'product safety', 'rep', 'blockchain innovation']",R,Kentucky
1310,RepJohnYarmuth, Americans need to be able to feed their families amp make ends meet but that means nothing to President Trump amp Republ,0.5,"['families amp', 'trump', 'republ']",D,Kentucky
1311,RepJohnYarmuth,The only reason Mitch is rushing your SCOTUS nomination is because he thinks you are going to lose,0.0,"['mitch', 'scotus']",D,Kentucky
1312,RepJohnYarmuth,In normal times the party opposite the President might balk at giving him a major win before the election These are not normal times you can deliver the help the American people desperately need Don t listen to Mitch Take the win,0.14218750000000002,"['normal times', 'normal times', 'american people', 'don', 'mitch']",D,Kentucky
1313,RepJohnYarmuth,President Trump and Mitch McConnell have now officially killed negotiations on a deal to provide relief for the American people No 1200 checks No 600 unemployment benefit No funding for city amp state governments to save jobs No relief to small businesses No leadership,-0.15,"['trump', 'mitch mcconnell', 'american people', 'unemployment benefit', 'city amp state governments', 'small businesses']",D,Kentucky
1314,RepJohnYarmuth,Kynect is back Thrilled to see relaunch and reimagine our Commonwealth s comprehensive portal to provide Kentuckians with health coverage benefits and community based resources Go to today,0.3,"['kynect', 'thrilled', 'commonwealth', 'comprehensive portal', 'kentuckians', 'health coverage benefits']",D,Kentucky
1315,RepThomasMassie,I love the folks on twitter who don t realize this platform is a raging dumpster fire,0.5,"['don t', 'dumpster fire']",R,Kentucky
1316,RepThomasMassie,I m just going to leave this right here,0.2857142857142857,[],R,Kentucky
1317,RepThomasMassie,Forgive him for this tweet He s intoxicated with power,0.0,['forgive'],R,Kentucky
1318,RepThomasMassie, Constantly surprised at how many intelligent healthy people I meet who are living in fear of Covid I show them the ac,0.475,"['constantly', 'intelligent healthy people', 'covid']",R,Kentucky
